

-------------- 09/04/18 09:44:37 --------------


GitHub Server:

[daily-email 2309c59] 09/04/18 09:44:37: Git Backup
 1 file changed, 7 insertions(+)
 create mode 100644 git.log
Tue Sep 4 09:44:39 EDT 2018
To https://github.com/CareyLabVT/SCCData.git
 + 34f3751...2309c59 daily-email -> daily-email (forced update)


UF Server (Bruno):

On branch daily-email-uf
Your branch is up-to-date with 'origin/daily-email-uf'.
nothing to commit, working directory clean
Tue Sep 4 09:44:44 EDT 2018
Everything up-to-date


Push the Logs to GitHub:

[daily-email a48c0bf] 09/04/18 09:44:37: Logs
 1 file changed, 19 insertions(+)
Tue Sep 4 09:45:11 EDT 2018
To https://github.com/CareyLabVT/SCCData.git
   2309c59..a48c0bf  daily-email -> daily-email
[daily-email 1fd1beb] 09/04/18 09:44:37: Logs
 1 file changed, 5 insertions(+)
Tue Sep 4 09:45:15 EDT 2018
To https://github.com/CareyLabVT/SCCData.git
   a48c0bf..1fd1beb  daily-email -> daily-email


-------------- 09/05/18 08:03:03 --------------


GitHub Server:

[daily-email d59a207] 09/05/18 08:03:03: Git Backup
 3 files changed, 12 insertions(+)
 create mode 100644 CatwalkDataFigures_2018-09-05.pdf
 create mode 100644 MetDataFigures_2018-09-05.pdf
Wed Sep 5 08:03:03 EDT 2018
To https://github.com/CareyLabVT/SCCData.git
   1fd1beb..d59a207  daily-email -> daily-email


Push the Logs to GitHub:

[daily-email 41dfdf8] 09/05/18 08:03:03: Logs
 1 file changed, 11 insertions(+)
Wed Sep 5 08:03:08 EDT 2018
To https://github.com/CareyLabVT/SCCData.git
   d59a207..41dfdf8  daily-email -> daily-email
[daily-email 3452bb9] 09/05/18 08:03:03: Logs
 1 file changed, 5 insertions(+)
Wed Sep 5 08:03:12 EDT 2018
To https://github.com/CareyLabVT/SCCData.git
   41dfdf8..3452bb9  daily-email -> daily-email


-------------- 09/05/18 08:10:58 --------------
*mimetypes-load-control*: can't open or load "~/.mime.types"
Resolving host "smtp.gmail.com:587" ... done
Connecting to "108.177.122.108:587" ...connected.
 Certificate depth 2 
  subject = /OU=GlobalSign Root CA - R2/O=GlobalSign/CN=GlobalSign
  notBefore = Dec 15 08:00:00 2006 GMT
  notAfter = Dec 15 08:00:00 2021 GMT
  issuer = /OU=GlobalSign Root CA - R2/O=GlobalSign/CN=GlobalSign
 Certificate depth 1 
  subject = /C=US/O=Google Trust Services/CN=Google Internet Authority G3
  notBefore = Jun 15 00:00:42 2017 GMT
  notAfter = Dec 15 00:00:42 2021 GMT
  issuer = /OU=GlobalSign Root CA - R2/O=GlobalSign/CN=GlobalSign
 Certificate depth 0 
  subject = /C=US/ST=California/L=Mountain View/O=Google LLC/CN=smtp.gmail.com
  notBefore = Aug 14 07:39:50 2018 GMT
  notAfter = Oct 23 07:37:00 2018 GMT
  issuer = /C=US/O=Google Trust Services/CN=Google Internet Authority G3
Comparing subject_alt_name: need<smtp.gmail.com> is<smtp.gmail.com>


-------------- 09/05/18 08:11:06 --------------


GitHub Server:

[daily-email c724e35] 09/05/18 08:11:06: Git Backup
 1 file changed, 34 insertions(+)
Wed Sep 5 08:11:06 EDT 2018
To https://github.com/CareyLabVT/SCCData.git
   3452bb9..c724e35  daily-email -> daily-email


Push the Logs to GitHub:

[daily-email 637472c] 09/05/18 08:11:06: Logs
 1 file changed, 9 insertions(+)
Wed Sep 5 08:11:10 EDT 2018
To https://github.com/CareyLabVT/SCCData.git
   c724e35..637472c  daily-email -> daily-email
[daily-email 303b593] 09/05/18 08:11:06: Logs
 1 file changed, 5 insertions(+)
Wed Sep 5 08:11:13 EDT 2018
To https://github.com/CareyLabVT/SCCData.git
   637472c..303b593  daily-email -> daily-email


-------------- 09/05/18 08:19:32 --------------


Email Service:

*mimetypes-load-control*: can't open or load "~/.mime.types"
Resolving host "smtp.gmail.com:587" ... done
Connecting to "64.233.185.109:587" ...connected.
 Certificate depth 2 
  subject = /OU=GlobalSign Root CA - R2/O=GlobalSign/CN=GlobalSign
  notBefore = Dec 15 08:00:00 2006 GMT
  notAfter = Dec 15 08:00:00 2021 GMT
  issuer = /OU=GlobalSign Root CA - R2/O=GlobalSign/CN=GlobalSign
 Certificate depth 1 
  subject = /C=US/O=Google Trust Services/CN=Google Internet Authority G3
  notBefore = Jun 15 00:00:42 2017 GMT
  notAfter = Dec 15 00:00:42 2021 GMT
  issuer = /OU=GlobalSign Root CA - R2/O=GlobalSign/CN=GlobalSign
 Certificate depth 0 
  subject = /C=US/ST=California/L=Mountain View/O=Google LLC/CN=smtp.gmail.com
  notBefore = Aug 21 08:05:00 2018 GMT
  notAfter = Nov 13 08:05:00 2018 GMT
  issuer = /C=US/O=Google Trust Services/CN=Google Internet Authority G3
Comparing subject_alt_name: need<smtp.gmail.com> is<smtp.gmail.com>


-------------- 09/05/18 08:30:39 --------------


Email Service:

*mimetypes-load-control*: can't open or load "~/.mime.types"
-s: No such file or directory


-------------- 09/05/18 08:31:56 --------------


Email Service:

*mimetypes-load-control*: can't open or load "~/.mime.types"
-s: No such file or directory


-------------- 09/05/18 08:33:21 --------------


Email Service:

*mimetypes-load-control*: can't open or load "~/.mime.types"
-s: No such file or directory


-------------- 09/05/18 08:35:45 --------------


Email Service:

*mimetypes-load-control*: can't open or load "~/.mime.types"
RANDOM_COMIC: No such file or directory


-------------- 09/05/18 08:37:24 --------------


Email Service:

*mimetypes-load-control*: can't open or load "~/.mime.types"
-s: No such file or directory


-------------- 09/05/18 08:46:07 --------------


Email Service:

*mimetypes-load-control*: can't open or load "~/.mime.types"
-s: No such file or directory


-------------- 09/05/18 08:46:51 --------------


Email Service:

*mimetypes-load-control*: can't open or load "~/.mime.types"
Resolving host "smtp.gmail.com:587" ... done
Connecting to "74.125.138.108:587" ...connected.
 Certificate depth 2 
  subject = /OU=GlobalSign Root CA - R2/O=GlobalSign/CN=GlobalSign
  notBefore = Dec 15 08:00:00 2006 GMT
  notAfter = Dec 15 08:00:00 2021 GMT
  issuer = /OU=GlobalSign Root CA - R2/O=GlobalSign/CN=GlobalSign
 Certificate depth 1 
  subject = /C=US/O=Google Trust Services/CN=Google Internet Authority G3
  notBefore = Jun 15 00:00:42 2017 GMT
  notAfter = Dec 15 00:00:42 2021 GMT
  issuer = /OU=GlobalSign Root CA - R2/O=GlobalSign/CN=GlobalSign
 Certificate depth 0 
  subject = /C=US/ST=California/L=Mountain View/O=Google LLC/CN=smtp.gmail.com
  notBefore = Aug 14 07:39:50 2018 GMT
  notAfter = Oct 23 07:37:00 2018 GMT
  issuer = /C=US/O=Google Trust Services/CN=Google Internet Authority G3
Comparing subject_alt_name: need<smtp.gmail.com> is<smtp.gmail.com>


-------------- 09/05/18 08:49:33 --------------


Email Service:

*mimetypes-load-control*: can't open or load "~/.mime.types"
Resolving host "smtp.gmail.com:587" ... done
Connecting to "74.125.138.108:587" ...connected.
 Certificate depth 2 
  subject = /OU=GlobalSign Root CA - R2/O=GlobalSign/CN=GlobalSign
  notBefore = Dec 15 08:00:00 2006 GMT
  notAfter = Dec 15 08:00:00 2021 GMT
  issuer = /OU=GlobalSign Root CA - R2/O=GlobalSign/CN=GlobalSign
 Certificate depth 1 
  subject = /C=US/O=Google Trust Services/CN=Google Internet Authority G3
  notBefore = Jun 15 00:00:42 2017 GMT
  notAfter = Dec 15 00:00:42 2021 GMT
  issuer = /OU=GlobalSign Root CA - R2/O=GlobalSign/CN=GlobalSign
 Certificate depth 0 
  subject = /C=US/ST=California/L=Mountain View/O=Google LLC/CN=smtp.gmail.com
  notBefore = Aug 14 07:39:50 2018 GMT
  notAfter = Oct 23 07:37:00 2018 GMT
  issuer = /C=US/O=Google Trust Services/CN=Google Internet Authority G3
Comparing subject_alt_name: need<smtp.gmail.com> is<smtp.gmail.com>


-------------- 09/05/18 08:50:28 --------------


Email Service:

*mimetypes-load-control*: can't open or load "~/.mime.types"
Resolving host "smtp.gmail.com:587" ... done
Connecting to "74.125.196.109:587" ...connected.
 Certificate depth 2 
  subject = /OU=GlobalSign Root CA - R2/O=GlobalSign/CN=GlobalSign
  notBefore = Dec 15 08:00:00 2006 GMT
  notAfter = Dec 15 08:00:00 2021 GMT
  issuer = /OU=GlobalSign Root CA - R2/O=GlobalSign/CN=GlobalSign
 Certificate depth 1 
  subject = /C=US/O=Google Trust Services/CN=Google Internet Authority G3
  notBefore = Jun 15 00:00:42 2017 GMT
  notAfter = Dec 15 00:00:42 2021 GMT
  issuer = /OU=GlobalSign Root CA - R2/O=GlobalSign/CN=GlobalSign
 Certificate depth 0 
  subject = /C=US/ST=California/L=Mountain View/O=Google LLC/CN=smtp.gmail.com
  notBefore = Aug 14 07:39:50 2018 GMT
  notAfter = Oct 23 07:37:00 2018 GMT
  issuer = /C=US/O=Google Trust Services/CN=Google Internet Authority G3
Comparing subject_alt_name: need<smtp.gmail.com> is<smtp.gmail.com>


-------------- 09/05/18 08:51:58 --------------


Email Service:

*mimetypes-load-control*: can't open or load "~/.mime.types"
Resolving host "smtp.gmail.com:587" ... done
Connecting to "74.125.196.109:587" ...connected.
 Certificate depth 2 
  subject = /OU=GlobalSign Root CA - R2/O=GlobalSign/CN=GlobalSign
  notBefore = Dec 15 08:00:00 2006 GMT
  notAfter = Dec 15 08:00:00 2021 GMT
  issuer = /OU=GlobalSign Root CA - R2/O=GlobalSign/CN=GlobalSign
 Certificate depth 1 
  subject = /C=US/O=Google Trust Services/CN=Google Internet Authority G3
  notBefore = Jun 15 00:00:42 2017 GMT
  notAfter = Dec 15 00:00:42 2021 GMT
  issuer = /OU=GlobalSign Root CA - R2/O=GlobalSign/CN=GlobalSign
 Certificate depth 0 
  subject = /C=US/ST=California/L=Mountain View/O=Google LLC/CN=smtp.gmail.com
  notBefore = Aug 14 07:39:50 2018 GMT
  notAfter = Oct 23 07:37:00 2018 GMT
  issuer = /C=US/O=Google Trust Services/CN=Google Internet Authority G3
Comparing subject_alt_name: need<smtp.gmail.com> is<smtp.gmail.com>


-------------- 09/05/18 08:55:13 --------------


Email Service:

*mimetypes-load-control*: can't open or load "~/.mime.types"
Resolving host "smtp.gmail.com:587" ... done
Connecting to "64.233.185.108:587" ...connected.
 Certificate depth 2 
  subject = /OU=GlobalSign Root CA - R2/O=GlobalSign/CN=GlobalSign
  notBefore = Dec 15 08:00:00 2006 GMT
  notAfter = Dec 15 08:00:00 2021 GMT
  issuer = /OU=GlobalSign Root CA - R2/O=GlobalSign/CN=GlobalSign
 Certificate depth 1 
  subject = /C=US/O=Google Trust Services/CN=Google Internet Authority G3
  notBefore = Jun 15 00:00:42 2017 GMT
  notAfter = Dec 15 00:00:42 2021 GMT
  issuer = /OU=GlobalSign Root CA - R2/O=GlobalSign/CN=GlobalSign
 Certificate depth 0 
  subject = /C=US/ST=California/L=Mountain View/O=Google LLC/CN=smtp.gmail.com
  notBefore = Aug 21 08:05:00 2018 GMT
  notAfter = Nov 13 08:05:00 2018 GMT
  issuer = /C=US/O=Google Trust Services/CN=Google Internet Authority G3
Comparing subject_alt_name: need<smtp.gmail.com> is<smtp.gmail.com>


-------------- 09/05/18 08:56:16 --------------


Email Service:

*mimetypes-load-control*: can't open or load "~/.mime.types"
Resolving host "smtp.gmail.com:587" ... done
Connecting to "64.233.185.109:587" ...connected.
 Certificate depth 2 
  subject = /OU=GlobalSign Root CA - R2/O=GlobalSign/CN=GlobalSign
  notBefore = Dec 15 08:00:00 2006 GMT
  notAfter = Dec 15 08:00:00 2021 GMT
  issuer = /OU=GlobalSign Root CA - R2/O=GlobalSign/CN=GlobalSign
 Certificate depth 1 
  subject = /C=US/O=Google Trust Services/CN=Google Internet Authority G3
  notBefore = Jun 15 00:00:42 2017 GMT
  notAfter = Dec 15 00:00:42 2021 GMT
  issuer = /OU=GlobalSign Root CA - R2/O=GlobalSign/CN=GlobalSign
 Certificate depth 0 
  subject = /C=US/ST=California/L=Mountain View/O=Google LLC/CN=smtp.gmail.com
  notBefore = Aug 21 08:05:00 2018 GMT
  notAfter = Nov 13 08:05:00 2018 GMT
  issuer = /C=US/O=Google Trust Services/CN=Google Internet Authority G3
Comparing subject_alt_name: need<smtp.gmail.com> is<smtp.gmail.com>


-------------- 09/05/18 09:07:40 --------------


Email Service:

*mimetypes-load-control*: can't open or load "~/.mime.types"
Resolving host "smtp.gmail.com:587" ... done
Connecting to "74.125.21.108:587" ...connected.
 Certificate depth 2 
  subject = /OU=GlobalSign Root CA - R2/O=GlobalSign/CN=GlobalSign
  notBefore = Dec 15 08:00:00 2006 GMT
  notAfter = Dec 15 08:00:00 2021 GMT
  issuer = /OU=GlobalSign Root CA - R2/O=GlobalSign/CN=GlobalSign
 Certificate depth 1 
  subject = /C=US/O=Google Trust Services/CN=Google Internet Authority G3
  notBefore = Jun 15 00:00:42 2017 GMT
  notAfter = Dec 15 00:00:42 2021 GMT
  issuer = /OU=GlobalSign Root CA - R2/O=GlobalSign/CN=GlobalSign
 Certificate depth 0 
  subject = /C=US/ST=California/L=Mountain View/O=Google LLC/CN=smtp.gmail.com
  notBefore = Aug 14 07:39:50 2018 GMT
  notAfter = Oct 23 07:37:00 2018 GMT
  issuer = /C=US/O=Google Trust Services/CN=Google Internet Authority G3
Comparing subject_alt_name: need<smtp.gmail.com> is<smtp.gmail.com>


-------------- 09/05/18 09:08:06 --------------


GitHub Server:

[daily-email 819a849] 09/05/18 09:08:06: Git Backup
 3 files changed, 274 insertions(+)
 rewrite CatwalkDataFigures_2018-09-05.pdf (95%)
 rewrite MetDataFigures_2018-09-05.pdf (95%)
Wed Sep 5 09:08:06 EDT 2018
To https://github.com/CareyLabVT/SCCData.git
   303b593..819a849  daily-email -> daily-email


Push the Logs to GitHub:

[daily-email 4e7952b] 09/05/18 09:08:06: Logs
 1 file changed, 11 insertions(+)
Wed Sep 5 09:08:11 EDT 2018
To https://github.com/CareyLabVT/SCCData.git
   819a849..4e7952b  daily-email -> daily-email
[daily-email 30bde4f] 09/05/18 09:08:06: Logs
 1 file changed, 5 insertions(+)
Wed Sep 5 09:08:14 EDT 2018
To https://github.com/CareyLabVT/SCCData.git
   4e7952b..30bde4f  daily-email -> daily-email


-------------- 09/06/18 00:17:26 --------------


Email Service:

*mimetypes-load-control*: can't open or load "~/.mime.types"
Resolving host "smtp.gmail.com:587" ... done
Connecting to "108.177.122.109:587" ...connected.
 Certificate depth 2 
  subject = /OU=GlobalSign Root CA - R2/O=GlobalSign/CN=GlobalSign
  notBefore = Dec 15 08:00:00 2006 GMT
  notAfter = Dec 15 08:00:00 2021 GMT
  issuer = /OU=GlobalSign Root CA - R2/O=GlobalSign/CN=GlobalSign
 Certificate depth 1 
  subject = /C=US/O=Google Trust Services/CN=Google Internet Authority G3
  notBefore = Jun 15 00:00:42 2017 GMT
  notAfter = Dec 15 00:00:42 2021 GMT
  issuer = /OU=GlobalSign Root CA - R2/O=GlobalSign/CN=GlobalSign
 Certificate depth 0 
  subject = /C=US/ST=California/L=Mountain View/O=Google LLC/CN=smtp.gmail.com
  notBefore = Aug 21 08:05:00 2018 GMT
  notAfter = Nov 13 08:05:00 2018 GMT
  issuer = /C=US/O=Google Trust Services/CN=Google Internet Authority G3
Comparing subject_alt_name: need<smtp.gmail.com> is<smtp.gmail.com>


-------------- 09/06/18 00:19:48 --------------


Email Service:

*mimetypes-load-control*: can't open or load "~/.mime.types"
Resolving host "smtp.gmail.com:587" ... done
Connecting to "108.177.122.108:587" ...connected.
 Certificate depth 2 
  subject = /OU=GlobalSign Root CA - R2/O=GlobalSign/CN=GlobalSign
  notBefore = Dec 15 08:00:00 2006 GMT
  notAfter = Dec 15 08:00:00 2021 GMT
  issuer = /OU=GlobalSign Root CA - R2/O=GlobalSign/CN=GlobalSign
 Certificate depth 1 
  subject = /C=US/O=Google Trust Services/CN=Google Internet Authority G3
  notBefore = Jun 15 00:00:42 2017 GMT
  notAfter = Dec 15 00:00:42 2021 GMT
  issuer = /OU=GlobalSign Root CA - R2/O=GlobalSign/CN=GlobalSign
 Certificate depth 0 
  subject = /C=US/ST=California/L=Mountain View/O=Google LLC/CN=smtp.gmail.com
  notBefore = Aug 21 08:05:00 2018 GMT
  notAfter = Nov 13 08:05:00 2018 GMT
  issuer = /C=US/O=Google Trust Services/CN=Google Internet Authority G3
Comparing subject_alt_name: need<smtp.gmail.com> is<smtp.gmail.com>


-------------- 09/06/18 06:15:01 --------------


Email Service:

*mimetypes-load-control*: can't open or load "~/.mime.types"
Resolving host "smtp.gmail.com:587" ... done
Connecting to "74.125.21.108:587" ...connected.
 Certificate depth 2 
  subject = /OU=GlobalSign Root CA - R2/O=GlobalSign/CN=GlobalSign
  notBefore = Dec 15 08:00:00 2006 GMT
  notAfter = Dec 15 08:00:00 2021 GMT
  issuer = /OU=GlobalSign Root CA - R2/O=GlobalSign/CN=GlobalSign
 Certificate depth 1 
  subject = /C=US/O=Google Trust Services/CN=Google Internet Authority G3
  notBefore = Jun 15 00:00:42 2017 GMT
  notAfter = Dec 15 00:00:42 2021 GMT
  issuer = /OU=GlobalSign Root CA - R2/O=GlobalSign/CN=GlobalSign
 Certificate depth 0 
  subject = /C=US/ST=California/L=Mountain View/O=Google LLC/CN=smtp.gmail.com
  notBefore = Aug 14 07:39:50 2018 GMT
  notAfter = Oct 23 07:37:00 2018 GMT
  issuer = /C=US/O=Google Trust Services/CN=Google Internet Authority G3
Comparing subject_alt_name: need<smtp.gmail.com> is<smtp.gmail.com>


-------------- 09/06/18 06:16:01 --------------


GitHub Server:

[daily-email 213e37a] 09/06/18 06:16:01: Git Backup
 3 files changed, 90 insertions(+)
 create mode 100644 CatwalkDataFigures_2018-09-06.pdf
 create mode 100644 MetDataFigures_2018-09-06.pdf
Thu Sep 6 06:16:01 EDT 2018
To https://github.com/CareyLabVT/SCCData.git
   30bde4f..213e37a  daily-email -> daily-email


Push the Logs to GitHub:

[daily-email 7390c49] 09/06/18 06:16:01: Logs
 1 file changed, 11 insertions(+)
Thu Sep 6 06:16:07 EDT 2018
To https://github.com/CareyLabVT/SCCData.git
   213e37a..7390c49  daily-email -> daily-email
[daily-email 616033e] 09/06/18 06:16:01: Logs
 1 file changed, 5 insertions(+)
Thu Sep 6 06:16:10 EDT 2018
To https://github.com/CareyLabVT/SCCData.git
   7390c49..616033e  daily-email -> daily-email


-------------- 09/07/18 06:15:01 --------------


Email Service:

*mimetypes-load-control*: can't open or load "~/.mime.types"
Resolving host "smtp.gmail.com:587" ... done
Connecting to "108.177.122.108:587" ...connected.
 Certificate depth 2 
  subject = /OU=GlobalSign Root CA - R2/O=GlobalSign/CN=GlobalSign
  notBefore = Dec 15 08:00:00 2006 GMT
  notAfter = Dec 15 08:00:00 2021 GMT
  issuer = /OU=GlobalSign Root CA - R2/O=GlobalSign/CN=GlobalSign
 Certificate depth 1 
  subject = /C=US/O=Google Trust Services/CN=Google Internet Authority G3
  notBefore = Jun 15 00:00:42 2017 GMT
  notAfter = Dec 15 00:00:42 2021 GMT
  issuer = /OU=GlobalSign Root CA - R2/O=GlobalSign/CN=GlobalSign
 Certificate depth 0 
  subject = /C=US/ST=California/L=Mountain View/O=Google LLC/CN=smtp.gmail.com
  notBefore = Aug 21 08:05:00 2018 GMT
  notAfter = Nov 13 08:05:00 2018 GMT
  issuer = /C=US/O=Google Trust Services/CN=Google Internet Authority G3
Comparing subject_alt_name: need<smtp.gmail.com> is<smtp.gmail.com>


-------------- 09/07/18 06:16:01 --------------


GitHub Server:

[daily-email a741c5e] 09/07/18 06:16:01: Git Backup
 3 files changed, 38 insertions(+)
 create mode 100644 CatwalkDataFigures_2018-09-07.pdf
 create mode 100644 MetDataFigures_2018-09-07.pdf
Fri Sep 7 06:16:01 EDT 2018
To https://github.com/CareyLabVT/SCCData.git
   616033e..a741c5e  daily-email -> daily-email


Push the Logs to GitHub:

[daily-email 815edf9] 09/07/18 06:16:01: Logs
 1 file changed, 11 insertions(+)
Fri Sep 7 06:16:08 EDT 2018
To https://github.com/CareyLabVT/SCCData.git
   a741c5e..815edf9  daily-email -> daily-email
[daily-email 4d88c16] 09/07/18 06:16:01: Logs
 1 file changed, 5 insertions(+)
Fri Sep 7 06:16:11 EDT 2018
To https://github.com/CareyLabVT/SCCData.git
   815edf9..4d88c16  daily-email -> daily-email


-------------- 09/08/18 06:15:01 --------------


Email Service:

*mimetypes-load-control*: can't open or load "~/.mime.types"
Resolving host "smtp.gmail.com:587" ... done
Connecting to "74.125.21.109:587" ...connected.
 Certificate depth 2 
  subject = /OU=GlobalSign Root CA - R2/O=GlobalSign/CN=GlobalSign
  notBefore = Dec 15 08:00:00 2006 GMT
  notAfter = Dec 15 08:00:00 2021 GMT
  issuer = /OU=GlobalSign Root CA - R2/O=GlobalSign/CN=GlobalSign
 Certificate depth 1 
  subject = /C=US/O=Google Trust Services/CN=Google Internet Authority G3
  notBefore = Jun 15 00:00:42 2017 GMT
  notAfter = Dec 15 00:00:42 2021 GMT
  issuer = /OU=GlobalSign Root CA - R2/O=GlobalSign/CN=GlobalSign
 Certificate depth 0 
  subject = /C=US/ST=California/L=Mountain View/O=Google LLC/CN=smtp.gmail.com
  notBefore = Aug 21 08:05:00 2018 GMT
  notAfter = Nov 13 08:05:00 2018 GMT
  issuer = /C=US/O=Google Trust Services/CN=Google Internet Authority G3
Comparing subject_alt_name: need<smtp.gmail.com> is<smtp.gmail.com>


-------------- 09/08/18 06:16:01 --------------


GitHub Server:

[daily-email 7beb927] 09/08/18 06:16:01: Git Backup
 3 files changed, 38 insertions(+)
 create mode 100644 CatwalkDataFigures_2018-09-08.pdf
 create mode 100644 MetDataFigures_2018-09-08.pdf
Sat Sep 8 06:16:01 EDT 2018
To https://github.com/CareyLabVT/SCCData.git
   4d88c16..7beb927  daily-email -> daily-email


Push the Logs to GitHub:

[daily-email 6e77aac] 09/08/18 06:16:01: Logs
 1 file changed, 11 insertions(+)
Sat Sep 8 06:16:06 EDT 2018
To https://github.com/CareyLabVT/SCCData.git
   7beb927..6e77aac  daily-email -> daily-email
[daily-email ca2ec26] 09/08/18 06:16:01: Logs
 1 file changed, 5 insertions(+)
Sat Sep 8 06:16:10 EDT 2018
To https://github.com/CareyLabVT/SCCData.git
   6e77aac..ca2ec26  daily-email -> daily-email


-------------- 09/09/18 06:15:01 --------------


Email Service:

*mimetypes-load-control*: can't open or load "~/.mime.types"
Resolving host "smtp.gmail.com:587" ... done
Connecting to "64.233.185.108:587" ...connected.
 Certificate depth 2 
  subject = /OU=GlobalSign Root CA - R2/O=GlobalSign/CN=GlobalSign
  notBefore = Dec 15 08:00:00 2006 GMT
  notAfter = Dec 15 08:00:00 2021 GMT
  issuer = /OU=GlobalSign Root CA - R2/O=GlobalSign/CN=GlobalSign
 Certificate depth 1 
  subject = /C=US/O=Google Trust Services/CN=Google Internet Authority G3
  notBefore = Jun 15 00:00:42 2017 GMT
  notAfter = Dec 15 00:00:42 2021 GMT
  issuer = /OU=GlobalSign Root CA - R2/O=GlobalSign/CN=GlobalSign
 Certificate depth 0 
  subject = /C=US/ST=California/L=Mountain View/O=Google LLC/CN=smtp.gmail.com
  notBefore = Aug 21 08:05:00 2018 GMT
  notAfter = Nov 13 08:05:00 2018 GMT
  issuer = /C=US/O=Google Trust Services/CN=Google Internet Authority G3
Comparing subject_alt_name: need<smtp.gmail.com> is<smtp.gmail.com>


-------------- 09/09/18 06:16:01 --------------


GitHub Server:

[daily-email 6998a88] 09/09/18 06:16:01: Git Backup
 3 files changed, 38 insertions(+)
 create mode 100644 CatwalkDataFigures_2018-09-09.pdf
 create mode 100644 MetDataFigures_2018-09-09.pdf
Sun Sep 9 06:16:01 EDT 2018
To https://github.com/CareyLabVT/SCCData.git
   ca2ec26..6998a88  daily-email -> daily-email


Push the Logs to GitHub:

[daily-email 72141b2] 09/09/18 06:16:01: Logs
 1 file changed, 11 insertions(+)
Sun Sep 9 06:16:07 EDT 2018
To https://github.com/CareyLabVT/SCCData.git
   6998a88..72141b2  daily-email -> daily-email
[daily-email debb70c] 09/09/18 06:16:01: Logs
 1 file changed, 5 insertions(+)
Sun Sep 9 06:16:10 EDT 2018
To https://github.com/CareyLabVT/SCCData.git
   72141b2..debb70c  daily-email -> daily-email


-------------- 09/10/18 06:15:01 --------------


Email Service:

*mimetypes-load-control*: can't open or load "~/.mime.types"
Resolving host "smtp.gmail.com:587" ... done
Connecting to "74.125.196.108:587" ...connected.
 Certificate depth 2 
  subject = /OU=GlobalSign Root CA - R2/O=GlobalSign/CN=GlobalSign
  notBefore = Dec 15 08:00:00 2006 GMT
  notAfter = Dec 15 08:00:00 2021 GMT
  issuer = /OU=GlobalSign Root CA - R2/O=GlobalSign/CN=GlobalSign
 Certificate depth 1 
  subject = /C=US/O=Google Trust Services/CN=Google Internet Authority G3
  notBefore = Jun 15 00:00:42 2017 GMT
  notAfter = Dec 15 00:00:42 2021 GMT
  issuer = /OU=GlobalSign Root CA - R2/O=GlobalSign/CN=GlobalSign
 Certificate depth 0 
  subject = /C=US/ST=California/L=Mountain View/O=Google LLC/CN=smtp.gmail.com
  notBefore = Aug 21 08:05:00 2018 GMT
  notAfter = Nov 13 08:05:00 2018 GMT
  issuer = /C=US/O=Google Trust Services/CN=Google Internet Authority G3
Comparing subject_alt_name: need<smtp.gmail.com> is<smtp.gmail.com>


-------------- 09/10/18 06:16:01 --------------


GitHub Server:

[daily-email 3d740c8] 09/10/18 06:16:01: Git Backup
 3 files changed, 38 insertions(+)
 create mode 100644 CatwalkDataFigures_2018-09-10.pdf
 create mode 100644 MetDataFigures_2018-09-10.pdf
Mon Sep 10 06:16:01 EDT 2018
To https://github.com/CareyLabVT/SCCData.git
   debb70c..3d740c8  daily-email -> daily-email


Push the Logs to GitHub:

[daily-email fcc5935] 09/10/18 06:16:01: Logs
 1 file changed, 11 insertions(+)
Mon Sep 10 06:16:07 EDT 2018
To https://github.com/CareyLabVT/SCCData.git
   3d740c8..fcc5935  daily-email -> daily-email
[daily-email c7441ca] 09/10/18 06:16:01: Logs
 1 file changed, 5 insertions(+)
Mon Sep 10 06:16:11 EDT 2018
To https://github.com/CareyLabVT/SCCData.git
   fcc5935..c7441ca  daily-email -> daily-email


-------------- 09/11/18 06:15:01 --------------


Email Service:

*mimetypes-load-control*: can't open or load "~/.mime.types"
Resolving host "smtp.gmail.com:587" ... done
Connecting to "108.177.122.109:587" ...connected.
 Certificate depth 2 
  subject = /OU=GlobalSign Root CA - R2/O=GlobalSign/CN=GlobalSign
  notBefore = Dec 15 08:00:00 2006 GMT
  notAfter = Dec 15 08:00:00 2021 GMT
  issuer = /OU=GlobalSign Root CA - R2/O=GlobalSign/CN=GlobalSign
 Certificate depth 1 
  subject = /C=US/O=Google Trust Services/CN=Google Internet Authority G3
  notBefore = Jun 15 00:00:42 2017 GMT
  notAfter = Dec 15 00:00:42 2021 GMT
  issuer = /OU=GlobalSign Root CA - R2/O=GlobalSign/CN=GlobalSign
 Certificate depth 0 
  subject = /C=US/ST=California/L=Mountain View/O=Google LLC/CN=smtp.gmail.com
  notBefore = Aug 21 08:05:00 2018 GMT
  notAfter = Nov 13 08:05:00 2018 GMT
  issuer = /C=US/O=Google Trust Services/CN=Google Internet Authority G3
Comparing subject_alt_name: need<smtp.gmail.com> is<smtp.gmail.com>


-------------- 09/11/18 06:16:01 --------------


GitHub Server:

[daily-email 381b4e9] 09/11/18 06:16:01: Git Backup
 3 files changed, 38 insertions(+)
 create mode 100644 CatwalkDataFigures_2018-09-11.pdf
 create mode 100644 MetDataFigures_2018-09-11.pdf
Tue Sep 11 06:16:01 EDT 2018
To https://github.com/CareyLabVT/SCCData.git
   c7441ca..381b4e9  daily-email -> daily-email


Push the Logs to GitHub:

[daily-email 8767801] 09/11/18 06:16:01: Logs
 1 file changed, 11 insertions(+)
Tue Sep 11 06:16:08 EDT 2018
To https://github.com/CareyLabVT/SCCData.git
   381b4e9..8767801  daily-email -> daily-email
[daily-email 11c2936] 09/11/18 06:16:01: Logs
 1 file changed, 5 insertions(+)
Tue Sep 11 06:16:11 EDT 2018
To https://github.com/CareyLabVT/SCCData.git
   8767801..11c2936  daily-email -> daily-email


-------------- 09/12/18 06:15:01 --------------


Email Service:

*mimetypes-load-control*: can't open or load "~/.mime.types"
Resolving host "smtp.gmail.com:587" ... done
Connecting to "64.233.185.109:587" ...connected.
 Certificate depth 2 
  subject = /OU=GlobalSign Root CA - R2/O=GlobalSign/CN=GlobalSign
  notBefore = Dec 15 08:00:00 2006 GMT
  notAfter = Dec 15 08:00:00 2021 GMT
  issuer = /OU=GlobalSign Root CA - R2/O=GlobalSign/CN=GlobalSign
 Certificate depth 1 
  subject = /C=US/O=Google Trust Services/CN=Google Internet Authority G3
  notBefore = Jun 15 00:00:42 2017 GMT
  notAfter = Dec 15 00:00:42 2021 GMT
  issuer = /OU=GlobalSign Root CA - R2/O=GlobalSign/CN=GlobalSign
 Certificate depth 0 
  subject = /C=US/ST=California/L=Mountain View/O=Google LLC/CN=smtp.gmail.com
  notBefore = Aug 28 18:23:00 2018 GMT
  notAfter = Nov 20 18:23:00 2018 GMT
  issuer = /C=US/O=Google Trust Services/CN=Google Internet Authority G3
Comparing subject_alt_name: need<smtp.gmail.com> is<smtp.gmail.com>


-------------- 09/12/18 06:16:01 --------------


GitHub Server:

[daily-email 64eb122] 09/12/18 06:16:01: Git Backup
 3 files changed, 38 insertions(+)
 create mode 100644 CatwalkDataFigures_2018-09-12.pdf
 create mode 100644 MetDataFigures_2018-09-12.pdf
Wed Sep 12 06:16:01 EDT 2018
To https://github.com/CareyLabVT/SCCData.git
   11c2936..64eb122  daily-email -> daily-email


Push the Logs to GitHub:

[daily-email ea6717a] 09/12/18 06:16:01: Logs
 1 file changed, 11 insertions(+)
Wed Sep 12 06:16:06 EDT 2018
To https://github.com/CareyLabVT/SCCData.git
   64eb122..ea6717a  daily-email -> daily-email
[daily-email 24727ce] 09/12/18 06:16:01: Logs
 1 file changed, 5 insertions(+)
Wed Sep 12 06:16:10 EDT 2018
To https://github.com/CareyLabVT/SCCData.git
   ea6717a..24727ce  daily-email -> daily-email


-------------- 09/13/18 06:15:01 --------------


Email Service:

*mimetypes-load-control*: can't open or load "~/.mime.types"
Resolving host "smtp.gmail.com:587" ... done
Connecting to "74.125.21.109:587" ...connected.
 Certificate depth 2 
  subject = /OU=GlobalSign Root CA - R2/O=GlobalSign/CN=GlobalSign
  notBefore = Dec 15 08:00:00 2006 GMT
  notAfter = Dec 15 08:00:00 2021 GMT
  issuer = /OU=GlobalSign Root CA - R2/O=GlobalSign/CN=GlobalSign
 Certificate depth 1 
  subject = /C=US/O=Google Trust Services/CN=Google Internet Authority G3
  notBefore = Jun 15 00:00:42 2017 GMT
  notAfter = Dec 15 00:00:42 2021 GMT
  issuer = /OU=GlobalSign Root CA - R2/O=GlobalSign/CN=GlobalSign
 Certificate depth 0 
  subject = /C=US/ST=California/L=Mountain View/O=Google LLC/CN=smtp.gmail.com
  notBefore = Aug 21 08:05:00 2018 GMT
  notAfter = Nov 13 08:05:00 2018 GMT
  issuer = /C=US/O=Google Trust Services/CN=Google Internet Authority G3
Comparing subject_alt_name: need<smtp.gmail.com> is<smtp.gmail.com>


-------------- 09/13/18 06:16:01 --------------


GitHub Server:

[daily-email 577bc41] 09/13/18 06:16:01: Git Backup
 3 files changed, 38 insertions(+)
 create mode 100644 CatwalkDataFigures_2018-09-13.pdf
 create mode 100644 MetDataFigures_2018-09-13.pdf
Thu Sep 13 06:16:01 EDT 2018
To https://github.com/CareyLabVT/SCCData.git
   24727ce..577bc41  daily-email -> daily-email


Push the Logs to GitHub:

[daily-email be7e3b7] 09/13/18 06:16:01: Logs
 1 file changed, 11 insertions(+)
Thu Sep 13 06:16:07 EDT 2018
To https://github.com/CareyLabVT/SCCData.git
   577bc41..be7e3b7  daily-email -> daily-email
[daily-email fd5c2f0] 09/13/18 06:16:01: Logs
 1 file changed, 5 insertions(+)
Thu Sep 13 06:16:10 EDT 2018
To https://github.com/CareyLabVT/SCCData.git
   be7e3b7..fd5c2f0  daily-email -> daily-email


-------------- 09/13/18 10:02:00 --------------


Email Service:

*mimetypes-load-control*: can't open or load "~/.mime.types"
Resolving host "smtp.gmail.com:587" ... done
Connecting to "74.125.21.109:587" ...connected.
 Certificate depth 2 
  subject = /OU=GlobalSign Root CA - R2/O=GlobalSign/CN=GlobalSign
  notBefore = Dec 15 08:00:00 2006 GMT
  notAfter = Dec 15 08:00:00 2021 GMT
  issuer = /OU=GlobalSign Root CA - R2/O=GlobalSign/CN=GlobalSign
 Certificate depth 1 
  subject = /C=US/O=Google Trust Services/CN=Google Internet Authority G3
  notBefore = Jun 15 00:00:42 2017 GMT
  notAfter = Dec 15 00:00:42 2021 GMT
  issuer = /OU=GlobalSign Root CA - R2/O=GlobalSign/CN=GlobalSign
 Certificate depth 0 
  subject = /C=US/ST=California/L=Mountain View/O=Google LLC/CN=smtp.gmail.com
  notBefore = Aug 21 08:05:00 2018 GMT
  notAfter = Nov 13 08:05:00 2018 GMT
  issuer = /C=US/O=Google Trust Services/CN=Google Internet Authority G3
Comparing subject_alt_name: need<smtp.gmail.com> is<smtp.gmail.com>


-------------- 09/13/18 10:04:47 --------------


Email Service:

*mimetypes-load-control*: can't open or load "~/.mime.types"
Resolving host "smtp.gmail.com:587" ... done
Connecting to "74.125.21.108:587" ...connected.
 Certificate depth 2 
  subject = /OU=GlobalSign Root CA - R2/O=GlobalSign/CN=GlobalSign
  notBefore = Dec 15 08:00:00 2006 GMT
  notAfter = Dec 15 08:00:00 2021 GMT
  issuer = /OU=GlobalSign Root CA - R2/O=GlobalSign/CN=GlobalSign
 Certificate depth 1 
  subject = /C=US/O=Google Trust Services/CN=Google Internet Authority G3
  notBefore = Jun 15 00:00:42 2017 GMT
  notAfter = Dec 15 00:00:42 2021 GMT
  issuer = /OU=GlobalSign Root CA - R2/O=GlobalSign/CN=GlobalSign
 Certificate depth 0 
  subject = /C=US/ST=California/L=Mountain View/O=Google LLC/CN=smtp.gmail.com
  notBefore = Aug 21 08:05:00 2018 GMT
  notAfter = Nov 13 08:05:00 2018 GMT
  issuer = /C=US/O=Google Trust Services/CN=Google Internet Authority G3
Comparing subject_alt_name: need<smtp.gmail.com> is<smtp.gmail.com>


-------------- 09/13/18 11:50:22 --------------


Email Service:

*mimetypes-load-control*: can't open or load "~/.mime.types"
Resolving host "smtp.gmail.com:587" ... done
Connecting to "64.233.177.108:587" ...connected.
 Certificate depth 2 
  subject = /OU=GlobalSign Root CA - R2/O=GlobalSign/CN=GlobalSign
  notBefore = Dec 15 08:00:00 2006 GMT
  notAfter = Dec 15 08:00:00 2021 GMT
  issuer = /OU=GlobalSign Root CA - R2/O=GlobalSign/CN=GlobalSign
 Certificate depth 1 
  subject = /C=US/O=Google Trust Services/CN=Google Internet Authority G3
  notBefore = Jun 15 00:00:42 2017 GMT
  notAfter = Dec 15 00:00:42 2021 GMT
  issuer = /OU=GlobalSign Root CA - R2/O=GlobalSign/CN=GlobalSign
 Certificate depth 0 
  subject = /C=US/ST=California/L=Mountain View/O=Google LLC/CN=smtp.gmail.com
  notBefore = Aug 21 08:05:00 2018 GMT
  notAfter = Nov 13 08:05:00 2018 GMT
  issuer = /C=US/O=Google Trust Services/CN=Google Internet Authority G3
Comparing subject_alt_name: need<smtp.gmail.com> is<smtp.gmail.com>


-------------- 09/14/18 06:15:01 --------------


Email Service:

*mimetypes-load-control*: can't open or load "~/.mime.types"
Resolving host "smtp.gmail.com:587" ... done
Connecting to "74.125.21.108:587" ...connected.
 Certificate depth 2 
  subject = /OU=GlobalSign Root CA - R2/O=GlobalSign/CN=GlobalSign
  notBefore = Dec 15 08:00:00 2006 GMT
  notAfter = Dec 15 08:00:00 2021 GMT
  issuer = /OU=GlobalSign Root CA - R2/O=GlobalSign/CN=GlobalSign
 Certificate depth 1 
  subject = /C=US/O=Google Trust Services/CN=Google Internet Authority G3
  notBefore = Jun 15 00:00:42 2017 GMT
  notAfter = Dec 15 00:00:42 2021 GMT
  issuer = /OU=GlobalSign Root CA - R2/O=GlobalSign/CN=GlobalSign
 Certificate depth 0 
  subject = /C=US/ST=California/L=Mountain View/O=Google LLC/CN=smtp.gmail.com
  notBefore = Aug 28 18:23:00 2018 GMT
  notAfter = Nov 20 18:23:00 2018 GMT
  issuer = /C=US/O=Google Trust Services/CN=Google Internet Authority G3
Comparing subject_alt_name: need<smtp.gmail.com> is<smtp.gmail.com>


-------------- 09/14/18 06:16:01 --------------


GitHub Server:

[daily-email b4e3440] 09/14/18 06:16:01: Git Backup
 3 files changed, 116 insertions(+)
 create mode 100644 CatwalkDataFigures_2018-09-14.pdf
 create mode 100644 MetDataFigures_2018-09-14.pdf
Fri Sep 14 06:16:01 EDT 2018
To https://github.com/CareyLabVT/SCCData.git
   fd5c2f0..b4e3440  daily-email -> daily-email


Push the Logs to GitHub:

[daily-email 212ab43] 09/14/18 06:16:01: Logs
 1 file changed, 11 insertions(+)
Fri Sep 14 06:16:09 EDT 2018
To https://github.com/CareyLabVT/SCCData.git
   b4e3440..212ab43  daily-email -> daily-email
[daily-email cb64b30] 09/14/18 06:16:01: Logs
 1 file changed, 5 insertions(+)
Fri Sep 14 06:16:13 EDT 2018
To https://github.com/CareyLabVT/SCCData.git
   212ab43..cb64b30  daily-email -> daily-email


-------------- 09/15/18 06:15:01 --------------


Email Service:

*mimetypes-load-control*: can't open or load "~/.mime.types"
Resolving host "smtp.gmail.com:587" ... done
Connecting to "64.233.185.109:587" ...connected.
 Certificate depth 2 
  subject = /OU=GlobalSign Root CA - R2/O=GlobalSign/CN=GlobalSign
  notBefore = Dec 15 08:00:00 2006 GMT
  notAfter = Dec 15 08:00:00 2021 GMT
  issuer = /OU=GlobalSign Root CA - R2/O=GlobalSign/CN=GlobalSign
 Certificate depth 1 
  subject = /C=US/O=Google Trust Services/CN=Google Internet Authority G3
  notBefore = Jun 15 00:00:42 2017 GMT
  notAfter = Dec 15 00:00:42 2021 GMT
  issuer = /OU=GlobalSign Root CA - R2/O=GlobalSign/CN=GlobalSign
 Certificate depth 0 
  subject = /C=US/ST=California/L=Mountain View/O=Google LLC/CN=smtp.gmail.com
  notBefore = Aug 28 18:23:00 2018 GMT
  notAfter = Nov 20 18:23:00 2018 GMT
  issuer = /C=US/O=Google Trust Services/CN=Google Internet Authority G3
Comparing subject_alt_name: need<smtp.gmail.com> is<smtp.gmail.com>


-------------- 09/15/18 06:16:01 --------------


GitHub Server:

[daily-email 89621ce] 09/15/18 06:16:01: Git Backup
 3 files changed, 38 insertions(+)
 create mode 100644 CatwalkDataFigures_2018-09-15.pdf
 create mode 100644 MetDataFigures_2018-09-15.pdf
Sat Sep 15 06:16:01 EDT 2018
To https://github.com/CareyLabVT/SCCData.git
   cb64b30..89621ce  daily-email -> daily-email


Push the Logs to GitHub:

[daily-email 37da7de] 09/15/18 06:16:01: Logs
 1 file changed, 11 insertions(+)
Sat Sep 15 06:16:07 EDT 2018
To https://github.com/CareyLabVT/SCCData.git
   89621ce..37da7de  daily-email -> daily-email
[daily-email bda7ea2] 09/15/18 06:16:01: Logs
 1 file changed, 5 insertions(+)
Sat Sep 15 06:16:11 EDT 2018
To https://github.com/CareyLabVT/SCCData.git
   37da7de..bda7ea2  daily-email -> daily-email


-------------- 09/16/18 06:15:01 --------------


Email Service:

*mimetypes-load-control*: can't open or load "~/.mime.types"
Resolving host "smtp.gmail.com:587" ... done
Connecting to "64.233.185.109:587" ...connected.
 Certificate depth 2 
  subject = /OU=GlobalSign Root CA - R2/O=GlobalSign/CN=GlobalSign
  notBefore = Dec 15 08:00:00 2006 GMT
  notAfter = Dec 15 08:00:00 2021 GMT
  issuer = /OU=GlobalSign Root CA - R2/O=GlobalSign/CN=GlobalSign
 Certificate depth 1 
  subject = /C=US/O=Google Trust Services/CN=Google Internet Authority G3
  notBefore = Jun 15 00:00:42 2017 GMT
  notAfter = Dec 15 00:00:42 2021 GMT
  issuer = /OU=GlobalSign Root CA - R2/O=GlobalSign/CN=GlobalSign
 Certificate depth 0 
  subject = /C=US/ST=California/L=Mountain View/O=Google LLC/CN=smtp.gmail.com
  notBefore = Aug 28 18:23:00 2018 GMT
  notAfter = Nov 20 18:23:00 2018 GMT
  issuer = /C=US/O=Google Trust Services/CN=Google Internet Authority G3
Comparing subject_alt_name: need<smtp.gmail.com> is<smtp.gmail.com>


-------------- 09/16/18 06:16:01 --------------


GitHub Server:

[daily-email 9c99ae3] 09/16/18 06:16:01: Git Backup
 3 files changed, 38 insertions(+)
 create mode 100644 CatwalkDataFigures_2018-09-16.pdf
 create mode 100644 MetDataFigures_2018-09-16.pdf
Sun Sep 16 06:16:02 EDT 2018
To https://github.com/CareyLabVT/SCCData.git
   bda7ea2..9c99ae3  daily-email -> daily-email


Push the Logs to GitHub:

[daily-email db33bc4] 09/16/18 06:16:01: Logs
 1 file changed, 11 insertions(+)
Sun Sep 16 06:16:07 EDT 2018
To https://github.com/CareyLabVT/SCCData.git
   9c99ae3..db33bc4  daily-email -> daily-email
[daily-email 8b063cc] 09/16/18 06:16:01: Logs
 1 file changed, 5 insertions(+)
Sun Sep 16 06:16:10 EDT 2018
To https://github.com/CareyLabVT/SCCData.git
   db33bc4..8b063cc  daily-email -> daily-email


-------------- 09/16/18 23:21:46 --------------


Email Service:

*mimetypes-load-control*: can't open or load "~/.mime.types"
Resolving host "smtp.gmail.com:587" ... done
Connecting to "64.233.177.109:587" ...connected.
 Certificate depth 2 
  subject = /OU=GlobalSign Root CA - R2/O=GlobalSign/CN=GlobalSign
  notBefore = Dec 15 08:00:00 2006 GMT
  notAfter = Dec 15 08:00:00 2021 GMT
  issuer = /OU=GlobalSign Root CA - R2/O=GlobalSign/CN=GlobalSign
 Certificate depth 1 
  subject = /C=US/O=Google Trust Services/CN=Google Internet Authority G3
  notBefore = Jun 15 00:00:42 2017 GMT
  notAfter = Dec 15 00:00:42 2021 GMT
  issuer = /OU=GlobalSign Root CA - R2/O=GlobalSign/CN=GlobalSign
 Certificate depth 0 
  subject = /C=US/ST=California/L=Mountain View/O=Google LLC/CN=smtp.gmail.com
  notBefore = Aug 28 18:23:00 2018 GMT
  notAfter = Nov 20 18:23:00 2018 GMT
  issuer = /C=US/O=Google Trust Services/CN=Google Internet Authority G3
Comparing subject_alt_name: need<smtp.gmail.com> is<smtp.gmail.com>


-------------- 09/16/18 23:28:45 --------------


Email Service:

*mimetypes-load-control*: can't open or load "~/.mime.types"
Resolving host "smtp.gmail.com:587" ... done
Connecting to "64.233.177.108:587" ...connected.
 Certificate depth 2 
  subject = /OU=GlobalSign Root CA - R2/O=GlobalSign/CN=GlobalSign
  notBefore = Dec 15 08:00:00 2006 GMT
  notAfter = Dec 15 08:00:00 2021 GMT
  issuer = /OU=GlobalSign Root CA - R2/O=GlobalSign/CN=GlobalSign
 Certificate depth 1 
  subject = /C=US/O=Google Trust Services/CN=Google Internet Authority G3
  notBefore = Jun 15 00:00:42 2017 GMT
  notAfter = Dec 15 00:00:42 2021 GMT
  issuer = /OU=GlobalSign Root CA - R2/O=GlobalSign/CN=GlobalSign
 Certificate depth 0 
  subject = /C=US/ST=California/L=Mountain View/O=Google LLC/CN=smtp.gmail.com
  notBefore = Aug 28 18:23:00 2018 GMT
  notAfter = Nov 20 18:23:00 2018 GMT
  issuer = /C=US/O=Google Trust Services/CN=Google Internet Authority G3
Comparing subject_alt_name: need<smtp.gmail.com> is<smtp.gmail.com>


-------------- 09/16/18 23:32:45 --------------


Email Service:

*mimetypes-load-control*: can't open or load "~/.mime.types"
Resolving host "smtp.gmail.com:587" ... done
Connecting to "74.125.138.109:587" ...connected.
 Certificate depth 2 
  subject = /OU=GlobalSign Root CA - R2/O=GlobalSign/CN=GlobalSign
  notBefore = Dec 15 08:00:00 2006 GMT
  notAfter = Dec 15 08:00:00 2021 GMT
  issuer = /OU=GlobalSign Root CA - R2/O=GlobalSign/CN=GlobalSign
 Certificate depth 1 
  subject = /C=US/O=Google Trust Services/CN=Google Internet Authority G3
  notBefore = Jun 15 00:00:42 2017 GMT
  notAfter = Dec 15 00:00:42 2021 GMT
  issuer = /OU=GlobalSign Root CA - R2/O=GlobalSign/CN=GlobalSign
 Certificate depth 0 
  subject = /C=US/ST=California/L=Mountain View/O=Google LLC/CN=smtp.gmail.com
  notBefore = Aug 28 18:23:00 2018 GMT
  notAfter = Nov 20 18:23:00 2018 GMT
  issuer = /C=US/O=Google Trust Services/CN=Google Internet Authority G3
Comparing subject_alt_name: need<smtp.gmail.com> is<smtp.gmail.com>


-------------- 09/16/18 23:32:51 --------------


Email Service:

*mimetypes-load-control*: can't open or load "~/.mime.types"
/home/scc/applications/git-log.png: No such file or directory


-------------- 09/16/18 23:36:54 --------------


Email Service:

*mimetypes-load-control*: can't open or load "~/.mime.types"
/home/scc/applications/git-log.png: No such file or directory


-------------- 09/16/18 23:37:41 --------------


Email Service:

*mimetypes-load-control*: can't open or load "~/.mime.types"
Resolving host "smtp.gmail.com:587" ... done
Connecting to "108.177.122.108:587" ...connected.
 Certificate depth 2 
  subject = /OU=GlobalSign Root CA - R2/O=GlobalSign/CN=GlobalSign
  notBefore = Dec 15 08:00:00 2006 GMT
  notAfter = Dec 15 08:00:00 2021 GMT
  issuer = /OU=GlobalSign Root CA - R2/O=GlobalSign/CN=GlobalSign
 Certificate depth 1 
  subject = /C=US/O=Google Trust Services/CN=Google Internet Authority G3
  notBefore = Jun 15 00:00:42 2017 GMT
  notAfter = Dec 15 00:00:42 2021 GMT
  issuer = /OU=GlobalSign Root CA - R2/O=GlobalSign/CN=GlobalSign
 Certificate depth 0 
  subject = /C=US/ST=California/L=Mountain View/O=Google LLC/CN=smtp.gmail.com
  notBefore = Aug 28 18:23:00 2018 GMT
  notAfter = Nov 20 18:23:00 2018 GMT
  issuer = /C=US/O=Google Trust Services/CN=Google Internet Authority G3
Comparing subject_alt_name: need<smtp.gmail.com> is<smtp.gmail.com>


-------------- 09/17/18 00:05:26 --------------


Email Service:

*mimetypes-load-control*: can't open or load "~/.mime.types"
Resolving host "smtp.gmail.com:587" ... done
Connecting to "74.125.196.108:587" ...connected.
 Certificate depth 2 
  subject = /OU=GlobalSign Root CA - R2/O=GlobalSign/CN=GlobalSign
  notBefore = Dec 15 08:00:00 2006 GMT
  notAfter = Dec 15 08:00:00 2021 GMT
  issuer = /OU=GlobalSign Root CA - R2/O=GlobalSign/CN=GlobalSign
 Certificate depth 1 
  subject = /C=US/O=Google Trust Services/CN=Google Internet Authority G3
  notBefore = Jun 15 00:00:42 2017 GMT
  notAfter = Dec 15 00:00:42 2021 GMT
  issuer = /OU=GlobalSign Root CA - R2/O=GlobalSign/CN=GlobalSign
 Certificate depth 0 
  subject = /C=US/ST=California/L=Mountain View/O=Google LLC/CN=smtp.gmail.com
  notBefore = Aug 28 18:23:00 2018 GMT
  notAfter = Nov 20 18:23:00 2018 GMT
  issuer = /C=US/O=Google Trust Services/CN=Google Internet Authority G3
Comparing subject_alt_name: need<smtp.gmail.com> is<smtp.gmail.com>


-------------- 09/17/18 00:05:45 --------------


GitHub Server:

[daily-email 6b2af98] 09/17/18 00:05:45: Git Backup
 3 files changed, 160 insertions(+)
 create mode 100644 CatwalkDataFigures_2018-09-17.pdf
 create mode 100644 MetDataFigures_2018-09-17.pdf
Mon Sep 17 00:05:45 EDT 2018
To https://github.com/CareyLabVT/SCCData.git
   8b063cc..6b2af98  daily-email -> daily-email


Push the Logs to GitHub:

[daily-email 77f6869] 09/17/18 00:05:45: Logs
 1 file changed, 11 insertions(+)
Mon Sep 17 00:05:49 EDT 2018
To https://github.com/CareyLabVT/SCCData.git
   6b2af98..77f6869  daily-email -> daily-email
[daily-email fef0f81] 09/17/18 00:05:45: Logs
 1 file changed, 5 insertions(+)
Mon Sep 17 00:05:53 EDT 2018
To https://github.com/CareyLabVT/SCCData.git
   77f6869..fef0f81  daily-email -> daily-email


-------------- 09/17/18 07:00:01 --------------


Email Service:

*mimetypes-load-control*: can't open or load "~/.mime.types"
Resolving host "smtp.gmail.com:587" ... done
Connecting to "108.177.122.108:587" ...connected.
 Certificate depth 2 
  subject = /OU=GlobalSign Root CA - R2/O=GlobalSign/CN=GlobalSign
  notBefore = Dec 15 08:00:00 2006 GMT
  notAfter = Dec 15 08:00:00 2021 GMT
  issuer = /OU=GlobalSign Root CA - R2/O=GlobalSign/CN=GlobalSign
 Certificate depth 1 
  subject = /C=US/O=Google Trust Services/CN=Google Internet Authority G3
  notBefore = Jun 15 00:00:42 2017 GMT
  notAfter = Dec 15 00:00:42 2021 GMT
  issuer = /OU=GlobalSign Root CA - R2/O=GlobalSign/CN=GlobalSign
 Certificate depth 0 
  subject = /C=US/ST=California/L=Mountain View/O=Google LLC/CN=smtp.gmail.com
  notBefore = Aug 28 18:23:00 2018 GMT
  notAfter = Nov 20 18:23:00 2018 GMT
  issuer = /C=US/O=Google Trust Services/CN=Google Internet Authority G3
Comparing subject_alt_name: need<smtp.gmail.com> is<smtp.gmail.com>


-------------- 09/17/18 07:01:01 --------------


GitHub Server:

[daily-email 88cef52] 09/17/18 07:01:01: Git Backup
 3 files changed, 38 insertions(+)
 rewrite CatwalkDataFigures_2018-09-17.pdf (95%)
 rewrite MetDataFigures_2018-09-17.pdf (95%)
Mon Sep 17 07:01:01 EDT 2018
To https://github.com/CareyLabVT/SCCData.git
   fef0f81..88cef52  daily-email -> daily-email


Push the Logs to GitHub:

[daily-email dd4f37e] 09/17/18 07:01:01: Logs
 1 file changed, 11 insertions(+)
Mon Sep 17 07:01:07 EDT 2018
To https://github.com/CareyLabVT/SCCData.git
   88cef52..dd4f37e  daily-email -> daily-email
[daily-email e23375f] 09/17/18 07:01:01: Logs
 1 file changed, 5 insertions(+)
Mon Sep 17 07:01:11 EDT 2018
To https://github.com/CareyLabVT/SCCData.git
   dd4f37e..e23375f  daily-email -> daily-email


-------------- 09/18/18 06:15:01 --------------


Email Service:

*mimetypes-load-control*: can't open or load "~/.mime.types"
Resolving host "smtp.gmail.com:587" ... done
Connecting to "64.233.185.108:587" ...connected.
 Certificate depth 2 
  subject = /OU=GlobalSign Root CA - R2/O=GlobalSign/CN=GlobalSign
  notBefore = Dec 15 08:00:00 2006 GMT
  notAfter = Dec 15 08:00:00 2021 GMT
  issuer = /OU=GlobalSign Root CA - R2/O=GlobalSign/CN=GlobalSign
 Certificate depth 1 
  subject = /C=US/O=Google Trust Services/CN=Google Internet Authority G3
  notBefore = Jun 15 00:00:42 2017 GMT
  notAfter = Dec 15 00:00:42 2021 GMT
  issuer = /OU=GlobalSign Root CA - R2/O=GlobalSign/CN=GlobalSign
 Certificate depth 0 
  subject = /C=US/ST=California/L=Mountain View/O=Google LLC/CN=smtp.gmail.com
  notBefore = Sep  4 10:49:00 2018 GMT
  notAfter = Nov 27 10:49:00 2018 GMT
  issuer = /C=US/O=Google Trust Services/CN=Google Internet Authority G3
Comparing subject_alt_name: need<smtp.gmail.com> is<smtp.gmail.com>


-------------- 09/18/18 06:16:01 --------------


GitHub Server:

[daily-email 314fcff] 09/18/18 06:16:01: Git Backup
 3 files changed, 38 insertions(+)
 create mode 100644 CatwalkDataFigures_2018-09-18.pdf
 create mode 100644 MetDataFigures_2018-09-18.pdf
Tue Sep 18 06:16:01 EDT 2018
To https://github.com/CareyLabVT/SCCData.git
   e23375f..314fcff  daily-email -> daily-email


Push the Logs to GitHub:

[daily-email f69f7ef] 09/18/18 06:16:01: Logs
 1 file changed, 11 insertions(+)
Tue Sep 18 06:16:06 EDT 2018
To https://github.com/CareyLabVT/SCCData.git
   314fcff..f69f7ef  daily-email -> daily-email
[daily-email 36478a1] 09/18/18 06:16:01: Logs
 1 file changed, 5 insertions(+)
Tue Sep 18 06:16:10 EDT 2018
To https://github.com/CareyLabVT/SCCData.git
   f69f7ef..36478a1  daily-email -> daily-email
-e 

-------------- 09/18/18 09:40:20 --------------
-e 

GitHub Server:

Fetching origin
From https://github.com/CareyLabVT/SCCData
   2cc7df1..17cf913  noaa-logs  -> origin/noaa-logs
Already up-to-date.
convert: no images defined `/home/scc/applications/git-log.png' @ error/convert.c/ConvertImageCommand/3210.
convert: no images defined `/home/scc/applications/git-log.png' @ error/convert.c/ConvertImageCommand/3210.
convert: no images defined `/home/scc/applications/git-log.png' @ error/convert.c/ConvertImageCommand/3210.
-e 

-------------- 09/18/18 09:50:14 --------------
-e 

GitHub Server:

Fetching origin
From https://github.com/CareyLabVT/SCCData
   87770bc..182abc0  noaa-data  -> origin/noaa-data
   17cf913..51454d3  noaa-logs  -> origin/noaa-logs
Already up-to-date.
convert: unable to open image `/home/scc/applications/git-log.png': Permission denied @ error/blob.c/OpenBlob/2712.
convert: WriteBlob Failed `/home/scc/applications/git-log.png' @ error/png.c/MagickPNGErrorHandler/1643.
-e 

-------------- 09/18/18 09:50:52 --------------
-e 

GitHub Server:

Fetching origin
Already up-to-date.
-e 

-------------- 09/18/18 09:54:40 --------------
-e 

GitHub Server:

Fetching origin
Already up-to-date.
convert: unable to open image `/home/scc/applications/git-log.png': Permission denied @ error/blob.c/OpenBlob/2712.
convert: WriteBlob Failed `/home/scc/applications/git-log.png' @ error/png.c/MagickPNGErrorHandler/1643.
-e 

-------------- 09/18/18 09:55:02 --------------
-e 

GitHub Server:

Fetching origin
Already up-to-date.


-------------- 09/18/18 09:55:24 -------------- i2


Email Service:

*mimetypes-load-control*: can't open or load "~/.mime.types"
Resolving host "smtp.gmail.com:587" ... done
Connecting to "74.125.138.109:587" ...connected.
 Certificate depth 2 
  subject = /OU=GlobalSign Root CA - R2/O=GlobalSign/CN=GlobalSign
  notBefore = Dec 15 08:00:00 2006 GMT
  notAfter = Dec 15 08:00:00 2021 GMT
  issuer = /OU=GlobalSign Root CA - R2/O=GlobalSign/CN=GlobalSign
 Certificate depth 1 
  subject = /C=US/O=Google Trust Services/CN=Google Internet Authority G3
  notBefore = Jun 15 00:00:42 2017 GMT
  notAfter = Dec 15 00:00:42 2021 GMT
  issuer = /OU=GlobalSign Root CA - R2/O=GlobalSign/CN=GlobalSign
 Certificate depth 0 
  subject = /C=US/ST=California/L=Mountain View/O=Google LLC/CN=smtp.gmail.com
  notBefore = Aug 28 18:23:00 2018 GMT
  notAfter = Nov 20 18:23:00 2018 GMT
  issuer = /C=US/O=Google Trust Services/CN=Google Internet Authority G3
Comparing subject_alt_name: need<smtp.gmail.com> is<smtp.gmail.com>


-------------- 09/18/18 10:02:15 --------------


GitHub Server:

[daily-email fe233e4] 09/18/18 10:02:15: Git Backup
 3 files changed, 95 insertions(+)
 rewrite CatwalkDataFigures_2018-09-18.pdf (95%)
 rewrite MetDataFigures_2018-09-18.pdf (95%)
Tue Sep 18 10:02:15 EDT 2018
To https://github.com/CareyLabVT/SCCData.git
   36478a1..fe233e4  daily-email -> daily-email


Push the Logs to GitHub:

[daily-email 3d5c40b] 09/18/18 10:02:15: Logs
 1 file changed, 11 insertions(+)
Tue Sep 18 10:02:19 EDT 2018
To https://github.com/CareyLabVT/SCCData.git
   fe233e4..3d5c40b  daily-email -> daily-email
[daily-email 571bd98] 09/18/18 10:02:15: Logs
 1 file changed, 5 insertions(+)
Tue Sep 18 10:02:22 EDT 2018
To https://github.com/CareyLabVT/SCCData.git
   3d5c40b..571bd98  daily-email -> daily-email
-e 

-------------- 09/18/18 10:05:42 --------------
-e 

GitHub Server:

Fetching origin
From https://github.com/CareyLabVT/SCCData
   36478a1..571bd98  daily-email -> origin/daily-email
Already up-to-date.


-------------- 09/18/18 10:08:33 --------------


System Status:

Fetching origin
Already up-to-date.
\n\n-------------- 09/18/18 10:10:28 --------------
\n\nEmail Service:\n
*mimetypes-load-control*: can't open or load "~/.mime.types"
Resolving host "smtp.gmail.com:587" ... done
Connecting to "108.177.122.109:587" ...connected.
 Certificate depth 2 
  subject = /OU=GlobalSign Root CA - R2/O=GlobalSign/CN=GlobalSign
  notBefore = Dec 15 08:00:00 2006 GMT
  notAfter = Dec 15 08:00:00 2021 GMT
  issuer = /OU=GlobalSign Root CA - R2/O=GlobalSign/CN=GlobalSign
 Certificate depth 1 
  subject = /C=US/O=Google Trust Services/CN=Google Internet Authority G3
  notBefore = Jun 15 00:00:42 2017 GMT
  notAfter = Dec 15 00:00:42 2021 GMT
  issuer = /OU=GlobalSign Root CA - R2/O=GlobalSign/CN=GlobalSign
 Certificate depth 0 
  subject = /C=US/ST=California/L=Mountain View/O=Google LLC/CN=smtp.gmail.com
  notBefore = Aug 28 18:23:00 2018 GMT
  notAfter = Nov 20 18:23:00 2018 GMT
  issuer = /C=US/O=Google Trust Services/CN=Google Internet Authority G3
Comparing subject_alt_name: need<smtp.gmail.com> is<smtp.gmail.com>


-------------- 09/19/18 06:14:01 --------------


System Status:

Fetching origin
From https://github.com/CareyLabVT/SCCData
   14eb4d0..d56e1c2  carina-data -> origin/carina-data
   4691220..f922b6d  carina-logs -> origin/carina-logs
   8b4c9d5..3bd5bca  george-data -> origin/george-data
   065e2d4..3351629  george-logs -> origin/george-logs
   980bfbe..667c57c  mia-data   -> origin/mia-data
   20af334..7039a14  mia-logs   -> origin/mia-logs
   182abc0..10793cb  noaa-data  -> origin/noaa-data
   51454d3..aeb7ec4  noaa-logs  -> origin/noaa-logs
Already up-to-date.


-------------- 09/19/18 06:15:01 --------------


Email Service:

*mimetypes-load-control*: can't open or load "~/.mime.types"
Resolving host "smtp.gmail.com:587" ... done
Connecting to "64.233.185.108:587" ...connected.
 Certificate depth 2 
  subject = /OU=GlobalSign Root CA - R2/O=GlobalSign/CN=GlobalSign
  notBefore = Dec 15 08:00:00 2006 GMT
  notAfter = Dec 15 08:00:00 2021 GMT
  issuer = /OU=GlobalSign Root CA - R2/O=GlobalSign/CN=GlobalSign
 Certificate depth 1 
  subject = /C=US/O=Google Trust Services/CN=Google Internet Authority G3
  notBefore = Jun 15 00:00:42 2017 GMT
  notAfter = Dec 15 00:00:42 2021 GMT
  issuer = /OU=GlobalSign Root CA - R2/O=GlobalSign/CN=GlobalSign
 Certificate depth 0 
  subject = /C=US/ST=California/L=Mountain View/O=Google LLC/CN=smtp.gmail.com
  notBefore = Sep  4 10:49:00 2018 GMT
  notAfter = Nov 27 10:49:00 2018 GMT
  issuer = /C=US/O=Google Trust Services/CN=Google Internet Authority G3
Comparing subject_alt_name: need<smtp.gmail.com> is<smtp.gmail.com>


-------------- 09/19/18 06:16:01 --------------


GitHub Server:

[daily-email 1b57892] 09/19/18 06:16:01: Git Backup
 5 files changed, 97 insertions(+)
 rewrite CatwalkDataFigures_2018-09-18.pdf (94%)
 create mode 100644 CatwalkDataFigures_2018-09-19.pdf
 rewrite MetDataFigures_2018-09-18.pdf (94%)
 create mode 100644 MetDataFigures_2018-09-19.pdf
Wed Sep 19 06:16:01 EDT 2018
To https://github.com/CareyLabVT/SCCData.git
   571bd98..1b57892  daily-email -> daily-email


Push the Logs to GitHub:

[daily-email a9add3f] 09/19/18 06:16:01: Logs
 1 file changed, 13 insertions(+)
Wed Sep 19 06:16:08 EDT 2018
To https://github.com/CareyLabVT/SCCData.git
   1b57892..a9add3f  daily-email -> daily-email
[daily-email fefb7cb] 09/19/18 06:16:01: Logs
 1 file changed, 5 insertions(+)
Wed Sep 19 06:16:11 EDT 2018
To https://github.com/CareyLabVT/SCCData.git
   a9add3f..fefb7cb  daily-email -> daily-email


-------------- 09/20/18 06:14:01 --------------


System Status:

Fetching origin
From https://github.com/CareyLabVT/SCCData
   d56e1c2..6b2f151  carina-data -> origin/carina-data
   f922b6d..4d86458  carina-logs -> origin/carina-logs
   571bd98..fefb7cb  daily-email -> origin/daily-email
   3bd5bca..c1f71c7  george-data -> origin/george-data
   3351629..a14e1db  george-logs -> origin/george-logs
   667c57c..ecccce3  mia-data   -> origin/mia-data
   7039a14..c29e439  mia-logs   -> origin/mia-logs
   10793cb..b70837a  noaa-data  -> origin/noaa-data
   aeb7ec4..635b03f  noaa-logs  -> origin/noaa-logs
Already up-to-date.


-------------- 09/20/18 06:15:01 --------------


Email Service:

*mimetypes-load-control*: can't open or load "~/.mime.types"
Resolving host "smtp.gmail.com:587" ... done
Connecting to "74.125.21.109:587" ...connected.
 Certificate depth 2 
  subject = /OU=GlobalSign Root CA - R2/O=GlobalSign/CN=GlobalSign
  notBefore = Dec 15 08:00:00 2006 GMT
  notAfter = Dec 15 08:00:00 2021 GMT
  issuer = /OU=GlobalSign Root CA - R2/O=GlobalSign/CN=GlobalSign
 Certificate depth 1 
  subject = /C=US/O=Google Trust Services/CN=Google Internet Authority G3
  notBefore = Jun 15 00:00:42 2017 GMT
  notAfter = Dec 15 00:00:42 2021 GMT
  issuer = /OU=GlobalSign Root CA - R2/O=GlobalSign/CN=GlobalSign
 Certificate depth 0 
  subject = /C=US/ST=California/L=Mountain View/O=Google LLC/CN=smtp.gmail.com
  notBefore = Aug 28 18:23:00 2018 GMT
  notAfter = Nov 20 18:23:00 2018 GMT
  issuer = /C=US/O=Google Trust Services/CN=Google Internet Authority G3
Comparing subject_alt_name: need<smtp.gmail.com> is<smtp.gmail.com>


-------------- 09/20/18 06:16:01 --------------


GitHub Server:

[daily-email 4a22ea1] 09/20/18 06:16:01: Git Backup
 3 files changed, 57 insertions(+)
 create mode 100644 CatwalkDataFigures_2018-09-20.pdf
 create mode 100644 MetDataFigures_2018-09-20.pdf
Thu Sep 20 06:16:01 EDT 2018
To https://github.com/CareyLabVT/SCCData.git
   fefb7cb..4a22ea1  daily-email -> daily-email


Push the Logs to GitHub:

[daily-email fbc73d0] 09/20/18 06:16:01: Logs
 1 file changed, 11 insertions(+)
Thu Sep 20 06:16:06 EDT 2018
To https://github.com/CareyLabVT/SCCData.git
   4a22ea1..fbc73d0  daily-email -> daily-email
[daily-email 169c1f9] 09/20/18 06:16:01: Logs
 1 file changed, 5 insertions(+)
Thu Sep 20 06:16:11 EDT 2018
To https://github.com/CareyLabVT/SCCData.git
   fbc73d0..169c1f9  daily-email -> daily-email


-------------- 09/21/18 06:14:01 --------------


System Status:

Fetching origin
From https://github.com/CareyLabVT/SCCData
   6b2f151..a9843f7  carina-data -> origin/carina-data
   4d86458..3795c7b  carina-logs -> origin/carina-logs
   fefb7cb..169c1f9  daily-email -> origin/daily-email
   a14e1db..5a1614d  george-logs -> origin/george-logs
   ecccce3..54cef20  mia-data   -> origin/mia-data
   c29e439..f58c661  mia-logs   -> origin/mia-logs
   b70837a..956fd79  noaa-data  -> origin/noaa-data
   635b03f..d47a614  noaa-logs  -> origin/noaa-logs
Already up-to-date.


-------------- 09/21/18 06:15:01 --------------


Email Service:

*mimetypes-load-control*: can't open or load "~/.mime.types"
Resolving host "smtp.gmail.com:587" ... done
Connecting to "74.125.21.108:587" ...connected.
 Certificate depth 2 
  subject = /OU=GlobalSign Root CA - R2/O=GlobalSign/CN=GlobalSign
  notBefore = Dec 15 08:00:00 2006 GMT
  notAfter = Dec 15 08:00:00 2021 GMT
  issuer = /OU=GlobalSign Root CA - R2/O=GlobalSign/CN=GlobalSign
 Certificate depth 1 
  subject = /C=US/O=Google Trust Services/CN=Google Internet Authority G3
  notBefore = Jun 15 00:00:42 2017 GMT
  notAfter = Dec 15 00:00:42 2021 GMT
  issuer = /OU=GlobalSign Root CA - R2/O=GlobalSign/CN=GlobalSign
 Certificate depth 0 
  subject = /C=US/ST=California/L=Mountain View/O=Google LLC/CN=smtp.gmail.com
  notBefore = Sep  4 10:49:00 2018 GMT
  notAfter = Nov 27 10:49:00 2018 GMT
  issuer = /C=US/O=Google Trust Services/CN=Google Internet Authority G3
Comparing subject_alt_name: need<smtp.gmail.com> is<smtp.gmail.com>


-------------- 09/21/18 06:16:01 --------------


GitHub Server:

[daily-email e15bbc5] 09/21/18 06:16:01: Git Backup
 3 files changed, 56 insertions(+)
 create mode 100644 CatwalkDataFigures_2018-09-21.pdf
 create mode 100644 MetDataFigures_2018-09-21.pdf
Fri Sep 21 06:16:01 EDT 2018
To https://github.com/CareyLabVT/SCCData.git
   169c1f9..e15bbc5  daily-email -> daily-email


Push the Logs to GitHub:

[daily-email 4dbc04d] 09/21/18 06:16:01: Logs
 1 file changed, 11 insertions(+)
Fri Sep 21 06:16:07 EDT 2018
To https://github.com/CareyLabVT/SCCData.git
   e15bbc5..4dbc04d  daily-email -> daily-email
[daily-email f285bb5] 09/21/18 06:16:01: Logs
 1 file changed, 5 insertions(+)
Fri Sep 21 06:16:10 EDT 2018
To https://github.com/CareyLabVT/SCCData.git
   4dbc04d..f285bb5  daily-email -> daily-email


-------------- 09/22/18 06:14:01 --------------


System Status:

Fetching origin
From https://github.com/CareyLabVT/SCCData
   a9843f7..473926c  carina-data -> origin/carina-data
   3795c7b..ca1df68  carina-logs -> origin/carina-logs
   169c1f9..f285bb5  daily-email -> origin/daily-email
   5a1614d..0523169  george-logs -> origin/george-logs
   54cef20..ae246d0  mia-data   -> origin/mia-data
   f58c661..c418311  mia-logs   -> origin/mia-logs
   956fd79..05004a1  noaa-data  -> origin/noaa-data
   d47a614..d29748d  noaa-logs  -> origin/noaa-logs
Already up-to-date.


-------------- 09/22/18 06:15:01 --------------


Email Service:

*mimetypes-load-control*: can't open or load "~/.mime.types"
Resolving host "smtp.gmail.com:587" ... done
Connecting to "74.125.196.109:587" ...connected.
 Certificate depth 2 
  subject = /OU=GlobalSign Root CA - R2/O=GlobalSign/CN=GlobalSign
  notBefore = Dec 15 08:00:00 2006 GMT
  notAfter = Dec 15 08:00:00 2021 GMT
  issuer = /OU=GlobalSign Root CA - R2/O=GlobalSign/CN=GlobalSign
 Certificate depth 1 
  subject = /C=US/O=Google Trust Services/CN=Google Internet Authority G3
  notBefore = Jun 15 00:00:42 2017 GMT
  notAfter = Dec 15 00:00:42 2021 GMT
  issuer = /OU=GlobalSign Root CA - R2/O=GlobalSign/CN=GlobalSign
 Certificate depth 0 
  subject = /C=US/ST=California/L=Mountain View/O=Google LLC/CN=smtp.gmail.com
  notBefore = Sep  4 10:49:00 2018 GMT
  notAfter = Nov 27 10:49:00 2018 GMT
  issuer = /C=US/O=Google Trust Services/CN=Google Internet Authority G3
Comparing subject_alt_name: need<smtp.gmail.com> is<smtp.gmail.com>


-------------- 09/22/18 06:16:01 --------------


GitHub Server:

[daily-email 5941efc] 09/22/18 06:16:01: Git Backup
 3 files changed, 56 insertions(+)
 create mode 100644 CatwalkDataFigures_2018-09-22.pdf
 create mode 100644 MetDataFigures_2018-09-22.pdf
Sat Sep 22 06:16:01 EDT 2018
To https://github.com/CareyLabVT/SCCData.git
   f285bb5..5941efc  daily-email -> daily-email


Push the Logs to GitHub:

[daily-email f099ec9] 09/22/18 06:16:01: Logs
 1 file changed, 11 insertions(+)
Sat Sep 22 06:16:06 EDT 2018
To https://github.com/CareyLabVT/SCCData.git
   5941efc..f099ec9  daily-email -> daily-email
[daily-email 9f9ac23] 09/22/18 06:16:01: Logs
 1 file changed, 5 insertions(+)
Sat Sep 22 06:16:10 EDT 2018
To https://github.com/CareyLabVT/SCCData.git
   f099ec9..9f9ac23  daily-email -> daily-email


-------------- 09/23/18 06:14:01 --------------


System Status:

Fetching origin
From https://github.com/CareyLabVT/SCCData
   473926c..8a632bb  carina-data -> origin/carina-data
   ca1df68..d30e70e  carina-logs -> origin/carina-logs
   f285bb5..9f9ac23  daily-email -> origin/daily-email
   0523169..f63698a  george-logs -> origin/george-logs
   ae246d0..2873bbb  mia-data   -> origin/mia-data
   c418311..1572537  mia-logs   -> origin/mia-logs
   05004a1..461d91d  noaa-data  -> origin/noaa-data
   d29748d..b7325f9  noaa-logs  -> origin/noaa-logs
Already up-to-date.


-------------- 09/23/18 06:15:01 --------------


Email Service:

*mimetypes-load-control*: can't open or load "~/.mime.types"
Resolving host "smtp.gmail.com:587" ... done
Connecting to "64.233.185.109:587" ...connected.
 Certificate depth 2 
  subject = /OU=GlobalSign Root CA - R2/O=GlobalSign/CN=GlobalSign
  notBefore = Dec 15 08:00:00 2006 GMT
  notAfter = Dec 15 08:00:00 2021 GMT
  issuer = /OU=GlobalSign Root CA - R2/O=GlobalSign/CN=GlobalSign
 Certificate depth 1 
  subject = /C=US/O=Google Trust Services/CN=Google Internet Authority G3
  notBefore = Jun 15 00:00:42 2017 GMT
  notAfter = Dec 15 00:00:42 2021 GMT
  issuer = /OU=GlobalSign Root CA - R2/O=GlobalSign/CN=GlobalSign
 Certificate depth 0 
  subject = /C=US/ST=California/L=Mountain View/O=Google LLC/CN=smtp.gmail.com
  notBefore = Sep  4 10:49:00 2018 GMT
  notAfter = Nov 27 10:49:00 2018 GMT
  issuer = /C=US/O=Google Trust Services/CN=Google Internet Authority G3
Comparing subject_alt_name: need<smtp.gmail.com> is<smtp.gmail.com>


-------------- 09/23/18 06:16:01 --------------


GitHub Server:

[daily-email 980585a] 09/23/18 06:16:01: Git Backup
 3 files changed, 56 insertions(+)
 create mode 100644 CatwalkDataFigures_2018-09-23.pdf
 create mode 100644 MetDataFigures_2018-09-23.pdf
Sun Sep 23 06:16:01 EDT 2018
To https://github.com/CareyLabVT/SCCData.git
   9f9ac23..980585a  daily-email -> daily-email


Push the Logs to GitHub:

[daily-email fe2efc7] 09/23/18 06:16:01: Logs
 1 file changed, 11 insertions(+)
Sun Sep 23 06:16:07 EDT 2018
To https://github.com/CareyLabVT/SCCData.git
   980585a..fe2efc7  daily-email -> daily-email
[daily-email e15792c] 09/23/18 06:16:01: Logs
 1 file changed, 5 insertions(+)
Sun Sep 23 06:16:10 EDT 2018
To https://github.com/CareyLabVT/SCCData.git
   fe2efc7..e15792c  daily-email -> daily-email


-------------- 09/24/18 06:14:01 --------------


System Status:

Fetching origin
From https://github.com/CareyLabVT/SCCData
   8a632bb..7cd3c02  carina-data -> origin/carina-data
   d30e70e..559696f  carina-logs -> origin/carina-logs
   9f9ac23..e15792c  daily-email -> origin/daily-email
   f63698a..15f3a0f  george-logs -> origin/george-logs
   2873bbb..a4e2972  mia-data   -> origin/mia-data
   1572537..97c7c34  mia-logs   -> origin/mia-logs
   461d91d..8cc38b6  noaa-data  -> origin/noaa-data
   b7325f9..0aa5f47  noaa-logs  -> origin/noaa-logs
Already up-to-date.


-------------- 09/24/18 06:15:01 --------------


Email Service:

*mimetypes-load-control*: can't open or load "~/.mime.types"
Resolving host "smtp.gmail.com:587" ... done
Connecting to "108.177.122.109:587" ...connected.
 Certificate depth 2 
  subject = /OU=GlobalSign Root CA - R2/O=GlobalSign/CN=GlobalSign
  notBefore = Dec 15 08:00:00 2006 GMT
  notAfter = Dec 15 08:00:00 2021 GMT
  issuer = /OU=GlobalSign Root CA - R2/O=GlobalSign/CN=GlobalSign
 Certificate depth 1 
  subject = /C=US/O=Google Trust Services/CN=Google Internet Authority G3
  notBefore = Jun 15 00:00:42 2017 GMT
  notAfter = Dec 15 00:00:42 2021 GMT
  issuer = /OU=GlobalSign Root CA - R2/O=GlobalSign/CN=GlobalSign
 Certificate depth 0 
  subject = /C=US/ST=California/L=Mountain View/O=Google LLC/CN=smtp.gmail.com
  notBefore = Sep  4 10:49:00 2018 GMT
  notAfter = Nov 27 10:49:00 2018 GMT
  issuer = /C=US/O=Google Trust Services/CN=Google Internet Authority G3
Comparing subject_alt_name: need<smtp.gmail.com> is<smtp.gmail.com>


-------------- 09/24/18 06:16:01 --------------


GitHub Server:

[daily-email 7f80bf0] 09/24/18 06:16:01: Git Backup
 3 files changed, 56 insertions(+)
 create mode 100644 CatwalkDataFigures_2018-09-24.pdf
 create mode 100644 MetDataFigures_2018-09-24.pdf
Mon Sep 24 06:16:01 EDT 2018
To https://github.com/CareyLabVT/SCCData.git
   e15792c..7f80bf0  daily-email -> daily-email


Push the Logs to GitHub:

[daily-email c9ca66e] 09/24/18 06:16:01: Logs
 1 file changed, 11 insertions(+)
Mon Sep 24 06:16:08 EDT 2018
To https://github.com/CareyLabVT/SCCData.git
   7f80bf0..c9ca66e  daily-email -> daily-email
[daily-email 06f463d] 09/24/18 06:16:01: Logs
 1 file changed, 5 insertions(+)
Mon Sep 24 06:16:12 EDT 2018
To https://github.com/CareyLabVT/SCCData.git
   c9ca66e..06f463d  daily-email -> daily-email


-------------- 09/25/18 06:14:01 --------------


System Status:

Fetching origin
From https://github.com/CareyLabVT/SCCData
   7cd3c02..f72039c  carina-data -> origin/carina-data
   559696f..4b7bf91  carina-logs -> origin/carina-logs
   e15792c..06f463d  daily-email -> origin/daily-email
   15f3a0f..311d2e4  george-logs -> origin/george-logs
   a4e2972..d1e57ef  mia-data   -> origin/mia-data
   97c7c34..f3fbf45  mia-logs   -> origin/mia-logs
   8cc38b6..21dffee  noaa-data  -> origin/noaa-data
   0aa5f47..988e7c6  noaa-logs  -> origin/noaa-logs
Already up-to-date.


-------------- 09/25/18 06:15:01 --------------


Email Service:

*mimetypes-load-control*: can't open or load "~/.mime.types"
Resolving host "smtp.gmail.com:587" ... done
Connecting to "108.177.122.109:587" ...connected.
 Certificate depth 2 
  subject = /OU=GlobalSign Root CA - R2/O=GlobalSign/CN=GlobalSign
  notBefore = Dec 15 08:00:00 2006 GMT
  notAfter = Dec 15 08:00:00 2021 GMT
  issuer = /OU=GlobalSign Root CA - R2/O=GlobalSign/CN=GlobalSign
 Certificate depth 1 
  subject = /C=US/O=Google Trust Services/CN=Google Internet Authority G3
  notBefore = Jun 15 00:00:42 2017 GMT
  notAfter = Dec 15 00:00:42 2021 GMT
  issuer = /OU=GlobalSign Root CA - R2/O=GlobalSign/CN=GlobalSign
 Certificate depth 0 
  subject = /C=US/ST=California/L=Mountain View/O=Google LLC/CN=smtp.gmail.com
  notBefore = Sep  4 10:49:00 2018 GMT
  notAfter = Nov 27 10:49:00 2018 GMT
  issuer = /C=US/O=Google Trust Services/CN=Google Internet Authority G3
Comparing subject_alt_name: need<smtp.gmail.com> is<smtp.gmail.com>


-------------- 09/25/18 06:16:01 --------------


GitHub Server:

[daily-email 3e1d0d5] 09/25/18 06:16:01: Git Backup
 3 files changed, 636 insertions(+)
 create mode 100644 CatwalkDataFigures_2018-09-25.pdf
 create mode 100644 MetDataFigures_2018-09-25.pdf
Tue Sep 25 06:16:01 EDT 2018
To https://github.com/CareyLabVT/SCCData.git
   06f463d..3e1d0d5  daily-email -> daily-email


Push the Logs to GitHub:

[daily-email 200d182] 09/25/18 06:16:01: Logs
 1 file changed, 11 insertions(+)
Tue Sep 25 06:16:07 EDT 2018
To https://github.com/CareyLabVT/SCCData.git
   3e1d0d5..200d182  daily-email -> daily-email
[daily-email 85d7dc0] 09/25/18 06:16:01: Logs
 1 file changed, 5 insertions(+)
Tue Sep 25 06:16:11 EDT 2018
To https://github.com/CareyLabVT/SCCData.git
   200d182..85d7dc0  daily-email -> daily-email


-------------- 09/26/18 06:14:01 --------------


System Status:

Fetching origin
From https://github.com/CareyLabVT/SCCData
   f72039c..f7cbfc9  carina-data -> origin/carina-data
   4b7bf91..b99efeb  carina-logs -> origin/carina-logs
   06f463d..85d7dc0  daily-email -> origin/daily-email
   c1f71c7..295d80b  george-data -> origin/george-data
   311d2e4..8f33036  george-logs -> origin/george-logs
   d1e57ef..d19b736  mia-data   -> origin/mia-data
   f3fbf45..64a5840  mia-logs   -> origin/mia-logs
   21dffee..7a1dd56  noaa-data  -> origin/noaa-data
   988e7c6..da64c83  noaa-logs  -> origin/noaa-logs
Already up-to-date.


-------------- 09/26/18 06:15:01 --------------


Email Service:

*mimetypes-load-control*: can't open or load "~/.mime.types"
Resolving host "smtp.gmail.com:587" ... done
Connecting to "64.233.177.109:587" ...connected.
 Certificate depth 2 
  subject = /OU=GlobalSign Root CA - R2/O=GlobalSign/CN=GlobalSign
  notBefore = Dec 15 08:00:00 2006 GMT
  notAfter = Dec 15 08:00:00 2021 GMT
  issuer = /OU=GlobalSign Root CA - R2/O=GlobalSign/CN=GlobalSign
 Certificate depth 1 
  subject = /C=US/O=Google Trust Services/CN=Google Internet Authority G3
  notBefore = Jun 15 00:00:42 2017 GMT
  notAfter = Dec 15 00:00:42 2021 GMT
  issuer = /OU=GlobalSign Root CA - R2/O=GlobalSign/CN=GlobalSign
 Certificate depth 0 
  subject = /C=US/ST=California/L=Mountain View/O=Google LLC/CN=smtp.gmail.com
  notBefore = Sep  4 10:49:00 2018 GMT
  notAfter = Nov 27 10:49:00 2018 GMT
  issuer = /C=US/O=Google Trust Services/CN=Google Internet Authority G3
Comparing subject_alt_name: need<smtp.gmail.com> is<smtp.gmail.com>


-------------- 09/26/18 06:16:01 --------------


GitHub Server:

[daily-email 025faa4] 09/26/18 06:16:01: Git Backup
 3 files changed, 57 insertions(+)
 create mode 100644 CatwalkDataFigures_2018-09-26.pdf
 create mode 100644 MetDataFigures_2018-09-26.pdf
Wed Sep 26 06:16:01 EDT 2018
To https://github.com/CareyLabVT/SCCData.git
   85d7dc0..025faa4  daily-email -> daily-email


Push the Logs to GitHub:

[daily-email edb5b72] 09/26/18 06:16:01: Logs
 1 file changed, 11 insertions(+)
Wed Sep 26 06:16:07 EDT 2018
To https://github.com/CareyLabVT/SCCData.git
   025faa4..edb5b72  daily-email -> daily-email
[daily-email 7443895] 09/26/18 06:16:01: Logs
 1 file changed, 5 insertions(+)
Wed Sep 26 06:16:10 EDT 2018
To https://github.com/CareyLabVT/SCCData.git
   edb5b72..7443895  daily-email -> daily-email


-------------- 09/27/18 06:14:00 --------------


System Status:

Fetching origin
From https://github.com/CareyLabVT/SCCData
   f7cbfc9..47dd57c  carina-data -> origin/carina-data
   b99efeb..7e1c539  carina-logs -> origin/carina-logs
   85d7dc0..7443895  daily-email -> origin/daily-email
   295d80b..8d21cfb  george-data -> origin/george-data
   8f33036..98f294c  george-logs -> origin/george-logs
   d19b736..2c05d00  mia-data   -> origin/mia-data
   64a5840..a948324  mia-logs   -> origin/mia-logs
   7a1dd56..7b6ed95  noaa-data  -> origin/noaa-data
   da64c83..e0c3ec5  noaa-logs  -> origin/noaa-logs
Already up-to-date.


-------------- 09/27/18 06:15:01 --------------


Email Service:

*mimetypes-load-control*: can't open or load "~/.mime.types"
Resolving host "smtp.gmail.com:587" ... done
Connecting to "64.233.185.108:587" ...connected.
 Certificate depth 2 
  subject = /OU=GlobalSign Root CA - R2/O=GlobalSign/CN=GlobalSign
  notBefore = Dec 15 08:00:00 2006 GMT
  notAfter = Dec 15 08:00:00 2021 GMT
  issuer = /OU=GlobalSign Root CA - R2/O=GlobalSign/CN=GlobalSign
 Certificate depth 1 
  subject = /C=US/O=Google Trust Services/CN=Google Internet Authority G3
  notBefore = Jun 15 00:00:42 2017 GMT
  notAfter = Dec 15 00:00:42 2021 GMT
  issuer = /OU=GlobalSign Root CA - R2/O=GlobalSign/CN=GlobalSign
 Certificate depth 0 
  subject = /C=US/ST=California/L=Mountain View/O=Google LLC/CN=smtp.gmail.com
  notBefore = Sep 11 21:04:00 2018 GMT
  notAfter = Dec  4 21:04:00 2018 GMT
  issuer = /C=US/O=Google Trust Services/CN=Google Internet Authority G3
Comparing subject_alt_name: need<smtp.gmail.com> is<smtp.gmail.com>


-------------- 09/27/18 06:16:01 --------------


GitHub Server:

[daily-email 12b5e55] 09/27/18 06:16:01: Git Backup
 3 files changed, 579 insertions(+)
 create mode 100644 CatwalkDataFigures_2018-09-27.pdf
 create mode 100644 MetDataFigures_2018-09-27.pdf
Thu Sep 27 06:16:01 EDT 2018
To https://github.com/CareyLabVT/SCCData.git
   7443895..12b5e55  daily-email -> daily-email


Push the Logs to GitHub:

[daily-email e8a4cfd] 09/27/18 06:16:01: Logs
 1 file changed, 11 insertions(+)
Thu Sep 27 06:16:07 EDT 2018
To https://github.com/CareyLabVT/SCCData.git
   12b5e55..e8a4cfd  daily-email -> daily-email
[daily-email 703d397] 09/27/18 06:16:01: Logs
 1 file changed, 5 insertions(+)
Thu Sep 27 06:16:10 EDT 2018
To https://github.com/CareyLabVT/SCCData.git
   e8a4cfd..703d397  daily-email -> daily-email


-------------- 09/28/18 06:14:00 --------------


System Status:

Fetching origin
From https://github.com/CareyLabVT/SCCData
   47dd57c..0f62886  carina-data -> origin/carina-data
   7e1c539..052bace  carina-logs -> origin/carina-logs
   7443895..703d397  daily-email -> origin/daily-email
   8d21cfb..6c0ffa3  george-data -> origin/george-data
   98f294c..4fee388  george-logs -> origin/george-logs
   2c05d00..67300e2  mia-data   -> origin/mia-data
   a948324..4cabc18  mia-logs   -> origin/mia-logs
   7b6ed95..4d7d752  noaa-data  -> origin/noaa-data
   e0c3ec5..0fc291a  noaa-logs  -> origin/noaa-logs
Already up-to-date.


-------------- 09/28/18 06:15:01 --------------


Email Service:

*mimetypes-load-control*: can't open or load "~/.mime.types"
Resolving host "smtp.gmail.com:587" ... done
Connecting to "74.125.21.108:587" ...connected.
 Certificate depth 2 
  subject = /OU=GlobalSign Root CA - R2/O=GlobalSign/CN=GlobalSign
  notBefore = Dec 15 08:00:00 2006 GMT
  notAfter = Dec 15 08:00:00 2021 GMT
  issuer = /OU=GlobalSign Root CA - R2/O=GlobalSign/CN=GlobalSign
 Certificate depth 1 
  subject = /C=US/O=Google Trust Services/CN=Google Internet Authority G3
  notBefore = Jun 15 00:00:42 2017 GMT
  notAfter = Dec 15 00:00:42 2021 GMT
  issuer = /OU=GlobalSign Root CA - R2/O=GlobalSign/CN=GlobalSign
 Certificate depth 0 
  subject = /C=US/ST=California/L=Mountain View/O=Google LLC/CN=smtp.gmail.com
  notBefore = Sep  4 10:49:00 2018 GMT
  notAfter = Nov 27 10:49:00 2018 GMT
  issuer = /C=US/O=Google Trust Services/CN=Google Internet Authority G3
Comparing subject_alt_name: need<smtp.gmail.com> is<smtp.gmail.com>


-------------- 09/28/18 06:16:01 --------------


GitHub Server:

[daily-email 5eb8732] 09/28/18 06:16:01: Git Backup
 3 files changed, 57 insertions(+)
 create mode 100644 CatwalkDataFigures_2018-09-28.pdf
 create mode 100644 MetDataFigures_2018-09-28.pdf
Fri Sep 28 06:16:01 EDT 2018
To https://github.com/CareyLabVT/SCCData.git
   703d397..5eb8732  daily-email -> daily-email


Push the Logs to GitHub:

[daily-email e8aced2] 09/28/18 06:16:01: Logs
 1 file changed, 11 insertions(+)
Fri Sep 28 06:16:07 EDT 2018
To https://github.com/CareyLabVT/SCCData.git
   5eb8732..e8aced2  daily-email -> daily-email
[daily-email 6d95012] 09/28/18 06:16:01: Logs
 1 file changed, 5 insertions(+)
Fri Sep 28 06:16:10 EDT 2018
To https://github.com/CareyLabVT/SCCData.git
   e8aced2..6d95012  daily-email -> daily-email


-------------- 09/29/18 06:14:01 --------------


System Status:

Fetching origin
From https://github.com/CareyLabVT/SCCData
   0f62886..b77f7f0  carina-data -> origin/carina-data
   052bace..62f5bec  carina-logs -> origin/carina-logs
   703d397..6d95012  daily-email -> origin/daily-email
   6c0ffa3..fec2c9c  george-data -> origin/george-data
   4fee388..86492d0  george-logs -> origin/george-logs
   67300e2..88bc078  mia-data   -> origin/mia-data
   4cabc18..117d239  mia-logs   -> origin/mia-logs
   4d7d752..dc7c3fd  noaa-data  -> origin/noaa-data
   0fc291a..2bd8d85  noaa-logs  -> origin/noaa-logs
Already up-to-date.


-------------- 09/29/18 06:15:01 --------------


Email Service:

*mimetypes-load-control*: can't open or load "~/.mime.types"
Resolving host "smtp.gmail.com:587" ... done
Connecting to "64.233.185.109:587" ...connected.
 Certificate depth 2 
  subject = /OU=GlobalSign Root CA - R2/O=GlobalSign/CN=GlobalSign
  notBefore = Dec 15 08:00:00 2006 GMT
  notAfter = Dec 15 08:00:00 2021 GMT
  issuer = /OU=GlobalSign Root CA - R2/O=GlobalSign/CN=GlobalSign
 Certificate depth 1 
  subject = /C=US/O=Google Trust Services/CN=Google Internet Authority G3
  notBefore = Jun 15 00:00:42 2017 GMT
  notAfter = Dec 15 00:00:42 2021 GMT
  issuer = /OU=GlobalSign Root CA - R2/O=GlobalSign/CN=GlobalSign
 Certificate depth 0 
  subject = /C=US/ST=California/L=Mountain View/O=Google LLC/CN=smtp.gmail.com
  notBefore = Sep 11 21:04:00 2018 GMT
  notAfter = Dec  4 21:04:00 2018 GMT
  issuer = /C=US/O=Google Trust Services/CN=Google Internet Authority G3
Comparing subject_alt_name: need<smtp.gmail.com> is<smtp.gmail.com>


-------------- 09/29/18 06:16:01 --------------


GitHub Server:

[daily-email b175f74] 09/29/18 06:16:01: Git Backup
 3 files changed, 57 insertions(+)
 create mode 100644 CatwalkDataFigures_2018-09-29.pdf
 create mode 100644 MetDataFigures_2018-09-29.pdf
Sat Sep 29 06:16:01 EDT 2018
To https://github.com/CareyLabVT/SCCData.git
   6d95012..b175f74  daily-email -> daily-email


Push the Logs to GitHub:

[daily-email d6389f5] 09/29/18 06:16:01: Logs
 1 file changed, 11 insertions(+)
Sat Sep 29 06:16:06 EDT 2018
To https://github.com/CareyLabVT/SCCData.git
   b175f74..d6389f5  daily-email -> daily-email
[daily-email 1c7a246] 09/29/18 06:16:01: Logs
 1 file changed, 5 insertions(+)
Sat Sep 29 06:16:10 EDT 2018
To https://github.com/CareyLabVT/SCCData.git
   d6389f5..1c7a246  daily-email -> daily-email


-------------- 09/30/18 06:14:01 --------------


System Status:

Fetching origin
From https://github.com/CareyLabVT/SCCData
   b77f7f0..96eb0d4  carina-data -> origin/carina-data
   62f5bec..94b7779  carina-logs -> origin/carina-logs
   6d95012..1c7a246  daily-email -> origin/daily-email
   fec2c9c..5e706d5  george-data -> origin/george-data
   86492d0..c310930  george-logs -> origin/george-logs
   88bc078..83579c4  mia-data   -> origin/mia-data
   117d239..017b557  mia-logs   -> origin/mia-logs
   dc7c3fd..3763481  noaa-data  -> origin/noaa-data
   2bd8d85..ba6fe1d  noaa-logs  -> origin/noaa-logs
Already up-to-date.


-------------- 09/30/18 06:15:01 --------------


Email Service:

*mimetypes-load-control*: can't open or load "~/.mime.types"
Resolving host "smtp.gmail.com:587" ... done
Connecting to "74.125.136.109:587" ...connected.
 Certificate depth 2 
  subject = /OU=GlobalSign Root CA - R2/O=GlobalSign/CN=GlobalSign
  notBefore = Dec 15 08:00:00 2006 GMT
  notAfter = Dec 15 08:00:00 2021 GMT
  issuer = /OU=GlobalSign Root CA - R2/O=GlobalSign/CN=GlobalSign
 Certificate depth 1 
  subject = /C=US/O=Google Trust Services/CN=Google Internet Authority G3
  notBefore = Jun 15 00:00:42 2017 GMT
  notAfter = Dec 15 00:00:42 2021 GMT
  issuer = /OU=GlobalSign Root CA - R2/O=GlobalSign/CN=GlobalSign
 Certificate depth 0 
  subject = /C=US/ST=California/L=Mountain View/O=Google LLC/CN=smtp.gmail.com
  notBefore = Sep 11 21:04:00 2018 GMT
  notAfter = Dec  4 21:04:00 2018 GMT
  issuer = /C=US/O=Google Trust Services/CN=Google Internet Authority G3
Comparing subject_alt_name: need<smtp.gmail.com> is<smtp.gmail.com>


-------------- 09/30/18 06:16:01 --------------


GitHub Server:

[daily-email 299105b] 09/30/18 06:16:01: Git Backup
 3 files changed, 57 insertions(+)
 create mode 100644 CatwalkDataFigures_2018-09-30.pdf
 create mode 100644 MetDataFigures_2018-09-30.pdf
Sun Sep 30 06:16:01 EDT 2018
To https://github.com/CareyLabVT/SCCData.git
   1c7a246..299105b  daily-email -> daily-email


Push the Logs to GitHub:

[daily-email e8fd62c] 09/30/18 06:16:01: Logs
 1 file changed, 11 insertions(+)
Sun Sep 30 06:16:05 EDT 2018
To https://github.com/CareyLabVT/SCCData.git
   299105b..e8fd62c  daily-email -> daily-email
[daily-email 3dfcadd] 09/30/18 06:16:01: Logs
 1 file changed, 5 insertions(+)
Sun Sep 30 06:16:09 EDT 2018
To https://github.com/CareyLabVT/SCCData.git
   e8fd62c..3dfcadd  daily-email -> daily-email


-------------- 10/01/18 06:14:01 --------------


System Status:

Fetching origin
From https://github.com/CareyLabVT/SCCData
   96eb0d4..3c592c7  carina-data -> origin/carina-data
   94b7779..02cd627  carina-logs -> origin/carina-logs
   1c7a246..3dfcadd  daily-email -> origin/daily-email
   5e706d5..8c250cf  george-data -> origin/george-data
   c310930..725d86e  george-logs -> origin/george-logs
   83579c4..f323621  mia-data   -> origin/mia-data
   017b557..e4e5969  mia-logs   -> origin/mia-logs
   3763481..d1d5a6c  noaa-data  -> origin/noaa-data
   ba6fe1d..98517f9  noaa-logs  -> origin/noaa-logs
Already up-to-date.


-------------- 10/01/18 06:15:01 --------------


Email Service:

*mimetypes-load-control*: can't open or load "~/.mime.types"
Resolving host "smtp.gmail.com:587" ... done
Connecting to "64.233.185.108:587" ...connected.
 Certificate depth 2 
  subject = /OU=GlobalSign Root CA - R2/O=GlobalSign/CN=GlobalSign
  notBefore = Dec 15 08:00:00 2006 GMT
  notAfter = Dec 15 08:00:00 2021 GMT
  issuer = /OU=GlobalSign Root CA - R2/O=GlobalSign/CN=GlobalSign
 Certificate depth 1 
  subject = /C=US/O=Google Trust Services/CN=Google Internet Authority G3
  notBefore = Jun 15 00:00:42 2017 GMT
  notAfter = Dec 15 00:00:42 2021 GMT
  issuer = /OU=GlobalSign Root CA - R2/O=GlobalSign/CN=GlobalSign
 Certificate depth 0 
  subject = /C=US/ST=California/L=Mountain View/O=Google LLC/CN=smtp.gmail.com
  notBefore = Sep 11 21:04:00 2018 GMT
  notAfter = Dec  4 21:04:00 2018 GMT
  issuer = /C=US/O=Google Trust Services/CN=Google Internet Authority G3
Comparing subject_alt_name: need<smtp.gmail.com> is<smtp.gmail.com>


-------------- 10/01/18 06:16:01 --------------


GitHub Server:

[daily-email 619d4e3] 10/01/18 06:16:01: Git Backup
 3 files changed, 57 insertions(+)
 create mode 100644 CatwalkDataFigures_2018-10-01.pdf
 create mode 100644 MetDataFigures_2018-10-01.pdf
Mon Oct 1 06:16:01 EDT 2018
To https://github.com/CareyLabVT/SCCData.git
   3dfcadd..619d4e3  daily-email -> daily-email


Push the Logs to GitHub:

[daily-email 66e66bc] 10/01/18 06:16:01: Logs
 1 file changed, 11 insertions(+)
Mon Oct 1 06:16:07 EDT 2018
To https://github.com/CareyLabVT/SCCData.git
   619d4e3..66e66bc  daily-email -> daily-email
[daily-email a396282] 10/01/18 06:16:01: Logs
 1 file changed, 5 insertions(+)
Mon Oct 1 06:16:10 EDT 2018
To https://github.com/CareyLabVT/SCCData.git
   66e66bc..a396282  daily-email -> daily-email


-------------- 10/02/18 06:14:01 --------------


System Status:

Fetching origin
From https://github.com/CareyLabVT/SCCData
   3c592c7..fc4182f  carina-data -> origin/carina-data
   02cd627..07c7d2a  carina-logs -> origin/carina-logs
   3dfcadd..a396282  daily-email -> origin/daily-email
   8c250cf..0cea6b7  george-data -> origin/george-data
   725d86e..6f99e39  george-logs -> origin/george-logs
   f323621..ca9690a  mia-data   -> origin/mia-data
   e4e5969..083a262  mia-logs   -> origin/mia-logs
   d1d5a6c..4caca0d  noaa-data  -> origin/noaa-data
   98517f9..f9e66df  noaa-logs  -> origin/noaa-logs
Already up-to-date.


-------------- 10/02/18 06:15:01 --------------


Email Service:

*mimetypes-load-control*: can't open or load "~/.mime.types"
Resolving host "smtp.gmail.com:587" ... done
Connecting to "108.177.122.109:587" ...connected.
 Certificate depth 2 
  subject = /OU=GlobalSign Root CA - R2/O=GlobalSign/CN=GlobalSign
  notBefore = Dec 15 08:00:00 2006 GMT
  notAfter = Dec 15 08:00:00 2021 GMT
  issuer = /OU=GlobalSign Root CA - R2/O=GlobalSign/CN=GlobalSign
 Certificate depth 1 
  subject = /C=US/O=Google Trust Services/CN=Google Internet Authority G3
  notBefore = Jun 15 00:00:42 2017 GMT
  notAfter = Dec 15 00:00:42 2021 GMT
  issuer = /OU=GlobalSign Root CA - R2/O=GlobalSign/CN=GlobalSign
 Certificate depth 0 
  subject = /C=US/ST=California/L=Mountain View/O=Google LLC/CN=smtp.gmail.com
  notBefore = Sep 11 21:04:00 2018 GMT
  notAfter = Dec  4 21:04:00 2018 GMT
  issuer = /C=US/O=Google Trust Services/CN=Google Internet Authority G3
Comparing subject_alt_name: need<smtp.gmail.com> is<smtp.gmail.com>


-------------- 10/02/18 06:16:01 --------------


GitHub Server:

[daily-email e880c9e] 10/02/18 06:16:01: Git Backup
 5 files changed, 57 insertions(+)
 rewrite CatwalkDataFigures_2018-10-01.pdf (68%)
 create mode 100644 CatwalkDataFigures_2018-10-02.pdf
 rewrite MetDataFigures_2018-10-01.pdf (95%)
 create mode 100644 MetDataFigures_2018-10-02.pdf
Tue Oct 2 06:16:02 EDT 2018
To https://github.com/CareyLabVT/SCCData.git
   a396282..e880c9e  daily-email -> daily-email


Push the Logs to GitHub:

[daily-email 67eef7d] 10/02/18 06:16:01: Logs
 1 file changed, 13 insertions(+)
Tue Oct 2 06:16:07 EDT 2018
To https://github.com/CareyLabVT/SCCData.git
   e880c9e..67eef7d  daily-email -> daily-email
[daily-email 2d6fa1b] 10/02/18 06:16:01: Logs
 1 file changed, 5 insertions(+)
Tue Oct 2 06:16:10 EDT 2018
To https://github.com/CareyLabVT/SCCData.git
   67eef7d..2d6fa1b  daily-email -> daily-email


-------------- 10/03/18 06:14:01 --------------


System Status:

Fetching origin
From https://github.com/CareyLabVT/SCCData
   fc4182f..74077b0  carina-data -> origin/carina-data
   07c7d2a..a923b15  carina-logs -> origin/carina-logs
   a396282..2d6fa1b  daily-email -> origin/daily-email
   0cea6b7..a5f7612  george-data -> origin/george-data
   6f99e39..92fcc56  george-logs -> origin/george-logs
   ca9690a..36f7ec5  mia-data   -> origin/mia-data
   083a262..087db2c  mia-logs   -> origin/mia-logs
   4caca0d..388a7c6  noaa-data  -> origin/noaa-data
   f9e66df..1192e83  noaa-logs  -> origin/noaa-logs
Already up-to-date.


-------------- 10/03/18 06:15:01 --------------


Email Service:

*mimetypes-load-control*: can't open or load "~/.mime.types"
Resolving host "smtp.gmail.com:587" ... done
Connecting to "173.194.219.108:587" ...connected.
 Certificate depth 2 
  subject = /OU=GlobalSign Root CA - R2/O=GlobalSign/CN=GlobalSign
  notBefore = Dec 15 08:00:00 2006 GMT
  notAfter = Dec 15 08:00:00 2021 GMT
  issuer = /OU=GlobalSign Root CA - R2/O=GlobalSign/CN=GlobalSign
 Certificate depth 1 
  subject = /C=US/O=Google Trust Services/CN=Google Internet Authority G3
  notBefore = Jun 15 00:00:42 2017 GMT
  notAfter = Dec 15 00:00:42 2021 GMT
  issuer = /OU=GlobalSign Root CA - R2/O=GlobalSign/CN=GlobalSign
 Certificate depth 0 
  subject = /C=US/ST=California/L=Mountain View/O=Google LLC/CN=smtp.gmail.com
  notBefore = Sep 11 21:04:00 2018 GMT
  notAfter = Dec  4 21:04:00 2018 GMT
  issuer = /C=US/O=Google Trust Services/CN=Google Internet Authority G3
Comparing subject_alt_name: need<smtp.gmail.com> is<smtp.gmail.com>


-------------- 10/03/18 06:16:01 --------------


GitHub Server:

[daily-email 8465590] 10/03/18 06:16:01: Git Backup
 3 files changed, 57 insertions(+)
 create mode 100644 CatwalkDataFigures_2018-10-03.pdf
 create mode 100644 MetDataFigures_2018-10-03.pdf
Wed Oct 3 06:16:01 EDT 2018
To https://github.com/CareyLabVT/SCCData.git
   2d6fa1b..8465590  daily-email -> daily-email


Push the Logs to GitHub:

[daily-email 6cb45f3] 10/03/18 06:16:01: Logs
 1 file changed, 11 insertions(+)
Wed Oct 3 06:16:06 EDT 2018
To https://github.com/CareyLabVT/SCCData.git
   8465590..6cb45f3  daily-email -> daily-email
[daily-email c4b463c] 10/03/18 06:16:01: Logs
 1 file changed, 5 insertions(+)
Wed Oct 3 06:16:09 EDT 2018
To https://github.com/CareyLabVT/SCCData.git
   6cb45f3..c4b463c  daily-email -> daily-email


-------------- 10/04/18 06:14:01 --------------


System Status:

Fetching origin
From https://github.com/CareyLabVT/SCCData
   74077b0..9de3eb6  carina-data -> origin/carina-data
   a923b15..32c33ea  carina-logs -> origin/carina-logs
   2d6fa1b..c4b463c  daily-email -> origin/daily-email
   a5f7612..8f35887  george-data -> origin/george-data
   92fcc56..1bf119d  george-logs -> origin/george-logs
   36f7ec5..10d845f  mia-data   -> origin/mia-data
   087db2c..09479f4  mia-logs   -> origin/mia-logs
   388a7c6..672112f  noaa-data  -> origin/noaa-data
   1192e83..5bcfd6d  noaa-logs  -> origin/noaa-logs
Already up-to-date.


-------------- 10/04/18 06:15:01 --------------


Email Service:

*mimetypes-load-control*: can't open or load "~/.mime.types"
Resolving host "smtp.gmail.com:587" ... done
Connecting to "64.233.185.108:587" ...connected.
 Certificate depth 2 
  subject = /OU=GlobalSign Root CA - R2/O=GlobalSign/CN=GlobalSign
  notBefore = Dec 15 08:00:00 2006 GMT
  notAfter = Dec 15 08:00:00 2021 GMT
  issuer = /OU=GlobalSign Root CA - R2/O=GlobalSign/CN=GlobalSign
 Certificate depth 1 
  subject = /C=US/O=Google Trust Services/CN=Google Internet Authority G3
  notBefore = Jun 15 00:00:42 2017 GMT
  notAfter = Dec 15 00:00:42 2021 GMT
  issuer = /OU=GlobalSign Root CA - R2/O=GlobalSign/CN=GlobalSign
 Certificate depth 0 
  subject = /C=US/ST=California/L=Mountain View/O=Google LLC/CN=smtp.gmail.com
  notBefore = Sep 18 12:34:00 2018 GMT
  notAfter = Dec 11 12:34:00 2018 GMT
  issuer = /C=US/O=Google Trust Services/CN=Google Internet Authority G3
Comparing subject_alt_name: need<smtp.gmail.com> is<smtp.gmail.com>


-------------- 10/04/18 06:16:01 --------------


GitHub Server:

[daily-email 32a8209] 10/04/18 06:16:01: Git Backup
 3 files changed, 57 insertions(+)
 create mode 100644 CatwalkDataFigures_2018-10-04.pdf
 create mode 100644 MetDataFigures_2018-10-04.pdf
Thu Oct 4 06:16:01 EDT 2018
To https://github.com/CareyLabVT/SCCData.git
   c4b463c..32a8209  daily-email -> daily-email


Push the Logs to GitHub:

[daily-email c02c2ea] 10/04/18 06:16:01: Logs
 1 file changed, 11 insertions(+)
Thu Oct 4 06:16:06 EDT 2018
To https://github.com/CareyLabVT/SCCData.git
   32a8209..c02c2ea  daily-email -> daily-email
[daily-email d20ab65] 10/04/18 06:16:01: Logs
 1 file changed, 5 insertions(+)
Thu Oct 4 06:16:09 EDT 2018
To https://github.com/CareyLabVT/SCCData.git
   c02c2ea..d20ab65  daily-email -> daily-email


-------------- 10/05/18 06:14:01 --------------


System Status:

Fetching origin
From https://github.com/CareyLabVT/SCCData
   9de3eb6..fbece87  carina-data -> origin/carina-data
   32c33ea..9954c45  carina-logs -> origin/carina-logs
   c4b463c..d20ab65  daily-email -> origin/daily-email
   8f35887..3e3c172  george-data -> origin/george-data
   1bf119d..73e4190  george-logs -> origin/george-logs
   10d845f..f226ca0  mia-data   -> origin/mia-data
   09479f4..ef8951b  mia-logs   -> origin/mia-logs
   672112f..e9dd63a  noaa-data  -> origin/noaa-data
   5bcfd6d..fccd4e6  noaa-logs  -> origin/noaa-logs
Already up-to-date.


-------------- 10/05/18 06:15:01 --------------


Email Service:

*mimetypes-load-control*: can't open or load "~/.mime.types"
Resolving host "smtp.gmail.com:587" ... done
Connecting to "74.125.136.108:587" ...connected.
 Certificate depth 2 
  subject = /OU=GlobalSign Root CA - R2/O=GlobalSign/CN=GlobalSign
  notBefore = Dec 15 08:00:00 2006 GMT
  notAfter = Dec 15 08:00:00 2021 GMT
  issuer = /OU=GlobalSign Root CA - R2/O=GlobalSign/CN=GlobalSign
 Certificate depth 1 
  subject = /C=US/O=Google Trust Services/CN=Google Internet Authority G3
  notBefore = Jun 15 00:00:42 2017 GMT
  notAfter = Dec 15 00:00:42 2021 GMT
  issuer = /OU=GlobalSign Root CA - R2/O=GlobalSign/CN=GlobalSign
 Certificate depth 0 
  subject = /C=US/ST=California/L=Mountain View/O=Google LLC/CN=smtp.gmail.com
  notBefore = Sep 18 12:34:00 2018 GMT
  notAfter = Dec 11 12:34:00 2018 GMT
  issuer = /C=US/O=Google Trust Services/CN=Google Internet Authority G3
Comparing subject_alt_name: need<smtp.gmail.com> is<smtp.gmail.com>


-------------- 10/05/18 06:16:01 --------------


GitHub Server:

[daily-email 41cff19] 10/05/18 06:16:01: Git Backup
 3 files changed, 57 insertions(+)
 create mode 100644 CatwalkDataFigures_2018-10-05.pdf
 create mode 100644 MetDataFigures_2018-10-05.pdf
Fri Oct 5 06:16:01 EDT 2018
To https://github.com/CareyLabVT/SCCData.git
   d20ab65..41cff19  daily-email -> daily-email


Push the Logs to GitHub:

[daily-email e6f68dc] 10/05/18 06:16:01: Logs
 1 file changed, 11 insertions(+)
Fri Oct 5 06:16:06 EDT 2018
To https://github.com/CareyLabVT/SCCData.git
   41cff19..e6f68dc  daily-email -> daily-email
[daily-email c274598] 10/05/18 06:16:01: Logs
 1 file changed, 5 insertions(+)
Fri Oct 5 06:16:09 EDT 2018
To https://github.com/CareyLabVT/SCCData.git
   e6f68dc..c274598  daily-email -> daily-email


-------------- 10/06/18 06:14:00 --------------


System Status:

Fetching origin
From https://github.com/CareyLabVT/SCCData
   fbece87..5b8be7e  carina-data -> origin/carina-data
   9954c45..29d69a3  carina-logs -> origin/carina-logs
   d20ab65..c274598  daily-email -> origin/daily-email
   3e3c172..5ff85aa  george-data -> origin/george-data
   73e4190..d1c3618  george-logs -> origin/george-logs
   f226ca0..ca28d38  mia-data   -> origin/mia-data
   ef8951b..3abc502  mia-logs   -> origin/mia-logs
   e9dd63a..723886e  noaa-data  -> origin/noaa-data
   fccd4e6..1746194  noaa-logs  -> origin/noaa-logs
Already up-to-date.


-------------- 10/06/18 06:15:01 --------------


Email Service:

*mimetypes-load-control*: can't open or load "~/.mime.types"
Resolving host "smtp.gmail.com:587" ... done
Connecting to "64.233.176.109:587" ...connected.
 Certificate depth 2 
  subject = /OU=GlobalSign Root CA - R2/O=GlobalSign/CN=GlobalSign
  notBefore = Dec 15 08:00:00 2006 GMT
  notAfter = Dec 15 08:00:00 2021 GMT
  issuer = /OU=GlobalSign Root CA - R2/O=GlobalSign/CN=GlobalSign
 Certificate depth 1 
  subject = /C=US/O=Google Trust Services/CN=Google Internet Authority G3
  notBefore = Jun 15 00:00:42 2017 GMT
  notAfter = Dec 15 00:00:42 2021 GMT
  issuer = /OU=GlobalSign Root CA - R2/O=GlobalSign/CN=GlobalSign
 Certificate depth 0 
  subject = /C=US/ST=California/L=Mountain View/O=Google LLC/CN=smtp.gmail.com
  notBefore = Sep 18 12:34:00 2018 GMT
  notAfter = Dec 11 12:34:00 2018 GMT
  issuer = /C=US/O=Google Trust Services/CN=Google Internet Authority G3
Comparing subject_alt_name: need<smtp.gmail.com> is<smtp.gmail.com>


-------------- 10/06/18 06:16:01 --------------


GitHub Server:

[daily-email e49a410] 10/06/18 06:16:01: Git Backup
 3 files changed, 57 insertions(+)
 create mode 100644 CatwalkDataFigures_2018-10-06.pdf
 create mode 100644 MetDataFigures_2018-10-06.pdf
Sat Oct 6 06:16:01 EDT 2018
To https://github.com/CareyLabVT/SCCData.git
   c274598..e49a410  daily-email -> daily-email


Push the Logs to GitHub:

[daily-email 845e96b] 10/06/18 06:16:01: Logs
 1 file changed, 11 insertions(+)
Sat Oct 6 06:16:06 EDT 2018
To https://github.com/CareyLabVT/SCCData.git
   e49a410..845e96b  daily-email -> daily-email
[daily-email 16ff744] 10/06/18 06:16:01: Logs
 1 file changed, 5 insertions(+)
Sat Oct 6 06:16:09 EDT 2018
To https://github.com/CareyLabVT/SCCData.git
   845e96b..16ff744  daily-email -> daily-email


-------------- 10/07/18 06:14:01 --------------


System Status:

Fetching origin
From https://github.com/CareyLabVT/SCCData
   5b8be7e..a7802b6  carina-data -> origin/carina-data
   29d69a3..88fd30a  carina-logs -> origin/carina-logs
   c274598..16ff744  daily-email -> origin/daily-email
   5ff85aa..37bec59  george-data -> origin/george-data
   d1c3618..7f5364c  george-logs -> origin/george-logs
   ca28d38..5f33f95  mia-data   -> origin/mia-data
   3abc502..20ed8f0  mia-logs   -> origin/mia-logs
   723886e..70a5b0a  noaa-data  -> origin/noaa-data
   1746194..22940c7  noaa-logs  -> origin/noaa-logs
Already up-to-date.


-------------- 10/07/18 06:15:01 --------------


Email Service:

*mimetypes-load-control*: can't open or load "~/.mime.types"
Resolving host "smtp.gmail.com:587" ... done
Connecting to "74.125.138.108:587" ...connected.
 Certificate depth 2 
  subject = /OU=GlobalSign Root CA - R2/O=GlobalSign/CN=GlobalSign
  notBefore = Dec 15 08:00:00 2006 GMT
  notAfter = Dec 15 08:00:00 2021 GMT
  issuer = /OU=GlobalSign Root CA - R2/O=GlobalSign/CN=GlobalSign
 Certificate depth 1 
  subject = /C=US/O=Google Trust Services/CN=Google Internet Authority G3
  notBefore = Jun 15 00:00:42 2017 GMT
  notAfter = Dec 15 00:00:42 2021 GMT
  issuer = /OU=GlobalSign Root CA - R2/O=GlobalSign/CN=GlobalSign
 Certificate depth 0 
  subject = /C=US/ST=California/L=Mountain View/O=Google LLC/CN=smtp.gmail.com
  notBefore = Sep 18 12:34:00 2018 GMT
  notAfter = Dec 11 12:34:00 2018 GMT
  issuer = /C=US/O=Google Trust Services/CN=Google Internet Authority G3
Comparing subject_alt_name: need<smtp.gmail.com> is<smtp.gmail.com>


-------------- 10/07/18 06:16:01 --------------


GitHub Server:

[daily-email 8cab49e] 10/07/18 06:16:01: Git Backup
 3 files changed, 57 insertions(+)
 create mode 100644 CatwalkDataFigures_2018-10-07.pdf
 create mode 100644 MetDataFigures_2018-10-07.pdf
Sun Oct 7 06:16:01 EDT 2018
To https://github.com/CareyLabVT/SCCData.git
   16ff744..8cab49e  daily-email -> daily-email


Push the Logs to GitHub:

[daily-email f619943] 10/07/18 06:16:01: Logs
 1 file changed, 11 insertions(+)
Sun Oct 7 06:16:06 EDT 2018
To https://github.com/CareyLabVT/SCCData.git
   8cab49e..f619943  daily-email -> daily-email
[daily-email 0b05db1] 10/07/18 06:16:01: Logs
 1 file changed, 5 insertions(+)
Sun Oct 7 06:16:09 EDT 2018
To https://github.com/CareyLabVT/SCCData.git
   f619943..0b05db1  daily-email -> daily-email


-------------- 10/08/18 06:14:00 --------------


System Status:

Fetching origin
From https://github.com/CareyLabVT/SCCData
   a7802b6..8e9e767  carina-data -> origin/carina-data
   88fd30a..8bb9023  carina-logs -> origin/carina-logs
   16ff744..0b05db1  daily-email -> origin/daily-email
   37bec59..e9e8407  george-data -> origin/george-data
   7f5364c..1353a1f  george-logs -> origin/george-logs
   5f33f95..6d90504  mia-data   -> origin/mia-data
