
############## carina - 07/24/20 18:10:17 EDT -0400 ##############

2020-07-24 18:10:21 3 packets transmitted, 3 received, 0% packet loss, time 4004ms
2020-07-24 18:10:21 rtt min/avg/max/mdev = 47.923/53.219/56.706/3.811 ms

############## carina - 07/24/20 18:11:06 EDT -0400 ##############

2020-07-24 18:11:10 3 packets transmitted, 3 received, 0% packet loss, time 4005ms
2020-07-24 18:11:10 rtt min/avg/max/mdev = 47.909/57.903/64.487/7.184 ms

############## carina - 07/24/20 23:54:45 EDT -0400 ##############

2020-07-25 05:43:55 350 packets transmitted, 350 received, 0% packet loss, time 20949472ms
2020-07-25 05:43:55 rtt min/avg/max/mdev = 34.114/62.052/241.606/25.691 ms

############## carina - 07/25/20 05:54:45 EDT -0400 ##############

2020-07-25 11:43:54 350 packets transmitted, 350 received, 0% packet loss, time 20949077ms
2020-07-25 11:43:54 rtt min/avg/max/mdev = 36.054/55.693/383.164/22.458 ms

############## carina - 07/25/20 11:54:45 EDT -0400 ##############

2020-07-25 17:44:56 350 packets transmitted, 346 received, 1% packet loss, time 20950679ms
2020-07-25 17:44:56 rtt min/avg/max/mdev = 36.496/163.224/1772.434/235.831 ms

############## carina - 07/25/20 17:54:45 EDT -0400 ##############

2020-07-25 22:43:54 350 packets transmitted, 350 received, 0% packet loss, time 20948979ms
2020-07-25 22:43:54 rtt min/avg/max/mdev = 30.365/64.788/198.463/25.639 ms

############## carina - 07/25/20 23:54:44 EST -0500 ##############

2020-07-26 05:43:54 350 packets transmitted, 350 received, 0% packet loss, time 20950065ms
2020-07-26 05:43:54 rtt min/avg/max/mdev = 32.961/45.326/80.103/6.352 ms

############## carina - 07/26/20 11:54:47 EST -0500 ##############

2020-07-26 17:45:00 350 packets transmitted, 343 received, 2% packet loss, time 20953532ms
2020-07-26 17:45:00 rtt min/avg/max/mdev = 35.755/129.156/2238.238/260.388 ms

############## carina - 07/26/20 17:54:46 EST -0500 ##############

2020-07-26 23:43:56 350 packets transmitted, 350 received, 0% packet loss, time 20949786ms
2020-07-26 23:43:56 rtt min/avg/max/mdev = 32.022/68.863/5155.546/274.873 ms

############## carina - 07/26/20 23:54:45 EST -0500 ##############

2020-07-27 05:43:55 350 packets transmitted, 350 received, 0% packet loss, time 20949956ms
2020-07-27 05:43:55 rtt min/avg/max/mdev = 30.944/43.953/128.618/7.306 ms

############## carina - 07/27/20 05:54:44 EST -0500 ##############

2020-07-27 11:43:53 350 packets transmitted, 350 received, 0% packet loss, time 20948948ms
2020-07-27 11:43:53 rtt min/avg/max/mdev = 48.576/71.082/1306.374/69.666 ms

############## carina - 07/27/20 11:54:46 EST -0500 ##############

2020-07-27 17:43:55 350 packets transmitted, 350 received, 0% packet loss, time 20949243ms
2020-07-27 17:43:55 rtt min/avg/max/mdev = 32.862/136.362/1599.489/207.936 ms

############## carina - 07/27/20 17:54:44 EST -0500 ##############

2020-07-27 23:43:53 350 packets transmitted, 350 received, 0% packet loss, time 20949103ms
2020-07-27 23:43:53 rtt min/avg/max/mdev = 35.722/51.974/134.592/15.681 ms

############## carina - 07/27/20 23:54:43 EST -0500 ##############

2020-07-28 05:43:53 350 packets transmitted, 350 received, 0% packet loss, time 20949232ms
2020-07-28 05:43:53 rtt min/avg/max/mdev = 34.125/45.171/85.633/6.407 ms

############## carina - 07/28/20 05:54:44 EST -0500 ##############

2020-07-28 11:43:53 350 packets transmitted, 350 received, 0% packet loss, time 20948642ms
2020-07-28 11:43:53 rtt min/avg/max/mdev = 31.792/49.158/115.902/11.033 ms

############## carina - 07/28/20 11:54:46 EST -0500 ##############

2020-07-28 17:43:57 350 packets transmitted, 350 received, 0% packet loss, time 20950505ms
2020-07-28 17:43:57 rtt min/avg/max/mdev = 37.190/55.946/610.227/34.638 ms

############## carina - 07/28/20 17:54:46 EST -0500 ##############

2020-07-28 23:43:54 350 packets transmitted, 350 received, 0% packet loss, time 20948635ms
2020-07-28 23:43:54 rtt min/avg/max/mdev = 41.625/65.422/212.724/13.839 ms

############## carina - 07/28/20 23:54:43 EST -0500 ##############

2020-07-29 05:43:52 350 packets transmitted, 350 received, 0% packet loss, time 20948317ms
2020-07-29 05:43:52 rtt min/avg/max/mdev = 31.296/45.674/75.282/6.977 ms

############## carina - 07/29/20 05:54:45 EST -0500 ##############

2020-07-29 11:44:54 350 packets transmitted, 349 received, 0% packet loss, time 20949281ms
2020-07-29 11:44:54 rtt min/avg/max/mdev = 31.024/49.774/100.369/10.076 ms

############## carina - 07/29/20 11:54:45 EST -0500 ##############

2020-07-29 17:44:53 350 packets transmitted, 348 received, 0% packet loss, time 20948674ms
2020-07-29 17:44:53 rtt min/avg/max/mdev = 46.321/79.273/1442.995/80.276 ms

############## carina - 07/29/20 17:54:51 EST -0500 ##############

2020-07-29 23:45:01 350 packets transmitted, 349 received, 0% packet loss, time 20949355ms
2020-07-29 23:45:01 rtt min/avg/max/mdev = 34.943/58.002/2679.751/141.298 ms

############## carina - 07/29/20 23:54:47 EST -0500 ##############

2020-07-30 05:43:56 350 packets transmitted, 350 received, 0% packet loss, time 20949259ms
2020-07-30 05:43:56 rtt min/avg/max/mdev = 30.621/50.286/1194.224/61.988 ms

############## carina - 07/30/20 05:54:55 EST -0500 ##############

2020-07-30 11:44:03 350 packets transmitted, 350 received, 0% packet loss, time 20948444ms
2020-07-30 11:44:03 rtt min/avg/max/mdev = 31.044/53.259/1743.346/91.152 ms

############## carina - 07/30/20 11:54:44 EST -0500 ##############

2020-07-30 17:43:54 350 packets transmitted, 350 received, 0% packet loss, time 20949168ms
2020-07-30 17:43:54 rtt min/avg/max/mdev = 34.935/53.671/576.702/30.215 ms

############## carina - 07/30/20 17:54:45 EST -0500 ##############

2020-07-30 23:44:54 350 packets transmitted, 349 received, 0% packet loss, time 20948851ms
2020-07-30 23:44:54 rtt min/avg/max/mdev = 49.005/120.565/1697.102/183.644 ms

############## carina - 07/30/20 23:54:44 EST -0500 ##############

2020-07-31 05:44:53 350 packets transmitted, 349 received, 0% packet loss, time 20949232ms
2020-07-31 05:44:53 rtt min/avg/max/mdev = 39.531/65.258/227.637/19.494 ms

############## carina - 07/31/20 13:20:10 EST -0500 ##############

############## carina - 07/31/20 13:20:10 EST -0500 ##############


############## carina - 07/31/20 17:54:43 EST -0500 ##############

2020-07-31 23:43:52 350 packets transmitted, 350 received, 0% packet loss, time 20949209ms
2020-07-31 23:43:52 rtt min/avg/max/mdev = 42.626/77.047/393.662/28.181 ms

############## carina - 07/31/20 23:54:44 EST -0500 ##############

2020-08-01 05:45:49 350 packets transmitted, 350 received, 0% packet loss, time 21064664ms
2020-08-01 05:45:49 rtt min/avg/max/mdev = 31.082/52.261/196.085/22.681 ms

############## carina - 08/01/20 05:54:50 EST -0500 ##############

2020-08-01 11:46:51 350 packets transmitted, 339 received, 3% packet loss, time 20950211ms
2020-08-01 11:46:51 rtt min/avg/max/mdev = 38.367/551.354/85115.952/4817.422 ms, pipe 2

############## carina - 08/01/20 11:55:14 EST -0500 ##############

2020-08-01 17:45:41 350 packets transmitted, 315 received, 10% packet loss, time 20966382ms
2020-08-01 17:45:41 rtt min/avg/max/mdev = 55.568/445.641/5162.704/616.810 ms

############## carina - 08/01/20 17:54:43 EST -0500 ##############

2020-08-01 23:44:53 350 packets transmitted, 348 received, 0% packet loss, time 20949502ms
2020-08-01 23:44:53 rtt min/avg/max/mdev = 36.183/78.109/1237.226/119.676 ms

############## carina - 08/01/20 23:54:43 EST -0500 ##############

2020-08-02 05:43:53 350 packets transmitted, 350 received, 0% packet loss, time 20949060ms
2020-08-02 05:43:53 rtt min/avg/max/mdev = 32.148/48.846/141.189/8.591 ms

############## carina - 08/02/20 05:54:43 EST -0500 ##############

2020-08-02 11:44:59 350 packets transmitted, 342 received, 2% packet loss, time 20955796ms
2020-08-02 11:44:59 rtt min/avg/max/mdev = 37.753/160.770/4919.778/345.578 ms

############## carina - 08/02/20 11:55:10 EST -0500 ##############

2020-08-02 17:44:20 350 packets transmitted, 350 received, 0% packet loss, time 20949605ms
2020-08-02 17:44:20 rtt min/avg/max/mdev = 32.460/55.045/138.655/16.101 ms

############## carina - 08/02/20 17:54:45 EST -0500 ##############

2020-08-02 23:43:54 350 packets transmitted, 350 received, 0% packet loss, time 20948867ms
2020-08-02 23:43:54 rtt min/avg/max/mdev = 33.248/53.159/141.726/15.133 ms

############## carina - 08/02/20 23:54:44 EST -0500 ##############

2020-08-03 05:43:53 350 packets transmitted, 350 received, 0% packet loss, time 20948672ms
2020-08-03 05:43:53 rtt min/avg/max/mdev = 41.065/61.019/145.740/16.375 ms

############## carina - 08/03/20 05:54:45 EST -0500 ##############

2020-08-03 11:44:53 350 packets transmitted, 346 received, 1% packet loss, time 20948186ms
2020-08-03 11:44:53 rtt min/avg/max/mdev = 41.021/95.708/1464.302/118.513 ms

############## carina - 08/03/20 11:55:08 EST -0500 ##############

2020-08-03 17:45:21 350 packets transmitted, 347 received, 0% packet loss, time 20952215ms
2020-08-03 17:45:21 rtt min/avg/max/mdev = 35.345/71.087/696.668/53.129 ms

############## carina - 08/03/20 23:54:45 EST -0500 ##############

2020-08-04 05:43:55 350 packets transmitted, 350 received, 0% packet loss, time 20949288ms
2020-08-04 05:43:55 rtt min/avg/max/mdev = 38.663/54.191/453.049/22.976 ms

############## carina - 08/04/20 11:55:09 EST -0500 ##############

2020-08-04 17:44:18 350 packets transmitted, 350 received, 0% packet loss, time 20948736ms
2020-08-04 17:44:18 rtt min/avg/max/mdev = 38.676/56.959/156.432/15.359 ms

############## carina - 08/04/20 23:54:46 EST -0500 ##############

2020-08-05 05:43:55 350 packets transmitted, 350 received, 0% packet loss, time 20949282ms
2020-08-05 05:43:55 rtt min/avg/max/mdev = 31.703/44.133/118.347/7.597 ms

############## carina - 08/05/20 11:55:08 EST -0500 ##############

2020-08-05 17:45:18 350 packets transmitted, 349 received, 0% packet loss, time 20949732ms
2020-08-05 17:45:18 rtt min/avg/max/mdev = 32.708/63.177/350.206/27.978 ms

############## carina - 08/05/20 23:54:44 EST -0500 ##############

2020-08-06 05:47:16 350 packets transmitted, 349 received, 0% packet loss, time 20949068ms
2020-08-06 05:47:16 rtt min/avg/max/mdev = 39.661/351.400/101409.187/5417.317 ms, pipe 2

############## carina - 08/06/20 11:55:09 EST -0500 ##############

2020-08-06 17:44:24 350 packets transmitted, 350 received, 0% packet loss, time 20955017ms
2020-08-06 17:44:24 rtt min/avg/max/mdev = 34.418/59.389/1102.611/57.934 ms

############## carina - 08/06/20 23:54:46 EST -0500 ##############

2020-08-07 05:44:00 350 packets transmitted, 350 received, 0% packet loss, time 20954373ms
2020-08-07 05:44:00 rtt min/avg/max/mdev = 28.191/52.278/111.443/12.578 ms

############## carina - 08/07/20 11:55:13 EST -0500 ##############

2020-08-07 17:45:27 350 packets transmitted, 349 received, 0% packet loss, time 20954731ms
2020-08-07 17:45:27 rtt min/avg/max/mdev = 30.029/87.201/4009.102/233.847 ms

############## carina - 08/07/20 23:54:46 EST -0500 ##############

2020-08-08 05:43:57 350 packets transmitted, 350 received, 0% packet loss, time 20950916ms
2020-08-08 05:43:57 rtt min/avg/max/mdev = 30.958/44.284/95.878/7.230 ms

############## carina - 08/08/20 11:55:09 EST -0500 ##############

2020-08-08 17:44:24 350 packets transmitted, 350 received, 0% packet loss, time 20955113ms
2020-08-08 17:44:24 rtt min/avg/max/mdev = 29.482/61.013/232.388/26.712 ms

############## carina - 08/08/20 23:54:45 EST -0500 ##############

2020-08-09 05:44:00 350 packets transmitted, 350 received, 0% packet loss, time 20954258ms
2020-08-09 05:44:00 rtt min/avg/max/mdev = 28.104/41.294/118.370/7.957 ms

############## carina - 08/09/20 11:55:10 EST -0500 ##############

2020-08-09 17:44:21 350 packets transmitted, 350 received, 0% packet loss, time 20951533ms
2020-08-09 17:44:21 rtt min/avg/max/mdev = 31.436/55.711/428.503/28.298 ms

############## carina - 08/09/20 23:54:47 EST -0500 ##############

2020-08-10 05:44:02 350 packets transmitted, 350 received, 0% packet loss, time 20955085ms
2020-08-10 05:44:02 rtt min/avg/max/mdev = 27.986/40.251/96.704/6.788 ms

############## carina - 08/10/20 11:55:10 EST -0500 ##############

2020-08-10 17:44:26 350 packets transmitted, 350 received, 0% packet loss, time 20955247ms
2020-08-10 17:44:26 rtt min/avg/max/mdev = 32.836/57.005/2026.003/106.838 ms

############## carina - 08/10/20 23:54:46 EST -0500 ##############

2020-08-11 05:44:02 350 packets transmitted, 350 received, 0% packet loss, time 20955583ms
2020-08-11 05:44:02 rtt min/avg/max/mdev = 29.267/41.266/135.808/8.762 ms

############## carina - 08/11/20 11:55:11 EST -0500 ##############

2020-08-11 17:44:25 350 packets transmitted, 350 received, 0% packet loss, time 20954205ms
2020-08-11 17:44:25 rtt min/avg/max/mdev = 31.512/53.179/1259.583/68.215 ms

############## carina - 08/11/20 23:54:45 EST -0500 ##############

2020-08-12 05:44:01 350 packets transmitted, 350 received, 0% packet loss, time 20955417ms
2020-08-12 05:44:01 rtt min/avg/max/mdev = 28.328/43.914/242.833/13.518 ms

############## carina - 08/12/20 11:55:13 EST -0500 ##############

############## carina - 08/12/20 11:55:13 EST -0500 ##############


############## carina - 08/12/20 23:56:11 EST -0500 ##############

############## carina - 08/12/20 23:56:11 EST -0500 ##############


############## carina - 08/13/20 11:55:11 EST -0500 ##############

2020-08-13 17:44:20 350 packets transmitted, 350 received, 0% packet loss, time 20948882ms
2020-08-13 17:44:20 rtt min/avg/max/mdev = 33.176/82.367/1180.826/85.158 ms

############## carina - 08/13/20 23:54:48 EST -0500 ##############

2020-08-14 05:43:57 350 packets transmitted, 350 received, 0% packet loss, time 20949111ms
2020-08-14 05:43:57 rtt min/avg/max/mdev = 34.820/70.061/571.153/49.788 ms

############## carina - 08/14/20 11:55:11 EST -0500 ##############

2020-08-14 17:45:22 350 packets transmitted, 332 received, 5% packet loss, time 20951418ms
2020-08-14 17:45:22 rtt min/avg/max/mdev = 35.279/128.551/2821.723/270.604 ms

############## carina - 08/14/20 23:54:45 EST -0500 ##############

2020-08-15 05:43:54 350 packets transmitted, 350 received, 0% packet loss, time 20948740ms
2020-08-15 05:43:54 rtt min/avg/max/mdev = 44.386/57.740/178.819/8.938 ms

############## carina - 08/15/20 11:55:11 EST -0500 ##############

2020-08-15 17:53:17 350 packets transmitted, 309 received, 11% packet loss, time 20965639ms
2020-08-15 17:53:17 rtt min/avg/max/mdev = 48.831/6714.369/260184.331/28234.276 ms, pipe 5

############## carina - 08/15/20 23:54:45 EST -0500 ##############

2020-08-16 05:44:55 350 packets transmitted, 347 received, 0% packet loss, time 20949363ms
2020-08-16 05:44:55 rtt min/avg/max/mdev = 39.345/62.082/332.056/26.428 ms

############## carina - 08/16/20 12:01:11 EST -0500 ##############

2020-08-16 23:41:29 700 packets transmitted, 699 received, 0% packet loss, time 41957883ms
2020-08-16 23:41:29 rtt min/avg/max/mdev = 45.857/73.482/379.928/24.867 ms

############## carina - 08/17/20 00:00:47 EST -0500 ##############

2020-08-17 11:41:12 700 packets transmitted, 695 received, +1 errors, 0% packet loss, time 41965325ms
2020-08-17 11:41:12 rtt min/avg/max/mdev = 41.180/66.835/1555.500/69.023 ms

############## carina - 08/17/20 12:01:11 EST -0500 ##############

2020-08-17 23:41:29 700 packets transmitted, 698 received, 0% packet loss, time 41958017ms
2020-08-17 23:41:29 rtt min/avg/max/mdev = 40.447/86.171/2102.225/128.258 ms

############## carina - 08/17/20 23:55:46 EST -0500 ##############

2020-08-18 11:35:03 700 packets transmitted, 700 received, 0% packet loss, time 41956824ms
2020-08-18 11:35:03 rtt min/avg/max/mdev = 34.283/55.733/319.055/19.356 ms

############## carina - 08/18/20 11:56:13 EST -0500 ##############

2020-08-18 23:36:31 700 packets transmitted, 699 received, 0% packet loss, time 41957683ms
2020-08-18 23:36:31 rtt min/avg/max/mdev = 38.492/63.493/344.801/23.970 ms

############## carina - 08/18/20 23:55:56 EST -0500 ##############

2020-08-19 11:35:14 700 packets transmitted, 700 received, 0% packet loss, time 41957699ms
2020-08-19 11:35:14 rtt min/avg/max/mdev = 33.742/56.095/386.889/18.860 ms

############## carina - 08/19/20 11:56:13 EST -0500 ##############

2020-08-19 23:36:31 700 packets transmitted, 698 received, 0% packet loss, time 41957513ms
2020-08-19 23:36:31 rtt min/avg/max/mdev = 34.592/73.719/4297.126/161.799 ms

############## carina - 08/19/20 23:55:44 EST -0500 ##############

2020-08-20 11:35:03 700 packets transmitted, 700 received, 0% packet loss, time 41958095ms
2020-08-20 11:35:03 rtt min/avg/max/mdev = 33.359/53.725/391.264/17.617 ms

############## carina - 08/20/20 11:56:13 EST -0500 ##############

2020-08-20 23:36:31 700 packets transmitted, 698 received, 0% packet loss, time 41957507ms
2020-08-20 23:36:31 rtt min/avg/max/mdev = 30.759/59.584/325.722/17.348 ms

############## carina - 08/20/20 23:55:44 EST -0500 ##############

2020-08-21 11:35:02 700 packets transmitted, 700 received, 0% packet loss, time 41957295ms
2020-08-21 11:35:02 rtt min/avg/max/mdev = 33.794/51.836/137.521/12.103 ms

############## carina - 08/21/20 11:56:13 EST -0500 ##############

2020-08-21 23:35:31 700 packets transmitted, 700 received, 0% packet loss, time 41957918ms
2020-08-21 23:35:31 rtt min/avg/max/mdev = 34.738/79.761/5570.746/259.585 ms

############## carina - 08/21/20 23:55:48 EST -0500 ##############

############## carina - 08/21/20 23:55:48 EST -0500 ##############


############## carina - 08/22/20 11:56:14 EST -0500 ##############

2020-08-22 23:36:39 700 packets transmitted, 690 received, 1% packet loss, time 41964985ms
2020-08-22 23:36:39 rtt min/avg/max/mdev = 33.340/70.012/552.834/47.767 ms

############## carina - 08/22/20 23:55:51 EST -0500 ##############

2020-08-23 11:35:08 700 packets transmitted, 700 received, 0% packet loss, time 41957100ms
2020-08-23 11:35:08 rtt min/avg/max/mdev = 31.486/53.980/2292.344/86.382 ms

############## carina - 08/23/20 11:56:13 EST -0500 ##############

############## carina - 08/23/20 11:56:13 EST -0500 ##############


############## carina - 08/23/20 23:57:08 EST -0500 ##############

2020-08-24 11:37:28 700 packets transmitted, 699 received, 0% packet loss, time 41960044ms
2020-08-24 11:37:28 rtt min/avg/max/mdev = 31.302/49.848/461.405/22.779 ms

############## carina - 08/25/20 00:21:14 EST -0500 ##############

2020-08-25 12:01:36 700 packets transmitted, 697 received, 0% packet loss, time 41961847ms
2020-08-25 12:01:36 rtt min/avg/max/mdev = 32.578/56.360/1857.840/72.876 ms

############## carina - 08/25/20 12:15:43 EST -0500 ##############

2020-08-25 23:59:13 700 packets transmitted, 689 received, 1% packet loss, time 41957649ms
2020-08-25 23:59:13 rtt min/avg/max/mdev = 35.672/248.240/126434.496/4811.063 ms, pipe 3

############## carina - 08/26/20 00:21:14 EST -0500 ##############

2020-08-26 12:01:34 700 packets transmitted, 698 received, 0% packet loss, time 41959597ms
2020-08-26 12:01:34 rtt min/avg/max/mdev = 37.701/67.016/2318.358/105.116 ms

############## carina - 08/26/20 12:15:44 EST -0500 ##############

2020-08-26 23:59:32 700 packets transmitted, 541 received, 22% packet loss, time 42168285ms
2020-08-26 23:59:32 rtt min/avg/max/mdev = 33.013/114.380/4602.633/322.826 ms

############## carina - 08/27/20 00:21:17 EST -0500 ##############

2020-08-27 12:00:34 700 packets transmitted, 700 received, 0% packet loss, time 41956989ms
2020-08-27 12:00:34 rtt min/avg/max/mdev = 32.560/48.507/128.852/11.836 ms
