Loading required package: methods

Attaching package: ‘lubridate’

The following object is masked from ‘package:base’:

    date

trying URL 'https://github.com/CareyLabVT/SCCData/raw/carina-data/FCRmet.csv'
Content type 'text/plain; charset=utf-8' length 56027457 bytes (53.4 MB)
==================================================
downloaded 53.4 MB

trying URL 'https://github.com/CareyLabVT/SCCData/raw/mia-data/Catwalk.csv'
Content type 'text/plain; charset=utf-8' length 9124835 bytes (8.7 MB)
==================================================
downloaded 8.7 MB

null device 
          1 
null device 
          1 
Loading required package: methods

Attaching package: ‘lubridate’

The following object is masked from ‘package:base’:

    date

trying URL 'https://github.com/CareyLabVT/SCCData/raw/carina-data/FCRmet.csv'
Content type 'text/plain; charset=utf-8' length 56559663 bytes (53.9 MB)
==================================================
downloaded 53.9 MB

trying URL 'https://github.com/CareyLabVT/SCCData/raw/mia-data/Catwalk.csv'
Content type 'text/plain; charset=utf-8' length 9248358 bytes (8.8 MB)
==================================================
downloaded 8.8 MB

null device 
          1 
null device 
          1 
Loading required package: methods

Attaching package: ‘lubridate’

The following object is masked from ‘package:base’:

    date

trying URL 'https://github.com/CareyLabVT/SCCData/raw/carina-data/FCRmet.csv'
Content type 'text/plain; charset=utf-8' length 56738299 bytes (54.1 MB)
==================================================
downloaded 54.1 MB

trying URL 'https://github.com/CareyLabVT/SCCData/raw/mia-data/Catwalk.csv'
Content type 'text/plain; charset=utf-8' length 9290003 bytes (8.9 MB)
==================================================
downloaded 8.9 MB

null device 
          1 
null device 
          1 
Loading required package: methods

Attaching package: ‘lubridate’

The following object is masked from ‘package:base’:

    date

trying URL 'https://github.com/CareyLabVT/SCCData/raw/carina-data/FCRmet.csv'
Content type 'text/plain; charset=utf-8' length 56910867 bytes (54.3 MB)
==================================================
downloaded 54.3 MB

trying URL 'https://github.com/CareyLabVT/SCCData/raw/mia-data/Catwalk.csv'
Content type 'text/plain; charset=utf-8' length 9331739 bytes (8.9 MB)
==================================================
downloaded 8.9 MB

null device 
          1 
null device 
          1 
Loading required package: methods

Attaching package: ‘lubridate’

The following object is masked from ‘package:base’:

    date

trying URL 'https://github.com/CareyLabVT/SCCData/raw/carina-data/FCRmet.csv'
Content type 'text/plain; charset=utf-8' length 57087390 bytes (54.4 MB)
==================================================
downloaded 54.4 MB

trying URL 'https://github.com/CareyLabVT/SCCData/raw/mia-data/Catwalk.csv'
Content type 'text/plain; charset=utf-8' length 9373474 bytes (8.9 MB)
==================================================
downloaded 8.9 MB

null device 
          1 
null device 
          1 
Loading required package: methods

Attaching package: ‘lubridate’

The following object is masked from ‘package:base’:

    date

trying URL 'https://github.com/CareyLabVT/SCCData/raw/carina-data/FCRmet.csv'
Content type 'text/plain; charset=utf-8' length 57264390 bytes (54.6 MB)
==================================================
downloaded 54.6 MB

trying URL 'https://github.com/CareyLabVT/SCCData/raw/mia-data/Catwalk.csv'
Content type 'text/plain; charset=utf-8' length 9415134 bytes (9.0 MB)
==================================================
downloaded 9.0 MB

null device 
          1 
null device 
          1 
Loading required package: methods

Attaching package: ‘lubridate’

The following object is masked from ‘package:base’:

    date

trying URL 'https://github.com/CareyLabVT/SCCData/raw/carina-data/FCRmet.csv'
Content type 'text/plain; charset=utf-8' length 57441764 bytes (54.8 MB)
==================================================
downloaded 54.8 MB

trying URL 'https://github.com/CareyLabVT/SCCData/raw/mia-data/Catwalk.csv'
Content type 'text/plain; charset=utf-8' length 9456866 bytes (9.0 MB)
==================================================
downloaded 9.0 MB

null device 
          1 
null device 
          1 
Loading required package: methods

Attaching package: ‘lubridate’

The following object is masked from ‘package:base’:

    date

trying URL 'https://github.com/CareyLabVT/SCCData/raw/carina-data/FCRmet.csv'
Content type 'text/plain; charset=utf-8' length 57618913 bytes (54.9 MB)
==================================================
downloaded 54.9 MB

trying URL 'https://github.com/CareyLabVT/SCCData/raw/mia-data/Catwalk.csv'
Content type 'text/plain; charset=utf-8' length 9498528 bytes (9.1 MB)
==================================================
downloaded 9.1 MB

null device 
          1 
null device 
          1 
Loading required package: methods

Attaching package: ‘lubridate’

The following object is masked from ‘package:base’:

    date

trying URL 'https://github.com/CareyLabVT/SCCData/raw/carina-data/FCRmet.csv'
Content type 'text/plain; charset=utf-8' length 57797199 bytes (55.1 MB)
==================================================
downloaded 55.1 MB

trying URL 'https://github.com/CareyLabVT/SCCData/raw/mia-data/Catwalk.csv'
Content type 'text/plain; charset=utf-8' length 9540296 bytes (9.1 MB)
==================================================
downloaded 9.1 MB

null device 
          1 
null device 
          1 
Loading required package: methods

Attaching package: ‘lubridate’

The following object is masked from ‘package:base’:

    date

trying URL 'https://github.com/CareyLabVT/SCCData/raw/carina-data/FCRmet.csv'
Content type 'text/plain; charset=utf-8' length 57975465 bytes (55.3 MB)
==================================================
downloaded 55.3 MB

trying URL 'https://github.com/CareyLabVT/SCCData/raw/mia-data/Catwalk.csv'
Content type 'text/plain; charset=utf-8' length 9581999 bytes (9.1 MB)
==================================================
downloaded 9.1 MB

null device 
          1 
null device 
          1 
Loading required package: methods

Attaching package: ‘lubridate’

The following object is masked from ‘package:base’:

    date

trying URL 'https://github.com/CareyLabVT/SCCData/raw/carina-data/FCRmet.csv'
Content type 'text/plain; charset=utf-8' length 58153329 bytes (55.5 MB)
==================================================
downloaded 55.5 MB

trying URL 'https://github.com/CareyLabVT/SCCData/raw/mia-data/Catwalk.csv'
Content type 'text/plain; charset=utf-8' length 9623733 bytes (9.2 MB)
==================================================
downloaded 9.2 MB

null device 
          1 
null device 
          1 
Loading required package: methods

Attaching package: ‘lubridate’

The following object is masked from ‘package:base’:

    date

trying URL 'https://github.com/CareyLabVT/SCCData/raw/carina-data/FCRmet.csv'
Content type 'text/plain; charset=utf-8' length 58331051 bytes (55.6 MB)
==================================================
downloaded 55.6 MB

trying URL 'https://github.com/CareyLabVT/SCCData/raw/mia-data/Catwalk.csv'
Content type 'text/plain; charset=utf-8' length 9665490 bytes (9.2 MB)
==================================================
downloaded 9.2 MB

null device 
          1 
null device 
          1 
Loading required package: methods

Attaching package: ‘lubridate’

The following object is masked from ‘package:base’:

    date

trying URL 'https://github.com/CareyLabVT/SCCData/raw/carina-data/FCRmet.csv'
Content type 'text/plain; charset=utf-8' length 58507880 bytes (55.8 MB)
==================================================
downloaded 55.8 MB

trying URL 'https://github.com/CareyLabVT/SCCData/raw/mia-data/Catwalk.csv'
Content type 'text/plain; charset=utf-8' length 9707126 bytes (9.3 MB)
==================================================
downloaded 9.3 MB

null device 
          1 
null device 
          1 
Loading required package: methods

Attaching package: ‘lubridate’

The following object is masked from ‘package:base’:

    date

trying URL 'https://github.com/CareyLabVT/SCCData/raw/carina-data/FCRmet.csv'
Content type 'text/plain; charset=utf-8' length 58684880 bytes (56.0 MB)
==================================================
downloaded 56.0 MB

trying URL 'https://github.com/CareyLabVT/SCCData/raw/mia-data/Catwalk.csv'
Content type 'text/plain; charset=utf-8' length 9748742 bytes (9.3 MB)
==================================================
downloaded 9.3 MB

null device 
          1 
null device 
          1 
Loading required package: methods

Attaching package: ‘lubridate’

The following object is masked from ‘package:base’:

    date

trying URL 'https://github.com/CareyLabVT/SCCData/raw/carina-data/FCRmet.csv'
Content type 'text/plain; charset=utf-8' length 58862303 bytes (56.1 MB)
==================================================
downloaded 56.1 MB

trying URL 'https://github.com/CareyLabVT/SCCData/raw/mia-data/Catwalk.csv'
Content type 'text/plain; charset=utf-8' length 9790164 bytes (9.3 MB)
==================================================
downloaded 9.3 MB

null device 
          1 
null device 
          1 
Loading required package: methods

Attaching package: ‘lubridate’

The following object is masked from ‘package:base’:

    date

trying URL 'https://github.com/CareyLabVT/SCCData/raw/carina-data/FCRmet.csv'
Content type 'text/plain; charset=utf-8' length 59042316 bytes (56.3 MB)
==================================================
downloaded 56.3 MB

trying URL 'https://github.com/CareyLabVT/SCCData/raw/mia-data/Catwalk.csv'
Content type 'text/plain; charset=utf-8' length 9831829 bytes (9.4 MB)
==================================================
downloaded 9.4 MB

null device 
          1 
null device 
          1 
Loading required package: methods

Attaching package: ‘lubridate’

The following object is masked from ‘package:base’:

    date

trying URL 'https://github.com/CareyLabVT/SCCData/raw/carina-data/FCRmet.csv'
Content type 'text/plain; charset=utf-8' length 59221952 bytes (56.5 MB)
==================================================
downloaded 56.5 MB

trying URL 'https://github.com/CareyLabVT/SCCData/raw/mia-data/Catwalk.csv'
Content type 'text/plain; charset=utf-8' length 9873545 bytes (9.4 MB)
==================================================
downloaded 9.4 MB

null device 
          1 
null device 
          1 
Loading required package: methods

Attaching package: ‘lubridate’

The following object is masked from ‘package:base’:

    date

trying URL 'https://github.com/CareyLabVT/SCCData/raw/carina-data/FCRmet.csv'
Content type 'text/plain; charset=utf-8' length 59402034 bytes (56.7 MB)
==================================================
downloaded 56.7 MB

trying URL 'https://github.com/CareyLabVT/SCCData/raw/mia-data/Catwalk.csv'
Content type 'text/plain; charset=utf-8' length 9915234 bytes (9.5 MB)
==================================================
downloaded 9.5 MB

null device 
          1 
null device 
          1 
Loading required package: methods

Attaching package: ‘lubridate’

The following object is masked from ‘package:base’:

    date

trying URL 'https://github.com/CareyLabVT/SCCData/raw/carina-data/FCRmet.csv'
Content type 'text/plain; charset=utf-8' length 59580924 bytes (56.8 MB)
==================================================
downloaded 56.8 MB

trying URL 'https://github.com/CareyLabVT/SCCData/raw/mia-data/Catwalk.csv'
Content type 'text/plain; charset=utf-8' length 9956709 bytes (9.5 MB)
==================================================
downloaded 9.5 MB

null device 
          1 
null device 
          1 
Loading required package: methods

Attaching package: ‘lubridate’

The following object is masked from ‘package:base’:

    date

trying URL 'https://github.com/CareyLabVT/SCCData/raw/carina-data/FCRmet.csv'
Content type 'text/plain; charset=utf-8' length 59757263 bytes (57.0 MB)
==================================================
downloaded 57.0 MB

trying URL 'https://github.com/CareyLabVT/SCCData/raw/mia-data/Catwalk.csv'
Content type 'text/plain; charset=utf-8' length 9998250 bytes (9.5 MB)
==================================================
downloaded 9.5 MB

null device 
          1 
null device 
          1 
Loading required package: methods

Attaching package: ‘lubridate’

The following object is masked from ‘package:base’:

    date

trying URL 'https://github.com/CareyLabVT/SCCData/raw/carina-data/FCRmet.csv'
Content type 'text/plain; charset=utf-8' length 59918708 bytes (57.1 MB)
==================================================
downloaded 57.1 MB

trying URL 'https://github.com/CareyLabVT/SCCData/raw/mia-data/Catwalk.csv'
Content type 'text/plain; charset=utf-8' length 10037935 bytes (9.6 MB)
==================================================
downloaded 9.6 MB

Error in obs[i, ] <- unlist(metdata[index, c(1, 2, 3, 8, 9, 10, 11, 13,  : 
  number of items to replace is not a multiple of replacement length
Execution halted
Loading required package: methods

Attaching package: ‘lubridate’

The following object is masked from ‘package:base’:

    date

trying URL 'https://github.com/CareyLabVT/SCCData/raw/carina-data/FCRmet.csv'
Content type 'text/plain; charset=utf-8' length 59918708 bytes (57.1 MB)
==================================================
downloaded 57.1 MB

trying URL 'https://github.com/CareyLabVT/SCCData/raw/mia-data/Catwalk.csv'
Content type 'text/plain; charset=utf-8' length 10037935 bytes (9.6 MB)
==================================================
downloaded 9.6 MB

Error in obs[i, ] <- unlist(metdata[index, c(1, 2, 3, 8, 9, 10, 11, 13,  : 
  number of items to replace is not a multiple of replacement length
Execution halted
Loading required package: methods

Attaching package: ‘lubridate’

The following object is masked from ‘package:base’:

    date

trying URL 'https://github.com/CareyLabVT/SCCData/raw/carina-data/FCRmet.csv'
Content type 'text/plain; charset=utf-8' length 60095808 bytes (57.3 MB)
==================================================
downloaded 57.3 MB

trying URL 'https://github.com/CareyLabVT/SCCData/raw/mia-data/Catwalk.csv'
Content type 'text/plain; charset=utf-8' length 10079460 bytes (9.6 MB)
==================================================
downloaded 9.6 MB

Error in obs[i, ] <- unlist(metdata[index, c(1, 2, 3, 8, 9, 10, 11, 13,  : 
  number of items to replace is not a multiple of replacement length
Execution halted
Loading required package: methods

Attaching package: ‘lubridate’

The following object is masked from ‘package:base’:

    date

trying URL 'https://github.com/CareyLabVT/SCCData/raw/carina-data/FCRmet.csv'
Content type 'text/plain; charset=utf-8' length 60273080 bytes (57.5 MB)
==================================================
downloaded 57.5 MB

trying URL 'https://github.com/CareyLabVT/SCCData/raw/mia-data/Catwalk.csv'
Content type 'text/plain; charset=utf-8' length 10121161 bytes (9.7 MB)
==================================================
downloaded 9.7 MB

null device 
          1 
null device 
          1 
Loading required package: methods

Attaching package: ‘lubridate’

The following object is masked from ‘package:base’:

    date

trying URL 'https://github.com/CareyLabVT/SCCData/raw/carina-data/FCRmet.csv'
Content type 'text/plain; charset=utf-8' length 60451482 bytes (57.7 MB)
==================================================
downloaded 57.7 MB

trying URL 'https://github.com/CareyLabVT/SCCData/raw/mia-data/Catwalk.csv'
Content type 'text/plain; charset=utf-8' length 10162778 bytes (9.7 MB)
==================================================
downloaded 9.7 MB

null device 
          1 
null device 
          1 
Loading required package: methods

Attaching package: ‘lubridate’

The following object is masked from ‘package:base’:

    date

trying URL 'https://github.com/CareyLabVT/SCCData/raw/carina-data/FCRmet.csv'
Content type 'text/plain; charset=utf-8' length 60629502 bytes (57.8 MB)
==================================================
downloaded 57.8 MB

trying URL 'https://github.com/CareyLabVT/SCCData/raw/mia-data/Catwalk.csv'
Content type 'text/plain; charset=utf-8' length 10204384 bytes (9.7 MB)
==================================================
downloaded 9.7 MB

null device 
          1 
null device 
          1 
Loading required package: methods

Attaching package: ‘lubridate’

The following object is masked from ‘package:base’:

    date

trying URL 'https://github.com/CareyLabVT/SCCData/raw/carina-data/FCRmet.csv'
Content type 'text/plain; charset=utf-8' length 60806896 bytes (58.0 MB)
==================================================
downloaded 58.0 MB

trying URL 'https://github.com/CareyLabVT/SCCData/raw/mia-data/Catwalk.csv'
Content type 'text/plain; charset=utf-8' length 10245848 bytes (9.8 MB)
==================================================
downloaded 9.8 MB

null device 
          1 
null device 
          1 
Loading required package: methods

Attaching package: ‘lubridate’

The following object is masked from ‘package:base’:

    date

trying URL 'https://github.com/CareyLabVT/SCCData/raw/carina-data/FCRmet.csv'
Content type 'text/plain; charset=utf-8' length 60984857 bytes (58.2 MB)
==================================================
downloaded 58.2 MB

trying URL 'https://github.com/CareyLabVT/SCCData/raw/mia-data/Catwalk.csv'
Content type 'text/plain; charset=utf-8' length 10287447 bytes (9.8 MB)
==================================================
downloaded 9.8 MB

null device 
          1 
null device 
          1 
Loading required package: methods

Attaching package: ‘lubridate’

The following object is masked from ‘package:base’:

    date

trying URL 'https://github.com/CareyLabVT/SCCData/raw/carina-data/FCRmet.csv'
Content type 'text/plain; charset=utf-8' length 61162077 bytes (58.3 MB)
==================================================
downloaded 58.3 MB

trying URL 'https://github.com/CareyLabVT/SCCData/raw/mia-data/Catwalk.csv'
Content type 'text/plain; charset=utf-8' length 10329068 bytes (9.9 MB)
==================================================
downloaded 9.9 MB

null device 
          1 
null device 
          1 
Loading required package: methods

Attaching package: ‘lubridate’

The following object is masked from ‘package:base’:

    date

trying URL 'https://github.com/CareyLabVT/SCCData/raw/carina-data/FCRmet.csv'
Content type 'text/plain; charset=utf-8' length 61339333 bytes (58.5 MB)
==================================================
downloaded 58.5 MB

trying URL 'https://github.com/CareyLabVT/SCCData/raw/mia-data/Catwalk.csv'
Content type 'text/plain; charset=utf-8' length 10370588 bytes (9.9 MB)
==================================================
downloaded 9.9 MB

null device 
          1 
null device 
          1 
Loading required package: methods

Attaching package: ‘lubridate’

The following object is masked from ‘package:base’:

    date

trying URL 'https://github.com/CareyLabVT/SCCData/raw/carina-data/FCRmet.csv'
Content type 'text/plain; charset=utf-8' length 61517232 bytes (58.7 MB)
==================================================
downloaded 58.7 MB

trying URL 'https://github.com/CareyLabVT/SCCData/raw/mia-data/Catwalk.csv'
Content type 'text/plain; charset=utf-8' length 10412187 bytes (9.9 MB)
==================================================
downloaded 9.9 MB

null device 
          1 
null device 
          1 
Loading required package: methods

Attaching package: ‘lubridate’

The following object is masked from ‘package:base’:

    date

trying URL 'https://github.com/CareyLabVT/SCCData/raw/carina-data/FCRmet.csv'
Content type 'text/plain; charset=utf-8' length 61695431 bytes (58.8 MB)
==================================================
downloaded 58.8 MB

trying URL 'https://github.com/CareyLabVT/SCCData/raw/mia-data/Catwalk.csv'
Content type 'text/plain; charset=utf-8' length 10453735 bytes (10.0 MB)
==================================================
downloaded 10.0 MB

null device 
          1 
null device 
          1 
Loading required package: methods

Attaching package: ‘lubridate’

The following object is masked from ‘package:base’:

    date

trying URL 'https://github.com/CareyLabVT/SCCData/raw/carina-data/FCRmet.csv'
Content type 'text/plain; charset=utf-8' length 61872133 bytes (59.0 MB)
==================================================
downloaded 59.0 MB

trying URL 'https://github.com/CareyLabVT/SCCData/raw/mia-data/Catwalk.csv'
Content type 'text/plain; charset=utf-8' length 10495231 bytes (10.0 MB)
==================================================
downloaded 10.0 MB

null device 
          1 
null device 
          1 
Loading required package: methods

Attaching package: ‘lubridate’

The following object is masked from ‘package:base’:

    date

trying URL 'https://github.com/CareyLabVT/SCCData/raw/carina-data/FCRmet.csv'
Content type 'text/plain; charset=utf-8' length 62048789 bytes (59.2 MB)
==================================================
downloaded 59.2 MB

trying URL 'https://github.com/CareyLabVT/SCCData/raw/mia-data/Catwalk.csv'
Content type 'text/plain; charset=utf-8' length 10536710 bytes (10.0 MB)
==================================================
downloaded 10.0 MB

null device 
          1 
null device 
          1 
Loading required package: methods

Attaching package: ‘lubridate’

The following object is masked from ‘package:base’:

    date

trying URL 'https://github.com/CareyLabVT/SCCData/raw/carina-data/FCRmet.csv'
Content type 'text/plain; charset=utf-8' length 62226051 bytes (59.3 MB)
==================================================
downloaded 59.3 MB

trying URL 'https://github.com/CareyLabVT/SCCData/raw/mia-data/Catwalk.csv'
Content type 'text/plain; charset=utf-8' length 10578173 bytes (10.1 MB)
==================================================
downloaded 10.1 MB

null device 
          1 
null device 
          1 
Loading required package: methods

Attaching package: ‘lubridate’

The following object is masked from ‘package:base’:

    date

trying URL 'https://github.com/CareyLabVT/SCCData/raw/carina-data/FCRmet.csv'
Content type 'text/plain; charset=utf-8' length 62403353 bytes (59.5 MB)
==================================================
downloaded 59.5 MB

trying URL 'https://github.com/CareyLabVT/SCCData/raw/mia-data/Catwalk.csv'
Content type 'text/plain; charset=utf-8' length 10619757 bytes (10.1 MB)
==================================================
downloaded 10.1 MB

null device 
          1 
null device 
          1 
Loading required package: methods

Attaching package: ‘lubridate’

The following object is masked from ‘package:base’:

    date

trying URL 'https://github.com/CareyLabVT/SCCData/raw/carina-data/FCRmet.csv'
Content type 'text/plain; charset=utf-8' length 62580900 bytes (59.7 MB)
==================================================
downloaded 59.7 MB

trying URL 'https://github.com/CareyLabVT/SCCData/raw/mia-data/Catwalk.csv'
Content type 'text/plain; charset=utf-8' length 10661429 bytes (10.2 MB)
==================================================
downloaded 10.2 MB

null device 
          1 
null device 
          1 
Loading required package: methods

Attaching package: ‘lubridate’

The following object is masked from ‘package:base’:

    date

trying URL 'https://github.com/CareyLabVT/SCCData/raw/carina-data/FCRmet.csv'
Content type 'text/plain; charset=utf-8' length 62757440 bytes (59.9 MB)
==================================================
downloaded 59.9 MB

trying URL 'https://github.com/CareyLabVT/SCCData/raw/mia-data/Catwalk.csv'
Content type 'text/plain; charset=utf-8' length 10703066 bytes (10.2 MB)
==================================================
downloaded 10.2 MB

null device 
          1 
null device 
          1 
Loading required package: methods

Attaching package: ‘lubridate’

The following object is masked from ‘package:base’:

    date

trying URL 'https://github.com/CareyLabVT/SCCData/raw/carina-data/FCRmet.csv'
Content type 'text/plain; charset=utf-8' length 62934574 bytes (60.0 MB)
==================================================
downloaded 60.0 MB

trying URL 'https://github.com/CareyLabVT/SCCData/raw/mia-data/Catwalk.csv'
Content type 'text/plain; charset=utf-8' length 10744717 bytes (10.2 MB)
==================================================
downloaded 10.2 MB

null device 
          1 
null device 
          1 
Loading required package: methods

Attaching package: ‘lubridate’

The following object is masked from ‘package:base’:

    date

trying URL 'https://github.com/CareyLabVT/SCCData/raw/carina-data/FCRmet.csv'
Content type 'text/plain; charset=utf-8' length 63112184 bytes (60.2 MB)
==================================================
downloaded 60.2 MB

trying URL 'https://github.com/CareyLabVT/SCCData/raw/mia-data/Catwalk.csv'
Content type 'text/plain; charset=utf-8' length 10786367 bytes (10.3 MB)
==================================================
downloaded 10.3 MB

null device 
          1 
null device 
          1 
Loading required package: methods

Attaching package: ‘lubridate’

The following object is masked from ‘package:base’:

    date

trying URL 'https://github.com/CareyLabVT/SCCData/raw/carina-data/FCRmet.csv'
Content type 'text/plain; charset=utf-8' length 63289900 bytes (60.4 MB)
==================================================
downloaded 60.4 MB

trying URL 'https://github.com/CareyLabVT/SCCData/raw/mia-data/Catwalk.csv'
Content type 'text/plain; charset=utf-8' length 10828052 bytes (10.3 MB)
==================================================
downloaded 10.3 MB

null device 
          1 
null device 
          1 
Loading required package: methods

Attaching package: ‘lubridate’

The following object is masked from ‘package:base’:

    date

trying URL 'https://github.com/CareyLabVT/SCCData/raw/carina-data/FCRmet.csv'
Content type 'text/plain; charset=utf-8' length 63467314 bytes (60.5 MB)
==================================================
downloaded 60.5 MB

trying URL 'https://github.com/CareyLabVT/SCCData/raw/mia-data/Catwalk.csv'
Content type 'text/plain; charset=utf-8' length 10869789 bytes (10.4 MB)
==================================================
downloaded 10.4 MB

null device 
          1 
null device 
          1 
Loading required package: methods

Attaching package: ‘lubridate’

The following object is masked from ‘package:base’:

    date

trying URL 'https://github.com/CareyLabVT/SCCData/raw/carina-data/FCRmet.csv'
Content type 'text/plain; charset=utf-8' length 63644536 bytes (60.7 MB)
==================================================
downloaded 60.7 MB

trying URL 'https://github.com/CareyLabVT/SCCData/raw/mia-data/Catwalk.csv'
Content type 'text/plain; charset=utf-8' length 10911462 bytes (10.4 MB)
==================================================
downloaded 10.4 MB

null device 
          1 
null device 
          1 
Loading required package: methods

Attaching package: ‘lubridate’

The following object is masked from ‘package:base’:

    date

trying URL 'https://github.com/CareyLabVT/SCCData/raw/carina-data/FCRmet.csv'
Content type 'text/plain; charset=utf-8' length 63821481 bytes (60.9 MB)
==================================================
downloaded 60.9 MB

trying URL 'https://github.com/CareyLabVT/SCCData/raw/mia-data/Catwalk.csv'
Content type 'text/plain; charset=utf-8' length 10953218 bytes (10.4 MB)
==================================================
downloaded 10.4 MB

null device 
          1 
null device 
          1 
Loading required package: methods

Attaching package: ‘lubridate’

The following object is masked from ‘package:base’:

    date

trying URL 'https://github.com/CareyLabVT/SCCData/raw/carina-data/FCRmet.csv'
Content type 'text/plain; charset=utf-8' length 63999933 bytes (61.0 MB)
==================================================
downloaded 61.0 MB

trying URL 'https://github.com/CareyLabVT/SCCData/raw/mia-data/Catwalk.csv'
Content type 'text/plain; charset=utf-8' length 10994893 bytes (10.5 MB)
==================================================
downloaded 10.5 MB

null device 
          1 
null device 
          1 
Loading required package: methods

Attaching package: ‘lubridate’

The following object is masked from ‘package:base’:

    date

trying URL 'https://github.com/CareyLabVT/SCCData/raw/carina-data/FCRmet.csv'
Content type 'text/plain; charset=utf-8' length 64177951 bytes (61.2 MB)
==================================================
downloaded 61.2 MB

trying URL 'https://github.com/CareyLabVT/SCCData/raw/mia-data/Catwalk.csv'
Content type 'text/plain; charset=utf-8' length 11036605 bytes (10.5 MB)
==================================================
downloaded 10.5 MB

null device 
          1 
null device 
          1 
Loading required package: methods

Attaching package: ‘lubridate’

The following object is masked from ‘package:base’:

    date

trying URL 'https://github.com/CareyLabVT/SCCData/raw/carina-data/FCRmet.csv'
Content type 'text/plain; charset=utf-8' length 64355024 bytes (61.4 MB)
==================================================
downloaded 61.4 MB

trying URL 'https://github.com/CareyLabVT/SCCData/raw/mia-data/Catwalk.csv'
Content type 'text/plain; charset=utf-8' length 11078323 bytes (10.6 MB)
==================================================
downloaded 10.6 MB

null device 
          1 
null device 
          1 
From https://github.com/CareyLabVT/SCCData
   1958bd3..be2b2c6  daily-email -> origin/daily-email
error: Your local changes to the following files would be overwritten by merge:
	SensorCheckScript.R
Please commit your changes or stash them before you merge.
Aborting
Updating 1958bd3..be2b2c6
Loading required package: methods

Attaching package: ‘lubridate’

The following object is masked from ‘package:base’:

    date

trying URL 'https://github.com/CareyLabVT/SCCData/raw/carina-data/FCRmet.csv'
Content type 'text/plain; charset=utf-8' length 64355024 bytes (61.4 MB)
==================================================
downloaded 61.4 MB

trying URL 'https://github.com/CareyLabVT/SCCData/raw/mia-data/Catwalk.csv'
Content type 'text/plain; charset=utf-8' length 11078323 bytes (10.6 MB)
==================================================
downloaded 10.6 MB

Auto-merging SensorCheckScript.R
CONFLICT (content): Merge conflict in SensorCheckScript.R
Automatic merge failed; fix conflicts and then commit the result.
Error: unexpected input in "<<"
Execution halted
[daily-email 3370bf7] 04/04/19 11:32:21 EST -0500: Sensor Check
Already up to date.
Loading required package: methods

Attaching package: ‘lubridate’

The following object is masked from ‘package:base’:

    date

trying URL 'https://github.com/CareyLabVT/SCCData/raw/carina-data/FCRmet.csv'
Content type 'text/plain; charset=utf-8' length 64531969 bytes (61.5 MB)
==================================================
downloaded 61.5 MB

trying URL 'https://github.com/CareyLabVT/SCCData/raw/mia-data/Catwalk.csv'
Content type 'text/plain; charset=utf-8' length 11120053 bytes (10.6 MB)
==================================================
downloaded 10.6 MB

null device 
          1 
null device 
          1 
[daily-email 9cd28e9] 04/05/19 06:27:01 EST -0500: Sensor Check
 5 files changed, 1607 insertions(+)
 create mode 100644 CatwalkDataFigures_2019-04-05.pdf
 create mode 100644 MetDataFigures_2019-04-05.pdf
remote: warning: GH001: Large files detected. You may want to try Git Large File Storage - https://git-lfs.github.com.        
remote: warning: See http://git.io/iEPt8g for more information.        
remote: warning: File FCRmet.csv is 61.54 MB; this is larger than GitHub's recommended maximum file size of 50.00 MB        
To github.com:CareyLabVT/SCCData.git
   b3ade4e..9cd28e9  daily-email -> daily-email
Already up to date.
Loading required package: methods

Attaching package: ‘lubridate’

The following object is masked from ‘package:base’:

    date

trying URL 'https://github.com/CareyLabVT/SCCData/raw/carina-data/FCRmet.csv'
Content type 'text/plain; charset=utf-8' length 64708019 bytes (61.7 MB)
==================================================
downloaded 61.7 MB

trying URL 'https://github.com/CareyLabVT/SCCData/raw/mia-data/Catwalk.csv'
Content type 'text/plain; charset=utf-8' length 11161788 bytes (10.6 MB)
==================================================
downloaded 10.6 MB

null device 
          1 
null device 
          1 
[daily-email c9b307b] 04/06/19 06:27:01 EST -0500: Sensor Check
 7 files changed, 1667 insertions(+), 3 deletions(-)
 create mode 100644 CatwalkDataFigures_2019-04-06.pdf
 create mode 100644 MetDataFigures_2019-04-06.pdf
remote: warning: GH001: Large files detected. You may want to try Git Large File Storage - https://git-lfs.github.com.        
remote: warning: See http://git.io/iEPt8g for more information.        
remote: warning: File FCRmet.csv is 61.71 MB; this is larger than GitHub's recommended maximum file size of 50.00 MB        
To github.com:CareyLabVT/SCCData.git
   9cd28e9..c9b307b  daily-email -> daily-email
Already up to date.
Loading required package: methods

Attaching package: ‘lubridate’

The following object is masked from ‘package:base’:

    date

trying URL 'https://github.com/CareyLabVT/SCCData/raw/carina-data/FCRmet.csv'
Content type 'text/plain; charset=utf-8' length 64884454 bytes (61.9 MB)
==================================================
downloaded 61.9 MB

trying URL 'https://github.com/CareyLabVT/SCCData/raw/mia-data/Catwalk.csv'
Content type 'text/plain; charset=utf-8' length 11203391 bytes (10.7 MB)
==================================================
downloaded 10.7 MB

null device 
          1 
null device 
          1 
[daily-email f9e8aa1] 04/07/19 06:27:01 EST -0500: Sensor Check
 7 files changed, 1662 insertions(+), 5 deletions(-)
 create mode 100644 CatwalkDataFigures_2019-04-07.pdf
 create mode 100644 MetDataFigures_2019-04-07.pdf
remote: warning: GH001: Large files detected. You may want to try Git Large File Storage - https://git-lfs.github.com.        
remote: warning: See http://git.io/iEPt8g for more information.        
remote: warning: File FCRmet.csv is 61.88 MB; this is larger than GitHub's recommended maximum file size of 50.00 MB        
To github.com:CareyLabVT/SCCData.git
   c9b307b..f9e8aa1  daily-email -> daily-email
ssh: Could not resolve hostname github.com: Temporary failure in name resolution
fatal: Could not read from remote repository.

Please make sure you have the correct access rights
and the repository exists.
Loading required package: methods

Attaching package: ‘lubridate’

The following object is masked from ‘package:base’:

    date

trying URL 'https://github.com/CareyLabVT/SCCData/raw/carina-data/FCRmet.csv'
Error in download.file("https://github.com/CareyLabVT/SCCData/raw/carina-data/FCRmet.csv",  : 
  cannot open URL 'https://github.com/CareyLabVT/SCCData/raw/carina-data/FCRmet.csv'
In addition: Warning message:
In download.file("https://github.com/CareyLabVT/SCCData/raw/carina-data/FCRmet.csv",  :
  URL 'https://github.com/CareyLabVT/SCCData/raw/carina-data/FCRmet.csv': status was 'Couldn't resolve host name'
Execution halted
[daily-email 2c7a5d0] 04/08/19 06:27:01 EST -0500: Sensor Check
 4 files changed, 76 insertions(+), 527307 deletions(-)
 delete mode 100644 FCRmet.csv
ssh: Could not resolve hostname github.com: Temporary failure in name resolution
fatal: Could not read from remote repository.

Please make sure you have the correct access rights
and the repository exists.
Already up to date.
Loading required package: methods

Attaching package: ‘lubridate’

The following object is masked from ‘package:base’:

    date

trying URL 'https://github.com/CareyLabVT/SCCData/raw/carina-data/FCRmet.csv'
Content type 'text/plain; charset=utf-8' length 65237639 bytes (62.2 MB)
==================================================
downloaded 62.2 MB

trying URL 'https://github.com/CareyLabVT/SCCData/raw/mia-data/Catwalk.csv'
Content type 'text/plain; charset=utf-8' length 11286641 bytes (10.8 MB)
==================================================
downloaded 10.8 MB

null device 
          1 
null device 
          1 
[daily-email 3b3fbf5] 04/09/19 06:27:01 EST -0500: Sensor Check
 7 files changed, 530522 insertions(+), 5 deletions(-)
 create mode 100644 CatwalkDataFigures_2019-04-09.pdf
 create mode 100644 FCRmet.csv
 create mode 100644 MetDataFigures_2019-04-09.pdf
remote: warning: GH001: Large files detected. You may want to try Git Large File Storage - https://git-lfs.github.com.        
remote: warning: See http://git.io/iEPt8g for more information.        
remote: warning: File FCRmet.csv is 62.22 MB; this is larger than GitHub's recommended maximum file size of 50.00 MB        
To github.com:CareyLabVT/SCCData.git
   f9e8aa1..3b3fbf5  daily-email -> daily-email
Already up to date.
Loading required package: methods

Attaching package: ‘lubridate’

The following object is masked from ‘package:base’:

    date

trying URL 'https://github.com/CareyLabVT/SCCData/raw/carina-data/FCRmet.csv'
Content type 'text/plain; charset=utf-8' length 65414578 bytes (62.4 MB)
==================================================
downloaded 62.4 MB

trying URL 'https://github.com/CareyLabVT/SCCData/raw/mia-data/Catwalk.csv'
Content type 'text/plain; charset=utf-8' length 11328287 bytes (10.8 MB)
==================================================
downloaded 10.8 MB

null device 
          1 
null device 
          1 
[daily-email 93cc51a] 04/10/19 06:27:01 EST -0500: Sensor Check
 6 files changed, 1611 insertions(+)
 create mode 100644 CatwalkDataFigures_2019-04-10.pdf
 create mode 100644 MetDataFigures_2019-04-10.pdf
remote: warning: GH001: Large files detected. You may want to try Git Large File Storage - https://git-lfs.github.com.        
remote: warning: See http://git.io/iEPt8g for more information.        
remote: warning: File FCRmet.csv is 62.38 MB; this is larger than GitHub's recommended maximum file size of 50.00 MB        
To github.com:CareyLabVT/SCCData.git
   a279547..93cc51a  daily-email -> daily-email
Already up to date.
Loading required package: methods

Attaching package: ‘lubridate’

The following object is masked from ‘package:base’:

    date

trying URL 'https://github.com/CareyLabVT/SCCData/raw/carina-data/FCRmet.csv'
Content type 'text/plain; charset=utf-8' length 65591325 bytes (62.6 MB)
==================================================
downloaded 62.6 MB

trying URL 'https://github.com/CareyLabVT/SCCData/raw/mia-data/Catwalk.csv'
Content type 'text/plain; charset=utf-8' length 11369979 bytes (10.8 MB)
==================================================
downloaded 10.8 MB

null device 
          1 
null device 
          1 
[daily-email 69a04cc] 04/11/19 06:27:01 EST -0500: Sensor Check
 6 files changed, 1611 insertions(+)
 create mode 100644 CatwalkDataFigures_2019-04-11.pdf
 create mode 100644 MetDataFigures_2019-04-11.pdf
remote: warning: GH001: Large files detected. You may want to try Git Large File Storage - https://git-lfs.github.com.        
remote: warning: See http://git.io/iEPt8g for more information.        
remote: warning: File FCRmet.csv is 62.55 MB; this is larger than GitHub's recommended maximum file size of 50.00 MB        
To github.com:CareyLabVT/SCCData.git
   3057ada..69a04cc  daily-email -> daily-email
Already up to date.
Loading required package: methods

Attaching package: ‘lubridate’

The following object is masked from ‘package:base’:

    date

trying URL 'https://github.com/CareyLabVT/SCCData/raw/carina-data/FCRmet.csv'
Content type 'text/plain; charset=utf-8' length 65769129 bytes (62.7 MB)
==================================================
downloaded 62.7 MB

trying URL 'https://github.com/CareyLabVT/SCCData/raw/mia-data/Catwalk.csv'
Content type 'text/plain; charset=utf-8' length 11411793 bytes (10.9 MB)
==================================================
downloaded 10.9 MB

null device 
          1 
null device 
          1 
[daily-email 22a88b4] 04/12/19 06:27:01 EST -0500: Sensor Check
 6 files changed, 1611 insertions(+)
 create mode 100644 CatwalkDataFigures_2019-04-12.pdf
 create mode 100644 MetDataFigures_2019-04-12.pdf
remote: warning: GH001: Large files detected. You may want to try Git Large File Storage - https://git-lfs.github.com.        
remote: warning: See http://git.io/iEPt8g for more information.        
remote: warning: File FCRmet.csv is 62.72 MB; this is larger than GitHub's recommended maximum file size of 50.00 MB        
To github.com:CareyLabVT/SCCData.git
   9a55f54..22a88b4  daily-email -> daily-email
Already up to date.
Loading required package: methods

Attaching package: ‘lubridate’

The following object is masked from ‘package:base’:

    date

trying URL 'https://github.com/CareyLabVT/SCCData/raw/carina-data/FCRmet.csv'
Content type 'text/plain; charset=utf-8' length 65945740 bytes (62.9 MB)
==================================================
downloaded 62.9 MB

trying URL 'https://github.com/CareyLabVT/SCCData/raw/mia-data/Catwalk.csv'
Content type 'text/plain; charset=utf-8' length 11453639 bytes (10.9 MB)
==================================================
downloaded 10.9 MB

null device 
          1 
null device 
          1 
[daily-email b645413] 04/13/19 06:27:01 EST -0500: Sensor Check
 6 files changed, 1611 insertions(+)
 create mode 100644 CatwalkDataFigures_2019-04-13.pdf
 create mode 100644 MetDataFigures_2019-04-13.pdf
remote: warning: GH001: Large files detected. You may want to try Git Large File Storage - https://git-lfs.github.com.        
remote: warning: See http://git.io/iEPt8g for more information.        
remote: warning: File FCRmet.csv is 62.89 MB; this is larger than GitHub's recommended maximum file size of 50.00 MB        
To github.com:CareyLabVT/SCCData.git
   9b68e9e..b645413  daily-email -> daily-email
Already up to date.
Loading required package: methods

Attaching package: ‘lubridate’

The following object is masked from ‘package:base’:

    date

trying URL 'https://github.com/CareyLabVT/SCCData/raw/carina-data/FCRmet.csv'
Content type 'text/plain; charset=utf-8' length 66121952 bytes (63.1 MB)
==================================================
downloaded 63.1 MB

trying URL 'https://github.com/CareyLabVT/SCCData/raw/mia-data/Catwalk.csv'
Content type 'text/plain; charset=utf-8' length 11495460 bytes (11.0 MB)
==================================================
downloaded 11.0 MB

null device 
          1 
null device 
          1 
[daily-email 8c4dcc3] 04/14/19 06:27:01 EST -0500: Sensor Check
 6 files changed, 1611 insertions(+)
 create mode 100644 CatwalkDataFigures_2019-04-14.pdf
 create mode 100644 MetDataFigures_2019-04-14.pdf
remote: warning: GH001: Large files detected. You may want to try Git Large File Storage - https://git-lfs.github.com.        
remote: warning: See http://git.io/iEPt8g for more information.        
remote: warning: File FCRmet.csv is 63.06 MB; this is larger than GitHub's recommended maximum file size of 50.00 MB        
To github.com:CareyLabVT/SCCData.git
   80052e7..8c4dcc3  daily-email -> daily-email
Already up to date.
Loading required package: methods

Attaching package: ‘lubridate’

The following object is masked from ‘package:base’:

    date

trying URL 'https://github.com/CareyLabVT/SCCData/raw/carina-data/FCRmet.csv'
Content type 'text/plain; charset=utf-8' length 66299072 bytes (63.2 MB)
==================================================
downloaded 63.2 MB

trying URL 'https://github.com/CareyLabVT/SCCData/raw/mia-data/Catwalk.csv'
Content type 'text/plain; charset=utf-8' length 11537346 bytes (11.0 MB)
==================================================
downloaded 11.0 MB

null device 
          1 
null device 
          1 
[daily-email d52ab5e] 04/15/19 06:27:01 EST -0500: Sensor Check
 6 files changed, 1611 insertions(+)
 create mode 100644 CatwalkDataFigures_2019-04-15.pdf
 create mode 100644 MetDataFigures_2019-04-15.pdf
remote: warning: GH001: Large files detected. You may want to try Git Large File Storage - https://git-lfs.github.com.        
remote: warning: See http://git.io/iEPt8g for more information.        
remote: warning: File FCRmet.csv is 63.23 MB; this is larger than GitHub's recommended maximum file size of 50.00 MB        
To github.com:CareyLabVT/SCCData.git
   a18d75b..d52ab5e  daily-email -> daily-email
Already up to date.
Loading required package: methods

Attaching package: ‘lubridate’

The following object is masked from ‘package:base’:

    date

trying URL 'https://github.com/CareyLabVT/SCCData/raw/carina-data/FCRmet.csv'
Content type 'text/plain; charset=utf-8' length 66483180 bytes (63.4 MB)
==================================================
downloaded 63.4 MB

trying URL 'https://github.com/CareyLabVT/SCCData/raw/mia-data/Catwalk.csv'
Content type 'text/plain; charset=utf-8' length 11578890 bytes (11.0 MB)
==================================================
downloaded 11.0 MB

Error in obs[i, ] <- unlist(metdata[index, c(1, 2, 3, 8, 9, 10, 11, 13,  : 
  number of items to replace is not a multiple of replacement length
Execution halted
[daily-email e76f7cc] 04/16/19 06:27:01 EST -0500: Sensor Check
 4 files changed, 1670 insertions(+)
remote: warning: GH001: Large files detected. You may want to try Git Large File Storage - https://git-lfs.github.com.        
remote: warning: See http://git.io/iEPt8g for more information.        
remote: warning: File FCRmet.csv is 63.40 MB; this is larger than GitHub's recommended maximum file size of 50.00 MB        
To github.com:CareyLabVT/SCCData.git
   979ab12..e76f7cc  daily-email -> daily-email
Already up to date.
Loading required package: methods

Attaching package: ‘lubridate’

The following object is masked from ‘package:base’:

    date

trying URL 'https://github.com/CareyLabVT/SCCData/raw/carina-data/FCRmet.csv'
Content type 'text/plain; charset=utf-8' length 66483180 bytes (63.4 MB)
==================================================
downloaded 63.4 MB

trying URL 'https://github.com/CareyLabVT/SCCData/raw/mia-data/Catwalk.csv'
Content type 'text/plain; charset=utf-8' length 11578890 bytes (11.0 MB)
==================================================
downloaded 11.0 MB

Error in obs[i, ] <- unlist(metdata[index, c(1, 2, 3, 8, 9, 10, 11, 13,  : 
  number of items to replace is not a multiple of replacement length
Execution halted
[daily-email 0a96aa0] 04/16/19 07:48:06 EST -0500: Sensor Check
 2 files changed, 26 insertions(+)
To github.com:CareyLabVT/SCCData.git
   771e6be..0a96aa0  daily-email -> daily-email
From github.com:CareyLabVT/SCCData
   0a96aa0..c43b891  daily-email -> origin/daily-email
Updating 0a96aa0..c43b891
Fast-forward
 CatwalkDataFigures_2019-04-16.pdf | Bin 0 -> 105105 bytes
 MetDataFigures_2019-04-16.pdf     | Bin 0 -> 187356 bytes
 SensorCheckScript.R               |  12 ++++++++----
 3 files changed, 8 insertions(+), 4 deletions(-)
 create mode 100644 CatwalkDataFigures_2019-04-16.pdf
 create mode 100644 MetDataFigures_2019-04-16.pdf
Loading required package: methods

Attaching package: ‘lubridate’

The following object is masked from ‘package:base’:

    date

trying URL 'https://github.com/CareyLabVT/SCCData/raw/carina-data/FCRmet.csv'
Content type 'text/plain; charset=utf-8' length 66660100 bytes (63.6 MB)
==================================================
downloaded 63.6 MB

trying URL 'https://github.com/CareyLabVT/SCCData/raw/mia-data/Catwalk.csv'
Content type 'text/plain; charset=utf-8' length 11620745 bytes (11.1 MB)
==================================================
downloaded 11.1 MB

Error in obs[i, ] <- unlist(metdata[index, c(1, 2, 3, 8, 9, 10, 11, 13,  : 
  number of items to replace is not a multiple of replacement length
Execution halted
[daily-email 14c206c] 04/17/19 06:27:01 EST -0500: Sensor Check
 3 files changed, 1619 insertions(+)
remote: warning: GH001: Large files detected. You may want to try Git Large File Storage - https://git-lfs.github.com.        
remote: warning: See http://git.io/iEPt8g for more information.        
remote: warning: File FCRmet.csv is 63.57 MB; this is larger than GitHub's recommended maximum file size of 50.00 MB        
To github.com:CareyLabVT/SCCData.git
   c43b891..14c206c  daily-email -> daily-email
Already up to date.
Loading required package: methods

Attaching package: ‘lubridate’

The following object is masked from ‘package:base’:

    date

trying URL 'https://github.com/CareyLabVT/SCCData/raw/carina-data/FCRmet.csv'
Content type 'text/plain; charset=utf-8' length 66660100 bytes (63.6 MB)
==================================================
downloaded 63.6 MB

trying URL 'https://github.com/CareyLabVT/SCCData/raw/mia-data/Catwalk.csv'
Content type 'text/plain; charset=utf-8' length 11620745 bytes (11.1 MB)
==================================================
downloaded 11.1 MB

Error in obs[i, ] <- unlist(metdata[index, c(1, 2, 3, 8, 9, 10, 11, 13,  : 
  number of items to replace is not a multiple of replacement length
Execution halted
[daily-email 1fe038d] 04/17/19 15:04:59 EST -0500: Sensor Check
 2 files changed, 26 insertions(+)
To github.com:CareyLabVT/SCCData.git
   6bb4b44..1fe038d  daily-email -> daily-email
Already up to date.
Loading required package: methods

Attaching package: ‘lubridate’

The following object is masked from ‘package:base’:

    date

trying URL 'https://github.com/CareyLabVT/SCCData/raw/carina-data/FCRmet.csv'
Content type 'text/plain; charset=utf-8' length 66837260 bytes (63.7 MB)
==================================================
downloaded 63.7 MB

trying URL 'https://github.com/CareyLabVT/SCCData/raw/mia-data/Catwalk.csv'
Content type 'text/plain; charset=utf-8' length 11662602 bytes (11.1 MB)
==================================================
downloaded 11.1 MB

Error in obs[i, ] <- unlist(metdata[index, c(1, 2, 3, 8, 9, 10, 11, 13,  : 
  number of items to replace is not a multiple of replacement length
Execution halted
[daily-email 7429028] 04/18/19 06:27:01 EST -0500: Sensor Check
 3 files changed, 1610 insertions(+)
remote: warning: GH001: Large files detected. You may want to try Git Large File Storage - https://git-lfs.github.com.        
remote: warning: See http://git.io/iEPt8g for more information.        
remote: warning: File FCRmet.csv is 63.74 MB; this is larger than GitHub's recommended maximum file size of 50.00 MB        
To github.com:CareyLabVT/SCCData.git
   1fe038d..7429028  daily-email -> daily-email
Already up to date.
Loading required package: methods

Attaching package: ‘lubridate’

The following object is masked from ‘package:base’:

    date

trying URL 'https://github.com/CareyLabVT/SCCData/raw/carina-data/FCRmet.csv'
Content type 'text/plain; charset=utf-8' length 66837260 bytes (63.7 MB)
==================================================
downloaded 63.7 MB

trying URL 'https://github.com/CareyLabVT/SCCData/raw/mia-data/Catwalk.csv'
Content type 'text/plain; charset=utf-8' length 11662602 bytes (11.1 MB)
==================================================
downloaded 11.1 MB

Error in obs[i, ] <- unlist(metdata[index, c(1, 2, 3, 8, 9, 10, 11, 13,  : 
  number of items to replace is not a multiple of replacement length
Execution halted
[daily-email a390be0] 04/18/19 07:29:57 EST -0500: Sensor Check
 2 files changed, 26 insertions(+)
To github.com:CareyLabVT/SCCData.git
   3d1b345..a390be0  daily-email -> daily-email
From github.com:CareyLabVT/SCCData
   a390be0..d39cf25  daily-email -> origin/daily-email
Updating a390be0..d39cf25
Fast-forward
 SensorCheckScript.R | 1 +
 1 file changed, 1 insertion(+)
Loading required package: methods

Attaching package: ‘lubridate’

The following object is masked from ‘package:base’:

    date

trying URL 'https://github.com/CareyLabVT/SCCData/raw/carina-data/FCRmet.csv'
Content type 'text/plain; charset=utf-8' length 66837260 bytes (63.7 MB)
==================================================
downloaded 63.7 MB

trying URL 'https://github.com/CareyLabVT/SCCData/raw/mia-data/Catwalk.csv'
Content type 'text/plain; charset=utf-8' length 11662602 bytes (11.1 MB)
==================================================
downloaded 11.1 MB

null device 
          1 
null device 
          1 
[daily-email 28cf725] 04/18/19 08:33:05 EST -0500: Sensor Check
 3 files changed, 32 insertions(+)
 create mode 100644 CatwalkDataFigures_2019-04-18.pdf
 create mode 100644 MetDataFigures_2019-04-18.pdf
To github.com:CareyLabVT/SCCData.git
   d39cf25..28cf725  daily-email -> daily-email
Already up to date.
Loading required package: methods

Attaching package: ‘lubridate’

The following object is masked from ‘package:base’:

    date

trying URL 'https://github.com/CareyLabVT/SCCData/raw/carina-data/FCRmet.csv'
Content type 'text/plain; charset=utf-8' length 67014445 bytes (63.9 MB)
==================================================
downloaded 63.9 MB

trying URL 'https://github.com/CareyLabVT/SCCData/raw/mia-data/Catwalk.csv'
Content type 'text/plain; charset=utf-8' length 11662602 bytes (11.1 MB)
==================================================
downloaded 11.1 MB

null device 
          1 
null device 
          1 
[daily-email fd35069] 04/19/19 06:27:01 EST -0500: Sensor Check
 5 files changed, 1467 insertions(+)
 create mode 100644 CatwalkDataFigures_2019-04-19.pdf
 create mode 100644 MetDataFigures_2019-04-19.pdf
remote: warning: GH001: Large files detected. You may want to try Git Large File Storage - https://git-lfs.github.com.        
remote: warning: See http://git.io/iEPt8g for more information.        
remote: warning: File FCRmet.csv is 63.91 MB; this is larger than GitHub's recommended maximum file size of 50.00 MB        
To github.com:CareyLabVT/SCCData.git
   cbdeecd..fd35069  daily-email -> daily-email
Already up to date.
Loading required package: methods

Attaching package: ‘lubridate’

The following object is masked from ‘package:base’:

    date

trying URL 'https://github.com/CareyLabVT/SCCData/raw/carina-data/FCRmet.csv'
Content type 'text/plain; charset=utf-8' length 67192447 bytes (64.1 MB)
==================================================
downloaded 64.1 MB

trying URL 'https://github.com/CareyLabVT/SCCData/raw/mia-data/Catwalk.csv'
Content type 'text/plain; charset=utf-8' length 11746355 bytes (11.2 MB)
==================================================
downloaded 11.2 MB

null device 
          1 
null device 
          1 
[daily-email 81f5aa7] 04/20/19 06:27:01 EST -0500: Sensor Check
 7 files changed, 1812 insertions(+)
 create mode 100644 CatwalkDataFigures_2019-04-20.pdf
 create mode 100644 MetDataFigures_2019-04-20.pdf
remote: warning: GH001: Large files detected. You may want to try Git Large File Storage - https://git-lfs.github.com.        
remote: warning: See http://git.io/iEPt8g for more information.        
remote: warning: File FCRmet.csv is 64.08 MB; this is larger than GitHub's recommended maximum file size of 50.00 MB        
To github.com:CareyLabVT/SCCData.git
   2ebd830..81f5aa7  daily-email -> daily-email
Already up to date.
Loading required package: methods

Attaching package: ‘lubridate’

The following object is masked from ‘package:base’:

    date

trying URL 'https://github.com/CareyLabVT/SCCData/raw/carina-data/FCRmet.csv'
Content type 'text/plain; charset=utf-8' length 67370234 bytes (64.2 MB)
==================================================
downloaded 64.2 MB

trying URL 'https://github.com/CareyLabVT/SCCData/raw/mia-data/Catwalk.csv'
Content type 'text/plain; charset=utf-8' length 11788275 bytes (11.2 MB)
==================================================
downloaded 11.2 MB

null device 
          1 
null device 
          1 
[daily-email 9b3fb1b] 04/21/19 06:27:01 EST -0500: Sensor Check
 7 files changed, 1638 insertions(+), 114 deletions(-)
 create mode 100644 CatwalkDataFigures_2019-04-21.pdf
 create mode 100644 MetDataFigures_2019-04-21.pdf
 rewrite git-log.log (86%)
remote: warning: GH001: Large files detected. You may want to try Git Large File Storage - https://git-lfs.github.com.        
remote: warning: See http://git.io/iEPt8g for more information.        
remote: warning: File FCRmet.csv is 64.25 MB; this is larger than GitHub's recommended maximum file size of 50.00 MB        
To github.com:CareyLabVT/SCCData.git
   ee2badf..9b3fb1b  daily-email -> daily-email
Already up to date.
Loading required package: methods

Attaching package: ‘lubridate’

The following object is masked from ‘package:base’:

    date

trying URL 'https://github.com/CareyLabVT/SCCData/raw/carina-data/FCRmet.csv'
Content type 'text/plain; charset=utf-8' length 67547992 bytes (64.4 MB)
==================================================
downloaded 64.4 MB

trying URL 'https://github.com/CareyLabVT/SCCData/raw/mia-data/Catwalk.csv'
Content type 'text/plain; charset=utf-8' length 11830129 bytes (11.3 MB)
==================================================
downloaded 11.3 MB

null device 
          1 
null device 
          1 
[daily-email 1242e93] 04/22/19 06:27:01 EST -0500: Sensor Check
 6 files changed, 1612 insertions(+)
 create mode 100644 CatwalkDataFigures_2019-04-22.pdf
 create mode 100644 MetDataFigures_2019-04-22.pdf
remote: warning: GH001: Large files detected. You may want to try Git Large File Storage - https://git-lfs.github.com.        
remote: warning: See http://git.io/iEPt8g for more information.        
remote: warning: File FCRmet.csv is 64.42 MB; this is larger than GitHub's recommended maximum file size of 50.00 MB        
To github.com:CareyLabVT/SCCData.git
   89ed5c1..1242e93  daily-email -> daily-email
Already up to date.
Loading required package: methods

Attaching package: ‘lubridate’

The following object is masked from ‘package:base’:

    date

trying URL 'https://github.com/CareyLabVT/SCCData/raw/carina-data/FCRmet.csv'
Content type 'text/plain; charset=utf-8' length 67722077 bytes (64.6 MB)
==================================================
downloaded 64.6 MB

trying URL 'https://github.com/CareyLabVT/SCCData/raw/mia-data/Catwalk.csv'
Content type 'text/plain; charset=utf-8' length 11871949 bytes (11.3 MB)
==================================================
downloaded 11.3 MB

null device 
          1 
null device 
          1 
[daily-email bf2ea3d] 04/23/19 06:27:01 EST -0500: Sensor Check
 6 files changed, 1610 insertions(+)
 create mode 100644 CatwalkDataFigures_2019-04-23.pdf
 create mode 100644 MetDataFigures_2019-04-23.pdf
remote: warning: GH001: Large files detected. You may want to try Git Large File Storage - https://git-lfs.github.com.        
remote: warning: See http://git.io/iEPt8g for more information.        
remote: warning: File FCRmet.csv is 64.58 MB; this is larger than GitHub's recommended maximum file size of 50.00 MB        
To github.com:CareyLabVT/SCCData.git
   f6f7bdc..bf2ea3d  daily-email -> daily-email
Already up to date.
Loading required package: methods

Attaching package: ‘lubridate’

The following object is masked from ‘package:base’:

    date

trying URL 'https://github.com/CareyLabVT/SCCData/raw/carina-data/FCRmet.csv'
Content type 'text/plain; charset=utf-8' length 67897200 bytes (64.8 MB)
==================================================
downloaded 64.8 MB

trying URL 'https://github.com/CareyLabVT/SCCData/raw/mia-data/Catwalk.csv'
Content type 'text/plain; charset=utf-8' length 11913787 bytes (11.4 MB)
==================================================
downloaded 11.4 MB

null device 
          1 
null device 
          1 
[daily-email 59b30a0] 04/24/19 06:27:01 EST -0500: Sensor Check
 6 files changed, 1611 insertions(+)
 create mode 100644 CatwalkDataFigures_2019-04-24.pdf
 create mode 100644 MetDataFigures_2019-04-24.pdf
remote: warning: GH001: Large files detected. You may want to try Git Large File Storage - https://git-lfs.github.com.        
remote: warning: See http://git.io/iEPt8g for more information.        
remote: warning: File FCRmet.csv is 64.75 MB; this is larger than GitHub's recommended maximum file size of 50.00 MB        
To github.com:CareyLabVT/SCCData.git
   c19d5c4..59b30a0  daily-email -> daily-email
Already up to date.
Loading required package: methods

Attaching package: ‘lubridate’

The following object is masked from ‘package:base’:

    date

trying URL 'https://github.com/CareyLabVT/SCCData/raw/carina-data/FCRmet.csv'
Content type 'text/plain; charset=utf-8' length 68073338 bytes (64.9 MB)
==================================================
downloaded 64.9 MB

trying URL 'https://github.com/CareyLabVT/SCCData/raw/mia-data/Catwalk.csv'
Content type 'text/plain; charset=utf-8' length 11955629 bytes (11.4 MB)
==================================================
downloaded 11.4 MB

null device 
          1 
null device 
          1 
[daily-email 9dab4eb] 04/25/19 06:27:01 EST -0500: Sensor Check
 6 files changed, 1611 insertions(+)
 create mode 100644 CatwalkDataFigures_2019-04-25.pdf
 create mode 100644 MetDataFigures_2019-04-25.pdf
remote: warning: GH001: Large files detected. You may want to try Git Large File Storage - https://git-lfs.github.com.        
remote: warning: See http://git.io/iEPt8g for more information.        
remote: warning: File FCRmet.csv is 64.92 MB; this is larger than GitHub's recommended maximum file size of 50.00 MB        
To github.com:CareyLabVT/SCCData.git
   e2f9b38..9dab4eb  daily-email -> daily-email
Already up to date.
Loading required package: methods

Attaching package: ‘lubridate’

The following object is masked from ‘package:base’:

    date

trying URL 'https://github.com/CareyLabVT/SCCData/raw/carina-data/FCRmet.csv'
Content type 'text/plain; charset=utf-8' length 68248661 bytes (65.1 MB)
==================================================
downloaded 65.1 MB

trying URL 'https://github.com/CareyLabVT/SCCData/raw/mia-data/Catwalk.csv'
Content type 'text/plain; charset=utf-8' length 11997508 bytes (11.4 MB)
==================================================
downloaded 11.4 MB

null device 
          1 
null device 
          1 
[daily-email 17c53d0] 04/26/19 06:27:01 EST -0500: Sensor Check
 6 files changed, 1612 insertions(+)
 create mode 100644 CatwalkDataFigures_2019-04-26.pdf
 create mode 100644 MetDataFigures_2019-04-26.pdf
remote: warning: GH001: Large files detected. You may want to try Git Large File Storage - https://git-lfs.github.com.        
remote: warning: See http://git.io/iEPt8g for more information.        
remote: warning: File FCRmet.csv is 65.09 MB; this is larger than GitHub's recommended maximum file size of 50.00 MB        
To github.com:CareyLabVT/SCCData.git
   05ca914..17c53d0  daily-email -> daily-email
Already up to date.
Loading required package: methods

Attaching package: ‘lubridate’

The following object is masked from ‘package:base’:

    date

trying URL 'https://github.com/CareyLabVT/SCCData/raw/carina-data/FCRmet.csv'
Content type 'text/plain; charset=utf-8' length 68424651 bytes (65.3 MB)
==================================================
downloaded 65.3 MB

trying URL 'https://github.com/CareyLabVT/SCCData/raw/mia-data/Catwalk.csv'
Content type 'text/plain; charset=utf-8' length 12039367 bytes (11.5 MB)
==================================================
downloaded 11.5 MB

null device 
          1 
null device 
          1 
[daily-email da192c7] 04/27/19 06:27:01 EST -0500: Sensor Check
 6 files changed, 1612 insertions(+)
 create mode 100644 CatwalkDataFigures_2019-04-27.pdf
 create mode 100644 MetDataFigures_2019-04-27.pdf
remote: warning: GH001: Large files detected. You may want to try Git Large File Storage - https://git-lfs.github.com.        
remote: warning: See http://git.io/iEPt8g for more information.        
remote: warning: File FCRmet.csv is 65.25 MB; this is larger than GitHub's recommended maximum file size of 50.00 MB        
To github.com:CareyLabVT/SCCData.git
   b95dfd2..da192c7  daily-email -> daily-email
Already up to date.
Loading required package: methods

Attaching package: ‘lubridate’

The following object is masked from ‘package:base’:

    date

trying URL 'https://github.com/CareyLabVT/SCCData/raw/carina-data/FCRmet.csv'
Content type 'text/plain; charset=utf-8' length 68600214 bytes (65.4 MB)
==================================================
downloaded 65.4 MB

trying URL 'https://github.com/CareyLabVT/SCCData/raw/mia-data/Catwalk.csv'
Content type 'text/plain; charset=utf-8' length 12081243 bytes (11.5 MB)
==================================================
downloaded 11.5 MB

null device 
          1 
null device 
          1 
[daily-email d455fcd] 04/28/19 06:27:01 EST -0500: Sensor Check
 6 files changed, 1612 insertions(+)
 create mode 100644 CatwalkDataFigures_2019-04-28.pdf
 create mode 100644 MetDataFigures_2019-04-28.pdf
remote: warning: GH001: Large files detected. You may want to try Git Large File Storage - https://git-lfs.github.com.        
remote: warning: See http://git.io/iEPt8g for more information.        
remote: warning: File FCRmet.csv is 65.42 MB; this is larger than GitHub's recommended maximum file size of 50.00 MB        
To github.com:CareyLabVT/SCCData.git
   cf31eaf..d455fcd  daily-email -> daily-email
Already up to date.
Loading required package: methods

Attaching package: ‘lubridate’

The following object is masked from ‘package:base’:

    date

trying URL 'https://github.com/CareyLabVT/SCCData/raw/carina-data/FCRmet.csv'
Content type 'text/plain; charset=utf-8' length 68776073 bytes (65.6 MB)
==================================================
downloaded 65.6 MB

trying URL 'https://github.com/CareyLabVT/SCCData/raw/mia-data/Catwalk.csv'
Content type 'text/plain; charset=utf-8' length 12123078 bytes (11.6 MB)
==================================================
downloaded 11.6 MB

null device 
          1 
null device 
          1 
[daily-email d40d970] 04/29/19 06:27:01 EST -0500: Sensor Check
 6 files changed, 1612 insertions(+)
 create mode 100644 CatwalkDataFigures_2019-04-29.pdf
 create mode 100644 MetDataFigures_2019-04-29.pdf
remote: warning: GH001: Large files detected. You may want to try Git Large File Storage - https://git-lfs.github.com.        
remote: warning: See http://git.io/iEPt8g for more information.        
remote: warning: File FCRmet.csv is 65.59 MB; this is larger than GitHub's recommended maximum file size of 50.00 MB        
To github.com:CareyLabVT/SCCData.git
   cc80f56..d40d970  daily-email -> daily-email
Already up to date.
Loading required package: methods

Attaching package: ‘lubridate’

The following object is masked from ‘package:base’:

    date

trying URL 'https://github.com/CareyLabVT/SCCData/raw/carina-data/FCRmet.csv'
Content type 'text/plain; charset=utf-8' length 68952255 bytes (65.8 MB)
==================================================
downloaded 65.8 MB

trying URL 'https://github.com/CareyLabVT/SCCData/raw/mia-data/Catwalk.csv'
Content type 'text/plain; charset=utf-8' length 12164872 bytes (11.6 MB)
==================================================
downloaded 11.6 MB

null device 
          1 
null device 
          1 
[daily-email 90957df] 04/30/19 06:27:01 EST -0500: Sensor Check
 6 files changed, 1612 insertions(+)
 create mode 100644 CatwalkDataFigures_2019-04-30.pdf
 create mode 100644 MetDataFigures_2019-04-30.pdf
remote: warning: GH001: Large files detected. You may want to try Git Large File Storage - https://git-lfs.github.com.        
remote: warning: See http://git.io/iEPt8g for more information.        
remote: warning: File FCRmet.csv is 65.76 MB; this is larger than GitHub's recommended maximum file size of 50.00 MB        
To github.com:CareyLabVT/SCCData.git
   329f0be..90957df  daily-email -> daily-email
From github.com:CareyLabVT/SCCData
   9960041..e92fa2c  daily-email -> origin/daily-email
Updating 9960041..e92fa2c
Fast-forward
 SensorCheckScript.R            |  36 ++++++++++++++++++++++++++++++++++++
 WeirDataFigures_2019-04-30.pdf | Bin 0 -> 17515 bytes
 2 files changed, 36 insertions(+)
 create mode 100644 WeirDataFigures_2019-04-30.pdf
Loading required package: methods

Attaching package: ‘lubridate’

The following object is masked from ‘package:base’:

    date

trying URL 'https://github.com/CareyLabVT/SCCData/raw/carina-data/FCRmet.csv'
Content type 'text/plain; charset=utf-8' length 69129001 bytes (65.9 MB)
==================================================
downloaded 65.9 MB

trying URL 'https://github.com/CareyLabVT/SCCData/raw/mia-data/Catwalk.csv'
Content type 'text/plain; charset=utf-8' length 12206614 bytes (11.6 MB)
==================================================
downloaded 11.6 MB

trying URL 'https://github.com/CareyLabVT/SCCData/raw/diana-data/FCRweir.csv'
Content type 'text/plain; charset=utf-8' length 46749 bytes (45 KB)
==================================================
downloaded 45 KB

null device 
          1 
null device 
          1 
null device 
          1 
[daily-email 98655ce] 05/01/19 06:27:01 EST -0500: Sensor Check
 8 files changed, 2456 insertions(+)
 create mode 100644 CatwalkDataFigures_2019-05-01.pdf
 create mode 100644 FCRweir.csv
 create mode 100644 MetDataFigures_2019-05-01.pdf
 create mode 100644 WeirDataFigures_2019-05-01.pdf
remote: warning: GH001: Large files detected. You may want to try Git Large File Storage - https://git-lfs.github.com.        
remote: warning: See http://git.io/iEPt8g for more information.        
remote: warning: File FCRmet.csv is 65.93 MB; this is larger than GitHub's recommended maximum file size of 50.00 MB        
To github.com:CareyLabVT/SCCData.git
   e92fa2c..98655ce  daily-email -> daily-email
Already up to date.
Loading required package: methods

Attaching package: ‘lubridate’

The following object is masked from ‘package:base’:

    date

trying URL 'https://github.com/CareyLabVT/SCCData/raw/carina-data/FCRmet.csv'
Content type 'text/plain; charset=utf-8' length 69305309 bytes (66.1 MB)
==================================================
downloaded 66.1 MB

trying URL 'https://github.com/CareyLabVT/SCCData/raw/mia-data/Catwalk.csv'
Content type 'text/plain; charset=utf-8' length 12248410 bytes (11.7 MB)
==================================================
downloaded 11.7 MB

trying URL 'https://github.com/CareyLabVT/SCCData/raw/diana-data/FCRweir.csv'
Content type 'text/plain; charset=utf-8' length 52168 bytes (50 KB)
==================================================
downloaded 50 KB

null device 
          1 
null device 
          1 
null device 
          1 
[daily-email 6f03b57] 05/02/19 06:27:01 EST -0500: Sensor Check
 8 files changed, 1715 insertions(+)
 create mode 100644 CatwalkDataFigures_2019-05-02.pdf
 create mode 100644 MetDataFigures_2019-05-02.pdf
 create mode 100644 WeirDataFigures_2019-05-02.pdf
remote: warning: GH001: Large files detected. You may want to try Git Large File Storage - https://git-lfs.github.com.        
remote: warning: See http://git.io/iEPt8g for more information.        
remote: warning: File FCRmet.csv is 66.09 MB; this is larger than GitHub's recommended maximum file size of 50.00 MB        
To github.com:CareyLabVT/SCCData.git
   018261c..6f03b57  daily-email -> daily-email
Already up to date.
Loading required package: methods

Attaching package: ‘lubridate’

The following object is masked from ‘package:base’:

    date

trying URL 'https://github.com/CareyLabVT/SCCData/raw/carina-data/FCRmet.csv'
Content type 'text/plain; charset=utf-8' length 69481643 bytes (66.3 MB)
==================================================
downloaded 66.3 MB

trying URL 'https://github.com/CareyLabVT/SCCData/raw/mia-data/Catwalk.csv'
Content type 'text/plain; charset=utf-8' length 12290023 bytes (11.7 MB)
==================================================
downloaded 11.7 MB

trying URL 'https://github.com/CareyLabVT/SCCData/raw/diana-data/FCRweir.csv'
Content type 'text/plain; charset=utf-8' length 57620 bytes (56 KB)
==================================================
downloaded 56 KB

null device 
          1 
null device 
          1 
null device 
          1 
[daily-email 08ab626] 05/03/19 06:27:01 EST -0500: Sensor Check
 8 files changed, 1715 insertions(+)
 create mode 100644 CatwalkDataFigures_2019-05-03.pdf
 create mode 100644 MetDataFigures_2019-05-03.pdf
 create mode 100644 WeirDataFigures_2019-05-03.pdf
remote: warning: GH001: Large files detected. You may want to try Git Large File Storage - https://git-lfs.github.com.        
remote: warning: See http://git.io/iEPt8g for more information.        
remote: warning: File FCRmet.csv is 66.26 MB; this is larger than GitHub's recommended maximum file size of 50.00 MB        
To github.com:CareyLabVT/SCCData.git
   e160b89..08ab626  daily-email -> daily-email
Already up to date.
Loading required package: methods

Attaching package: ‘lubridate’

The following object is masked from ‘package:base’:

    date

trying URL 'https://github.com/CareyLabVT/SCCData/raw/carina-data/FCRmet.csv'
Content type 'text/plain; charset=utf-8' length 69658296 bytes (66.4 MB)
==================================================
downloaded 66.4 MB

trying URL 'https://github.com/CareyLabVT/SCCData/raw/mia-data/Catwalk.csv'
Content type 'text/plain; charset=utf-8' length 12331649 bytes (11.8 MB)
==================================================
downloaded 11.8 MB

trying URL 'https://github.com/CareyLabVT/SCCData/raw/diana-data/FCRweir.csv'
Content type 'text/plain; charset=utf-8' length 57620 bytes (56 KB)
==================================================
downloaded 56 KB

null device 
          1 
null device 
          1 
null device 
          1 
[daily-email 4fe7821] 05/04/19 06:27:01 EST -0500: Sensor Check
 7 files changed, 1619 insertions(+)
 create mode 100644 CatwalkDataFigures_2019-05-04.pdf
 create mode 100644 MetDataFigures_2019-05-04.pdf
 create mode 100644 WeirDataFigures_2019-05-04.pdf
remote: warning: GH001: Large files detected. You may want to try Git Large File Storage - https://git-lfs.github.com.        
remote: warning: See http://git.io/iEPt8g for more information.        
remote: warning: File FCRmet.csv is 66.43 MB; this is larger than GitHub's recommended maximum file size of 50.00 MB        
To github.com:CareyLabVT/SCCData.git
   3b3a9f1..4fe7821  daily-email -> daily-email
Already up to date.
Loading required package: methods

Attaching package: ‘lubridate’

The following object is masked from ‘package:base’:

    date

trying URL 'https://github.com/CareyLabVT/SCCData/raw/carina-data/FCRmet.csv'
Content type 'text/plain; charset=utf-8' length 69833779 bytes (66.6 MB)
==================================================
downloaded 66.6 MB

trying URL 'https://github.com/CareyLabVT/SCCData/raw/mia-data/Catwalk.csv'
Content type 'text/plain; charset=utf-8' length 12373191 bytes (11.8 MB)
==================================================
downloaded 11.8 MB

trying URL 'https://github.com/CareyLabVT/SCCData/raw/diana-data/FCRweir.csv'
Content type 'text/plain; charset=utf-8' length 57620 bytes (56 KB)
==================================================
downloaded 56 KB

null device 
          1 
null device 
          1 
null device 
          1 
[daily-email c125b34] 05/05/19 06:27:01 EST -0500: Sensor Check
 7 files changed, 1619 insertions(+)
 create mode 100644 CatwalkDataFigures_2019-05-05.pdf
 create mode 100644 MetDataFigures_2019-05-05.pdf
 create mode 100644 WeirDataFigures_2019-05-05.pdf
remote: warning: GH001: Large files detected. You may want to try Git Large File Storage - https://git-lfs.github.com.        
remote: warning: See http://git.io/iEPt8g for more information.        
remote: warning: File FCRmet.csv is 66.60 MB; this is larger than GitHub's recommended maximum file size of 50.00 MB        
To github.com:CareyLabVT/SCCData.git
   f2b2cd8..c125b34  daily-email -> daily-email
Already up to date.
Loading required package: methods

Attaching package: ‘lubridate’

The following object is masked from ‘package:base’:

    date

trying URL 'https://github.com/CareyLabVT/SCCData/raw/carina-data/FCRmet.csv'
Content type 'text/plain; charset=utf-8' length 70010240 bytes (66.8 MB)
==================================================
downloaded 66.8 MB

trying URL 'https://github.com/CareyLabVT/SCCData/raw/mia-data/Catwalk.csv'
Content type 'text/plain; charset=utf-8' length 12414795 bytes (11.8 MB)
==================================================
downloaded 11.8 MB

trying URL 'https://github.com/CareyLabVT/SCCData/raw/diana-data/FCRweir.csv'
Content type 'text/plain; charset=utf-8' length 57620 bytes (56 KB)
==================================================
downloaded 56 KB

null device 
          1 
null device 
          1 
null device 
          1 
[daily-email 0315422] 05/06/19 06:27:01 EST -0500: Sensor Check
 8 files changed, 1640 insertions(+), 4 deletions(-)
 create mode 100644 CatwalkDataFigures_2019-05-06.pdf
 create mode 100644 MetDataFigures_2019-05-06.pdf
 create mode 100644 WeirDataFigures_2019-05-06.pdf
remote: warning: GH001: Large files detected. You may want to try Git Large File Storage - https://git-lfs.github.com.        
remote: warning: See http://git.io/iEPt8g for more information.        
remote: warning: File FCRmet.csv is 66.77 MB; this is larger than GitHub's recommended maximum file size of 50.00 MB        
To github.com:CareyLabVT/SCCData.git
   c38ef04..0315422  daily-email -> daily-email
Already up to date.
Loading required package: methods

Attaching package: ‘lubridate’

The following object is masked from ‘package:base’:

    date

trying URL 'https://github.com/CareyLabVT/SCCData/raw/carina-data/FCRmet.csv'
Content type 'text/plain; charset=utf-8' length 70186679 bytes (66.9 MB)
==================================================
downloaded 66.9 MB

trying URL 'https://github.com/CareyLabVT/SCCData/raw/mia-data/Catwalk.csv'
Content type 'text/plain; charset=utf-8' length 12456337 bytes (11.9 MB)
==================================================
downloaded 11.9 MB

trying URL 'https://github.com/CareyLabVT/SCCData/raw/diana-data/FCRweir.csv'
Content type 'text/plain; charset=utf-8' length 76259 bytes (74 KB)
==================================================
downloaded 74 KB

null device 
          1 
null device 
          1 
null device 
          1 
[daily-email 19ce7fa] 05/07/19 06:27:01 EST -0500: Sensor Check
 8 files changed, 1943 insertions(+)
 create mode 100644 CatwalkDataFigures_2019-05-07.pdf
 create mode 100644 MetDataFigures_2019-05-07.pdf
 create mode 100644 WeirDataFigures_2019-05-07.pdf
remote: warning: GH001: Large files detected. You may want to try Git Large File Storage - https://git-lfs.github.com.        
remote: warning: See http://git.io/iEPt8g for more information.        
remote: warning: File FCRmet.csv is 66.94 MB; this is larger than GitHub's recommended maximum file size of 50.00 MB        
To github.com:CareyLabVT/SCCData.git
   653cf64..19ce7fa  daily-email -> daily-email
Already up to date.
Loading required package: methods

Attaching package: ‘lubridate’

The following object is masked from ‘package:base’:

    date

trying URL 'https://github.com/CareyLabVT/SCCData/raw/carina-data/FCRmet.csv'
Content type 'text/plain; charset=utf-8' length 70362795 bytes (67.1 MB)
==================================================
downloaded 67.1 MB

trying URL 'https://github.com/CareyLabVT/SCCData/raw/mia-data/Catwalk.csv'
Content type 'text/plain; charset=utf-8' length 12497973 bytes (11.9 MB)
==================================================
downloaded 11.9 MB

trying URL 'https://github.com/CareyLabVT/SCCData/raw/diana-data/FCRweir.csv'
Content type 'text/plain; charset=utf-8' length 76259 bytes (74 KB)
==================================================
downloaded 74 KB

null device 
          1 
null device 
          1 
null device 
          1 
[daily-email 67c49f9] 05/08/19 06:27:01 EST -0500: Sensor Check
 7 files changed, 1619 insertions(+)
 create mode 100644 CatwalkDataFigures_2019-05-08.pdf
 create mode 100644 MetDataFigures_2019-05-08.pdf
 create mode 100644 WeirDataFigures_2019-05-08.pdf
remote: warning: GH001: Large files detected. You may want to try Git Large File Storage - https://git-lfs.github.com.        
remote: warning: See http://git.io/iEPt8g for more information.        
remote: warning: File FCRmet.csv is 67.10 MB; this is larger than GitHub's recommended maximum file size of 50.00 MB        
To github.com:CareyLabVT/SCCData.git
   478c299..67c49f9  daily-email -> daily-email
Already up to date.
Loading required package: methods

Attaching package: ‘lubridate’

The following object is masked from ‘package:base’:

    date

trying URL 'https://github.com/CareyLabVT/SCCData/raw/carina-data/FCRmet.csv'
Content type 'text/plain; charset=utf-8' length 70538402 bytes (67.3 MB)
==================================================
downloaded 67.3 MB

trying URL 'https://github.com/CareyLabVT/SCCData/raw/mia-data/Catwalk.csv'
Content type 'text/plain; charset=utf-8' length 12539612 bytes (12.0 MB)
==================================================
downloaded 12.0 MB

trying URL 'https://github.com/CareyLabVT/SCCData/raw/diana-data/FCRweir.csv'
Content type 'text/plain; charset=utf-8' length 76259 bytes (74 KB)
==================================================
downloaded 74 KB

null device 
          1 
null device 
          1 
null device 
          1 
[daily-email 5d77af7] 05/09/19 06:27:01 EST -0500: Sensor Check
 8 files changed, 1640 insertions(+), 4 deletions(-)
 create mode 100644 CatwalkDataFigures_2019-05-09.pdf
 create mode 100644 MetDataFigures_2019-05-09.pdf
 create mode 100644 WeirDataFigures_2019-05-09.pdf
remote: warning: GH001: Large files detected. You may want to try Git Large File Storage - https://git-lfs.github.com.        
remote: warning: See http://git.io/iEPt8g for more information.        
remote: warning: File FCRmet.csv is 67.27 MB; this is larger than GitHub's recommended maximum file size of 50.00 MB        
To github.com:CareyLabVT/SCCData.git
   b56b565..5d77af7  daily-email -> daily-email
Already up to date.
Loading required package: methods

Attaching package: ‘lubridate’

The following object is masked from ‘package:base’:

    date

trying URL 'https://github.com/CareyLabVT/SCCData/raw/carina-data/FCRmet.csv'
Content type 'text/plain; charset=utf-8' length 70714610 bytes (67.4 MB)
==================================================
downloaded 67.4 MB

trying URL 'https://github.com/CareyLabVT/SCCData/raw/mia-data/Catwalk.csv'
Content type 'text/plain; charset=utf-8' length 12581326 bytes (12.0 MB)
==================================================
downloaded 12.0 MB

trying URL 'https://github.com/CareyLabVT/SCCData/raw/diana-data/FCRweir.csv'
Content type 'text/plain; charset=utf-8' length 76259 bytes (74 KB)
==================================================
downloaded 74 KB

null device 
          1 
null device 
          1 
null device 
          1 
[daily-email ba7efc8] 05/10/19 06:27:01 EST -0500: Sensor Check
 8 files changed, 1640 insertions(+), 4 deletions(-)
 create mode 100644 CatwalkDataFigures_2019-05-10.pdf
 create mode 100644 MetDataFigures_2019-05-10.pdf
 create mode 100644 WeirDataFigures_2019-05-10.pdf
remote: warning: GH001: Large files detected. You may want to try Git Large File Storage - https://git-lfs.github.com.        
remote: warning: See http://git.io/iEPt8g for more information.        
remote: warning: File FCRmet.csv is 67.44 MB; this is larger than GitHub's recommended maximum file size of 50.00 MB        
To github.com:CareyLabVT/SCCData.git
   f3c5ca9..ba7efc8  daily-email -> daily-email
Already up to date.
Loading required package: methods

Attaching package: ‘lubridate’

The following object is masked from ‘package:base’:

    date

trying URL 'https://github.com/CareyLabVT/SCCData/raw/carina-data/FCRmet.csv'
Content type 'text/plain; charset=utf-8' length 70890891 bytes (67.6 MB)
==================================================
downloaded 67.6 MB

trying URL 'https://github.com/CareyLabVT/SCCData/raw/mia-data/Catwalk.csv'
Content type 'text/plain; charset=utf-8' length 12622941 bytes (12.0 MB)
==================================================
downloaded 12.0 MB

trying URL 'https://github.com/CareyLabVT/SCCData/raw/diana-data/FCRweir.csv'
Content type 'text/plain; charset=utf-8' length 76259 bytes (74 KB)
==================================================
downloaded 74 KB

null device 
          1 
null device 
          1 
null device 
          1 
[daily-email 99ace03] 05/11/19 06:27:01 EST -0500: Sensor Check
 8 files changed, 1640 insertions(+), 4 deletions(-)
 create mode 100644 CatwalkDataFigures_2019-05-11.pdf
 create mode 100644 MetDataFigures_2019-05-11.pdf
 create mode 100644 WeirDataFigures_2019-05-11.pdf
remote: warning: GH001: Large files detected. You may want to try Git Large File Storage - https://git-lfs.github.com.        
remote: warning: See http://git.io/iEPt8g for more information.        
remote: warning: File FCRmet.csv is 67.61 MB; this is larger than GitHub's recommended maximum file size of 50.00 MB        
To github.com:CareyLabVT/SCCData.git
   313ec4f..99ace03  daily-email -> daily-email
Already up to date.
Loading required package: methods

Attaching package: ‘lubridate’

The following object is masked from ‘package:base’:

    date

trying URL 'https://github.com/CareyLabVT/SCCData/raw/carina-data/FCRmet.csv'
Content type 'text/plain; charset=utf-8' length 71067054 bytes (67.8 MB)
==================================================
downloaded 67.8 MB

trying URL 'https://github.com/CareyLabVT/SCCData/raw/mia-data/Catwalk.csv'
Content type 'text/plain; charset=utf-8' length 12664606 bytes (12.1 MB)
==================================================
downloaded 12.1 MB

trying URL 'https://github.com/CareyLabVT/SCCData/raw/diana-data/FCRweir.csv'
Content type 'text/plain; charset=utf-8' length 76259 bytes (74 KB)
==================================================
downloaded 74 KB

null device 
          1 
null device 
          1 
Error in plot.window(...) : need finite 'ylim' values
Calls: plot -> plot.default -> localWindow -> plot.window
In addition: Warning messages:
1: In min(x) : no non-missing arguments to min; returning Inf
2: In max(x) : no non-missing arguments to max; returning -Inf
Execution halted
[daily-email cb330de] 05/12/19 06:27:01 EST -0500: Sensor Check
 7 files changed, 1622 insertions(+)
 create mode 100644 CatwalkDataFigures_2019-05-12.pdf
 create mode 100644 MetDataFigures_2019-05-12.pdf
 create mode 100644 WeirDataFigures_2019-05-12.pdf
remote: warning: GH001: Large files detected. You may want to try Git Large File Storage - https://git-lfs.github.com.        
remote: warning: See http://git.io/iEPt8g for more information.        
remote: warning: File FCRmet.csv is 67.77 MB; this is larger than GitHub's recommended maximum file size of 50.00 MB        
To github.com:CareyLabVT/SCCData.git
   bc259ac..cb330de  daily-email -> daily-email
Already up to date.
Loading required package: methods

Attaching package: ‘lubridate’

The following object is masked from ‘package:base’:

    date

trying URL 'https://github.com/CareyLabVT/SCCData/raw/carina-data/FCRmet.csv'
Error in download.file("https://github.com/CareyLabVT/SCCData/raw/carina-data/FCRmet.csv",  : 
  cannot open URL 'https://github.com/CareyLabVT/SCCData/raw/carina-data/FCRmet.csv'
In addition: Warning message:
In download.file("https://github.com/CareyLabVT/SCCData/raw/carina-data/FCRmet.csv",  :
  cannot open URL 'https://raw.githubusercontent.com/CareyLabVT/SCCData/carina-data/FCRmet.csv': HTTP status was '503 Service Unavailable'
Execution halted
[daily-email 4d57dfe] 05/13/19 06:27:01 EST -0500: Sensor Check
 3 files changed, 20 insertions(+), 577764 deletions(-)
 delete mode 100644 FCRmet.csv
To github.com:CareyLabVT/SCCData.git
   418aac4..4d57dfe  daily-email -> daily-email
Already up to date.
Loading required package: methods

Attaching package: ‘lubridate’

The following object is masked from ‘package:base’:

    date

trying URL 'https://github.com/CareyLabVT/SCCData/raw/carina-data/FCRmet.csv'
Error in download.file("https://github.com/CareyLabVT/SCCData/raw/carina-data/FCRmet.csv",  : 
  cannot open URL 'https://github.com/CareyLabVT/SCCData/raw/carina-data/FCRmet.csv'
In addition: Warning message:
In download.file("https://github.com/CareyLabVT/SCCData/raw/carina-data/FCRmet.csv",  :
  cannot open URL 'https://raw.githubusercontent.com/CareyLabVT/SCCData/carina-data/FCRmet.csv': HTTP status was '503 Service Unavailable'
Execution halted
[daily-email 6f38e8c] 05/13/19 07:44:37 EST -0500: Sensor Check
 2 files changed, 20 insertions(+)
To github.com:CareyLabVT/SCCData.git
   fad4a6e..6f38e8c  daily-email -> daily-email
Already up to date.
Loading required package: methods

Attaching package: ‘lubridate’

The following object is masked from ‘package:base’:

    date

trying URL 'https://github.com/CareyLabVT/SCCData/raw/carina-data/FCRmet.csv'
Content type 'text/plain; charset=utf-8' length 71243190 bytes (67.9 MB)
==================================================
downloaded 67.9 MB

trying URL 'https://github.com/CareyLabVT/SCCData/raw/mia-data/Catwalk.csv'
Content type 'text/plain; charset=utf-8' length 12706341 bytes (12.1 MB)
==================================================
downloaded 12.1 MB

trying URL 'https://github.com/CareyLabVT/SCCData/raw/diana-data/FCRweir.csv'
Content type 'text/plain; charset=utf-8' length 76259 bytes (74 KB)
==================================================
downloaded 74 KB

null device 
          1 
null device 
          1 
Error in plot.window(...) : need finite 'ylim' values
Calls: plot -> plot.default -> localWindow -> plot.window
In addition: Warning messages:
1: In min(x) : no non-missing arguments to min; returning Inf
2: In max(x) : no non-missing arguments to max; returning -Inf
Execution halted
[daily-email 03978c2] 05/13/19 07:47:16 EST -0500: Sensor Check
 6 files changed, 579386 insertions(+)
 create mode 100644 CatwalkDataFigures_2019-05-13.pdf
 create mode 100644 FCRmet.csv
 create mode 100644 MetDataFigures_2019-05-13.pdf
 create mode 100644 WeirDataFigures_2019-05-13.pdf
remote: warning: GH001: Large files detected. You may want to try Git Large File Storage - https://git-lfs.github.com.        
remote: warning: See http://git.io/iEPt8g for more information.        
remote: warning: File FCRmet.csv is 67.94 MB; this is larger than GitHub's recommended maximum file size of 50.00 MB        
To github.com:CareyLabVT/SCCData.git
   6f38e8c..03978c2  daily-email -> daily-email
Already up to date.
Loading required package: methods

Attaching package: ‘lubridate’

The following object is masked from ‘package:base’:

    date

trying URL 'https://github.com/CareyLabVT/SCCData/raw/carina-data/FCRmet.csv'
Content type 'text/plain; charset=utf-8' length 71243190 bytes (67.9 MB)
==================================================
downloaded 67.9 MB

trying URL 'https://github.com/CareyLabVT/SCCData/raw/mia-data/Catwalk.csv'
Content type 'text/plain; charset=utf-8' length 12706341 bytes (12.1 MB)
==================================================
downloaded 12.1 MB

trying URL 'https://github.com/CareyLabVT/SCCData/raw/diana-data/FCRweir.csv'
Content type 'text/plain; charset=utf-8' length 76259 bytes (74 KB)
==================================================
downloaded 74 KB

null device 
          1 
null device 
          1 
Error in plot.window(...) : need finite 'ylim' values
Calls: plot -> plot.default -> localWindow -> plot.window
In addition: Warning messages:
1: In min(x) : no non-missing arguments to min; returning Inf
2: In max(x) : no non-missing arguments to max; returning -Inf
Execution halted
[daily-email aa9e952] 05/13/19 07:52:00 EST -0500: Sensor Check
 5 files changed, 38 insertions(+)
 rewrite MetDataFigures_2019-05-13.pdf (95%)
To github.com:CareyLabVT/SCCData.git
   8355e0d..aa9e952  daily-email -> daily-email
Already up to date.
Loading required package: methods

Attaching package: ‘lubridate’

The following object is masked from ‘package:base’:

    date

trying URL 'https://github.com/CareyLabVT/SCCData/raw/carina-data/FCRmet.csv'
Error in download.file("https://github.com/CareyLabVT/SCCData/raw/carina-data/FCRmet.csv",  : 
  cannot open URL 'https://github.com/CareyLabVT/SCCData/raw/carina-data/FCRmet.csv'
In addition: Warning message:
In download.file("https://github.com/CareyLabVT/SCCData/raw/carina-data/FCRmet.csv",  :
  cannot open URL 'https://raw.githubusercontent.com/CareyLabVT/SCCData/carina-data/FCRmet.csv': HTTP status was '503 Service Unavailable'
Execution halted
[daily-email 5a240bb] 05/14/19 06:27:01 EST -0500: Sensor Check
 3 files changed, 32 insertions(+), 579204 deletions(-)
 delete mode 100644 FCRmet.csv
To github.com:CareyLabVT/SCCData.git
   aa9e952..5a240bb  daily-email -> daily-email
Already up to date.
Loading required package: methods

Attaching package: ‘lubridate’

The following object is masked from ‘package:base’:

    date

trying URL 'https://github.com/CareyLabVT/SCCData/raw/carina-data/FCRmet.csv'
Content type 'text/plain; charset=utf-8' length 71420018 bytes (68.1 MB)
==================================================
downloaded 68.1 MB

trying URL 'https://github.com/CareyLabVT/SCCData/raw/mia-data/Catwalk.csv'
Content type 'text/plain; charset=utf-8' length 12747988 bytes (12.2 MB)
==================================================
downloaded 12.2 MB

trying URL 'https://github.com/CareyLabVT/SCCData/raw/diana-data/FCRweir.csv'
Content type 'text/plain; charset=utf-8' length 118005 bytes (115 KB)
==================================================
downloaded 115 KB

null device 
          1 
null device 
          1 
null device 
          1 
[daily-email f4cd663] 05/14/19 08:10:58 EST -0500: Sensor Check
 8 files changed, 581548 insertions(+)
 create mode 100644 CatwalkDataFigures_2019-05-14.pdf
 create mode 100644 FCRmet.csv
 create mode 100644 MetDataFigures_2019-05-14.pdf
 create mode 100644 WeirDataFigures_2019-05-14.pdf
remote: warning: GH001: Large files detected. You may want to try Git Large File Storage - https://git-lfs.github.com.        
remote: warning: See http://git.io/iEPt8g for more information.        
remote: warning: File FCRmet.csv is 68.11 MB; this is larger than GitHub's recommended maximum file size of 50.00 MB        
To github.com:CareyLabVT/SCCData.git
   0ef25fb..f4cd663  daily-email -> daily-email
Already up to date.
Loading required package: methods

Attaching package: ‘lubridate’

The following object is masked from ‘package:base’:

    date

trying URL 'https://github.com/CareyLabVT/SCCData/raw/carina-data/FCRmet.csv'
Content type 'text/plain; charset=utf-8' length 71596733 bytes (68.3 MB)
==================================================
downloaded 68.3 MB

trying URL 'https://github.com/CareyLabVT/SCCData/raw/mia-data/Catwalk.csv'
Content type 'text/plain; charset=utf-8' length 12789669 bytes (12.2 MB)
==================================================
downloaded 12.2 MB

trying URL 'https://github.com/CareyLabVT/SCCData/raw/diana-data/FCRweir.csv'
Content type 'text/plain; charset=utf-8' length 118005 bytes (115 KB)
==================================================
downloaded 115 KB

null device 
          1 
null device 
          1 
null device 
          1 
[daily-email be1c33d] 05/15/19 06:27:01 EST -0500: Sensor Check
 7 files changed, 1618 insertions(+)
 create mode 100644 CatwalkDataFigures_2019-05-15.pdf
 create mode 100644 MetDataFigures_2019-05-15.pdf
 create mode 100644 WeirDataFigures_2019-05-15.pdf
remote: warning: GH001: Large files detected. You may want to try Git Large File Storage - https://git-lfs.github.com.        
remote: warning: See http://git.io/iEPt8g for more information.        
remote: warning: File FCRmet.csv is 68.28 MB; this is larger than GitHub's recommended maximum file size of 50.00 MB        
To github.com:CareyLabVT/SCCData.git
   7ddf47b..be1c33d  daily-email -> daily-email
Already up to date.
Loading required package: methods

Attaching package: ‘lubridate’

The following object is masked from ‘package:base’:

    date

trying URL 'https://github.com/CareyLabVT/SCCData/raw/carina-data/FCRmet.csv'
Content type 'text/plain; charset=utf-8' length 71773507 bytes (68.4 MB)
==================================================
downloaded 68.4 MB

trying URL 'https://github.com/CareyLabVT/SCCData/raw/mia-data/Catwalk.csv'
Content type 'text/plain; charset=utf-8' length 12831442 bytes (12.2 MB)
==================================================
downloaded 12.2 MB

trying URL 'https://github.com/CareyLabVT/SCCData/raw/diana-data/FCRweir.csv'
Content type 'text/plain; charset=utf-8' length 118005 bytes (115 KB)
==================================================
downloaded 115 KB

null device 
          1 
null device 
          1 
null device 
          1 
[daily-email f2e660e] 05/16/19 06:27:01 EST -0500: Sensor Check
 7 files changed, 1619 insertions(+)
 create mode 100644 CatwalkDataFigures_2019-05-16.pdf
 create mode 100644 MetDataFigures_2019-05-16.pdf
 create mode 100644 WeirDataFigures_2019-05-16.pdf
remote: warning: GH001: Large files detected. You may want to try Git Large File Storage - https://git-lfs.github.com.        
remote: warning: See http://git.io/iEPt8g for more information.        
remote: warning: File FCRmet.csv is 68.45 MB; this is larger than GitHub's recommended maximum file size of 50.00 MB        
To github.com:CareyLabVT/SCCData.git
   18a197c..f2e660e  daily-email -> daily-email
Already up to date.
Loading required package: methods

Attaching package: ‘lubridate’

The following object is masked from ‘package:base’:

    date

trying URL 'https://github.com/CareyLabVT/SCCData/raw/carina-data/FCRmet.csv'
Content type 'text/plain; charset=utf-8' length 71950597 bytes (68.6 MB)
==================================================
downloaded 68.6 MB

trying URL 'https://github.com/CareyLabVT/SCCData/raw/mia-data/Catwalk.csv'
Content type 'text/plain; charset=utf-8' length 12873164 bytes (12.3 MB)
==================================================
downloaded 12.3 MB

trying URL 'https://github.com/CareyLabVT/SCCData/raw/diana-data/FCRweir.csv'
Content type 'text/plain; charset=utf-8' length 131324 bytes (128 KB)
==================================================
downloaded 128 KB

null device 
          1 
null device 
          1 
null device 
          1 
[daily-email f2c6654] 05/17/19 06:27:01 EST -0500: Sensor Check
 8 files changed, 1850 insertions(+)
 create mode 100644 CatwalkDataFigures_2019-05-17.pdf
 create mode 100644 MetDataFigures_2019-05-17.pdf
 create mode 100644 WeirDataFigures_2019-05-17.pdf
remote: warning: GH001: Large files detected. You may want to try Git Large File Storage - https://git-lfs.github.com.        
remote: warning: See http://git.io/iEPt8g for more information.        
remote: warning: File FCRmet.csv is 68.62 MB; this is larger than GitHub's recommended maximum file size of 50.00 MB        
To github.com:CareyLabVT/SCCData.git
   ab4c895..f2c6654  daily-email -> daily-email
Already up to date.
Loading required package: methods

Attaching package: ‘lubridate’

The following object is masked from ‘package:base’:

    date

trying URL 'https://github.com/CareyLabVT/SCCData/raw/carina-data/FCRmet.csv'
Content type 'text/plain; charset=utf-8' length 72127157 bytes (68.8 MB)
==================================================
downloaded 68.8 MB

trying URL 'https://github.com/CareyLabVT/SCCData/raw/mia-data/Catwalk.csv'
Content type 'text/plain; charset=utf-8' length 12914814 bytes (12.3 MB)
==================================================
downloaded 12.3 MB

trying URL 'https://github.com/CareyLabVT/SCCData/raw/diana-data/FCRweir.csv'
